,season,episode,character,line
227,4,5,Mr Harris,"[with a stammer] Well, I want to announce that I may have found the dream boy of the decade. He's sexy, sassy, and full of spunk. His name is Timmy."
228,4,5,Timmy Burch,"TIMMMIHH, tih, Timmih?"
229,4,5,NAMBLA Leader,"Wuhell, members, I know we're all eager to get acquainted with our new partners and, so why don't we turn down the lights and start to dance! [the DJ starts the music again, and the boys and their partners take the dance floor. Stan and Kyle stay in their seats, as do Cartman and his partner.]"
230,4,5,Lead Agent,"Alright, I want those perverted bastards all taken in. Got it?"
231,4,5,Agents,Got it!
232,4,5,Dr. Mephesto,"[Kevin at his side] Hello, NAMBLA members. As the South Park representative- [the doors fly open and the FBI agents fill the room]"
233,4,5,Lead Agent,[heading for Mephesto] Hold it right there!
234,4,5,Agent 1,Freeze!
235,4,5,Agent 2,Don't nobody move!
236,4,5,Dr. Mephesto,What's going on? [four rifles and a shotgun are pointed at him]
237,4,5,Lead Agent,"Alright, sickos. Where are the children?! [the NAMBLA members look at each other confused]"
238,4,5,Dr. Mephesto,What children?
239,4,5,Lead Agent,"This... is... NAMBLA, right?"
240,4,5,Dr. Mephesto,Yes.
241,4,5,Lead Agent,The North American Man/Boy Love Association?
242,4,5,Dr. Mephesto,"[startled] What? No! [Points to the banner behind him] We're the North American Marlon Brando Look-Alikes. [a shot of the members is shown, and many of them do look like Marlon Brando]"
243,4,5,Blond Agent,"Aw, crap! We got the wrong NAMBLA."
244,4,5,Mr Garrison,"Aw, damnit, I'm in the wrong place. [gets up and walks out]"
245,4,5,Dr. Mephesto,Don't tell me that that other NAMBLA is actually in South Park?!
246,4,5,Lead Agent,You know of them?
247,4,5,Blond Member,Know of them? We've been fighting with them for years over the rights to nambla.com!
248,4,5,Brunet Member,"Yeah, those perverted bastards!"
249,4,5,Blond Agent,Wow. You guys really do look a lot like Marlon Brando.
250,4,5,Dr. Mephesto,"Thank you. Now, let's go get those other NAMBLA bastards before they hurt any of South Park's children!"
251,4,5,Members of North American Man-Boy Love Association,Yeah! Yeah!
252,4,5,Black Member,And let's kick their asses for stealin' our domain name!
253,4,5,Members of North American Man-Boy Love Association,Yeah! Yeah! Yeah!
254,4,5,NAMBLA Leader,"[Cartman stands next to him] Alright, members, that's enough of that. [the music is stopped] It's time for all of us to retire to our respective rooms, and get to know our new young boys. [NAMBLA members rub their hands react lustily]"
255,4,5,Member 3,All right.
256,4,5,Member 4,Alright.
257,4,5,Kyle Broflovski,Dude. Being mature is boring!
258,4,5,Stan Marsh,Yeah.
259,4,5,NAMBLA Leader,"Everyone come up and grab your room keys and we'll head upstairs, hm hm."
260,4,5,The Boys,Aaaaah! [all pour out into the hallway]
261,4,5,Stan Marsh,Dude! I think these guys mean to have sexual encounters with us!
262,4,5,Kyle Broflovski,"I know, dude! Let's get the hell out of here! [music resumes. All the boys turn and head for the stairs, only to see shadows moving up the wall, and they stop in their tracks]"
263,4,5,Stan Marsh,"Aah! There's more of them! Quick, hide! [the boys run into room 1A. Mephesto shows up and leads the other look-alikes onto the hallway]"
264,4,5,Dr. Mephesto,"Alright, Marlon Brandos, they've got to be here somewhere. Let's try this room. [they enter 2E. The FBI then arrives amid much commotion]"
265,4,5,Lead Agent,"Let's get those perverts! [the agents fan out and enter all rooms except 1A and 2E. A waiter heads for the stairs with a tray, but naked NAMBLA members pour out of their rooms and startle him. The tray flies off his hand]"
266,4,5,Waiter,Sacrebleu! [picks up the tray and heads back to the room he left. The NAMBLA members go into 1A]
267,4,5,The Boys,Whoa! [pour out of 1A and head down the hall to 2E. The door there opens and the Marlon Brandos peek out]
268,4,5,The Boys and The Brandos,"Aaah! [the boys run to 1E, the Brandos go back into 2E, and the doors to both are shut]"
269,4,5,Mrs McCormick,"[enters the hallway from the stairs] Kenny, no! Leave me alone [heads into 1C]"
270,4,5,Kenny McCormick,"(Come here, mom! Let me get it!) [follows her in. The agents pour out of the rooms and switch places, again avoiding 1A and 2E. Stuart arrives and looks around]"
271,4,5,Stuart McCormick,Kenny?? [enters 2C. The waiter again heads for the stairs with the tray]
272,4,5,Waiter,"Zis time, I will not drop zeh food. [makes it to the top of the stairs, but drops the tray when the NAMBLA members exit 1A] Allo!"
273,4,5,NAMBLA Leader,It's clear. The cops are gone. Where's the boys?! [the NAMBLA members enter 2A]
274,4,5,Waiter,"[picks up the tray and goes back down the hall, angrily] Sacre bleu! [the door to 2E opens and the Marlon Brandos step out]"
275,4,5,Dr. Mephesto,I think the boys went in here. [the Brandos enter 1E]
276,4,5,The Boys,[all exit 1E] Aaaaaah!
277,4,5,Timmy Burch,Timmih! [all enter 2D. A poodle on a ball exits 1C and enters 2D. The NAMBLA members exit 2A and head for 1C]
278,4,5,NAMBLA Leader,Maybe the boys are in here. Oh bo-oys? [the NAMBLA members enter 1C. Kenny's mom and Kenny exit 1C]
279,4,5,Mrs McCormick,"Kenny, GIVE IT UP!"
280,4,5,Kenny McCormick,"(Come on!) [both enter 2C. The waiter heads for the stairs again with the tray, but Marlon Brandos and FBI agents pour out of 1E]"
281,4,5,Waiter,[falls backwards] Waaah!
282,4,5,Lead Agent,"Alright, you're under arrest!"
283,4,5,Dr. Mephesto,No! You've got the wrong NAMBLA again!
284,4,5,Lead Agent,Damnit!
285,4,5,Agent,"Hey, we didn't try that room! [Brandos and agents head for 2A and enter. Two guys in vintage bikes ride across from 2D to 1D]"
286,4,5,Waiter,"[exasperated, gets up with the tray] Sacre bleu. [walks away, having given up on the stairs]"
287,4,5,Kyle Broflovski,[panting] Dude! We're surrounded by perverts.
288,4,5,Eric Cartman,They're all over the place.
289,4,5,Timmy Burch,Timmiihhh!
290,4,5,Token Black,[Token joins the group] What are we gonna do?!
291,4,5,Stan Marsh,"Well, Cartman, you got everybody into this, you have to figure out a way to get everybody out."
292,4,5,The Boys,Yeah.
293,4,5,Eric Cartman,"Uuh, that's, that's fine. I know how to get us out."
294,4,5,Kyle Broflovski,How?
295,4,5,Eric Cartman,"Well, look. Those perverts aren't going to rest until they've made love to one of us. Right? So,... somebody's just gonna have to go out there and... take one for the team. [the other boys are shocked at the thought] And I think, in all fairness, it should be Butters. [presents him]"
296,4,5,Butters Stotch,"Huh?? Uh-uh well, huh, why me?"
297,4,5,Eric Cartman,"Now, are you a team player or not?!"
298,4,5,Butters Stotch,"Well, sure, u-uh I'm a team player-uh, I guess."
299,4,5,Eric Cartman,"Well, Butters, there is no I in ""team."""
300,4,5,Butters Stotch,Huh-you mean to expect me to go out there and let all those... huhu-horny old men... have their way with my fragile person?? Well just what team is this anyway?!
301,4,5,Eric Cartman,"Just go, Butters. We're running out of time."
302,4,5,Butters Stotch,Well uuh-uuh-alright then. [heads for the door. Stan sees him out and Cartman closes the door]
303,4,5,Eric Cartman,"Heh, he's such a dumba-a-ass."
304,4,5,Butters Stotch,"Well, alright men. Here, here I come. [puts his hands over his eyes and moves across the hall] I'm ready to take one for the team. [enters 1D.]"
305,4,5,Stuart McCormick,"[exits 2D] Kenny?! Kenny, I've had enough of your shenanigans! [enters 1E]"
306,4,5,NAMBLA Leader,"[inside 1E] Oh, one of the boys just came in. [the members surround him and being their activity...]"
307,4,5,Stuart McCormick,"What the-? No, wait, no, WAH, NO, WAAAAAH! [Butters steps out of 1D, listens in at the door to 1E, turns around and walks away.]"
308,4,5,Mrs McCormick,"[voice shaking, approaches] Are you alright, Stuart?"
309,4,5,Stuart McCormick,"[sobbing] Don't touch me! I've had my nuts broken, body poisoned, have been made love to in the ass by three dozen 40-year-old men—I just wanna go home and take a, a hot bath! [the NAMBLA members are in cuffs]"
310,4,5,Lead Agent,"[to NAMBLA Leader] We've been after you for a long time, buddy! Do you know your rights?"
311,4,5,NAMBLA Leader,"Rights? Does anybody know their rights? You see, I've learned something today. [Stan and Kyle look at each other] Our forefathers came to this country because... they believed in an idea. An idea called ""freedom."" They wanted to live in a place where a group couldn't be prosecuted for their beliefs. Where a person can live the way he chooses to live. [Stan, Kyle, and Cartman look at each other] You see us as being perverted because we're different from you. People are afraid of us, because they don't understand. And sometimes it's easier to persecute than to understand. [Stan and Kyle look at each other, then at the NAMBLA leader]"
312,4,5,Kyle Broflovski,Dude. You have sex with children.
313,4,5,NAMBLA Leader,"We are human. Most of us didn't even choose to be attracted to young boys. We were born that way. We can't help the way we are, and if you all can't understand that, well, then, I guess you'll just have to put us away. [shots of the agents, then the Brando look-alikes, then Stan and Kyle, who look at each other, then at the NAMBLA leader]"
314,4,5,Kyle Broflovski,"[slowly, for emphasis] Dude. You have sex with children."
315,4,5,Stan Marsh,"Yeah. You know, we believe in equality for everybody, and tolerance, and all that gay stuff, but dude, fuck you."
316,4,5,Kyle Broflovski,Seriously.
317,4,5,Lead Agent,"Alright, that's enough. You're all going to be put away for a long time. [The agents escort the NAMBLA members away. The members groan. The boys gather around Stan, Kyle, and Cartman]"
318,4,5,Kyle Broflovski,"Well, Cartman?"
319,4,5,Eric Cartman,"Well, what?"
320,4,5,Kyle Broflovski,Don't you think you owe everyone an apology for bringing NAMBLA here?
321,4,5,The Boys,Yeah!
322,4,5,Eric Cartman,"Alright, alright, I'm sorry I almost got you guys all raped. There."
323,4,5,Stan Marsh,"And now, do you still think that you need to hang out with older, mature friends?"
324,4,5,Eric Cartman,"No, I guess you guys will blossom into maturity someday. Just don't take too long. [the paramedics finish putting Stuart into the ambulance and head for the cab]"
325,4,5,Paramedic,"Okay, let's roll. [the siren goes on. The ambulance goes into reverse and crushes Kenny under its rear wheels, then speeds off]"
326,4,5,A Nurse,"[voice-over] Dr. Flores, dial 18-"
327,4,5,Stuart McCormick,"Coo, cootchy-coo, coohoohoohoo, cootchy-coo."
328,4,5,Mrs McCormick,"Our little angel, yes."
329,4,5,Stuart McCormick,"Oh, he's so beautiful. I know it's been hard on both of us losing poor Kenny. But this new baby kind of reminds me of him. [a shot of the baby reveals a boy in a little orange parka with the hood tight on his face, like Kenny before him]"
330,4,5,Mrs McCormick,What should we name him?
331,4,5,Stuart McCormick,"Well, seeing as though Kenny passed away, maybe we should name him ah,... Kenny."
332,4,5,Mrs McCormick,"Yes. Kenny's such a great name. My little Kenny, a brand-new Kenny. (The new Kenny then mumbles)"
333,4,5,Stuart McCormick,"God, this must be the fiftieth time this has happened."
334,4,5,Mrs McCormick,Fifty-second.
