,season,episode,character,line
266,4,10,God,What brings you here? Do you wish to mount your unholy war against heaven?
267,4,10,Satan,"No, I have a problem, and I... need your advice."
268,4,10,God,You want to rule more than hell? You want to destroy the Earth?
269,4,10,Satan,"No, it's kind of a long story but, well, it all started when this Iraqi dictator, Saddam Hussein, [God scratches behind his left ear] was killed by a pack of wild boars. I remember when I first met him in hell. It was a lovely morning in April..."
270,4,10,Eric Cartman,"Hallelujah! Praise the Lord! And now, I'm receiving a message directly from God-uh! God is telling me that... each and every one of you is to walk up to the stage, and give me one dollar! [The clapping stops as confused faces appear in the congregation, and the music quiets a bit. Stan and Kyle look at each other as Cartman goes for the collection box] So I want everyone to feel the love of God by coming up heah, [sets the box at center stage] and putting a dollar in the box-ah! [kids begin to approach the stage] Come on, don't be shy! Come on now! [rolls on his back as the donations come in]"
271,4,10,Stan Marsh,"Dude, that seems kind of... weird."
272,4,10,Kyle Broflovski,Yeah. I don't remember him saying anything about this.
273,4,10,Satan,...And now Chris and Saddam just keep killing each other over and over and... I don't know which one to pick.
274,4,10,God,"[considers the story, then] Jesus, what the hell happened to you?"
275,4,10,Satan,Huh?
276,4,10,God,You got kicked out of here for being a headstrong rebel. And now you're a whiny little bitch.
277,4,10,Satan,"Well, I just don't know which one to pick."
278,4,10,God,"No, you've become dependent on relationships. So you haven't even considered the option of not being with either of them. [Satan listens] And if you're not sexually attracted to someone, you're not ever going to be. But Saddam isn't right either. He's the other extreme. You need to spend time alone so that you can find the balance, the middle ground. That's what I always do, because I'm a Buddhist."
279,4,10,Satan,"God, you're right. You know, I've had steady relationships for the last... thousand years, and when one ends I just start another one, but... I haven't taken the time to be secure with myself."
280,4,10,God,Bingo. [a fly gets near him and he snaps his tongue out to catch it and eat it]
281,4,10,Satan,"Hey... Thanks, God. I forgot how clear you make things sometimes."
282,4,10,God,"It was nice to see you again, Satan."
283,4,10,Satan,You too.
284,4,10,God,"Goodbye. [turns into the sphere of light and flies up and away. Satan turns and walks off, but encounters the Mormons]"
285,4,10,Mormon 2,Would you like to stay for some cookies and punch?
286,4,10,Mormon 1,"Yes, would you?"
287,4,10,Satan,"Uh, no, I need to be getting back."
288,4,10,Mormon 2,"Oh, alright then, but you're gonna miss our big play."
289,4,10,Mormon 4,Yes. We're going to do a play about how alcohol can ruin family life.
290,4,10,Satan,"Wow. That sounds great, but uh, I really  gotta go. [disappears in a burst of flames]"
291,4,10,Mormon 1,"Well, he seemed like a nice fellow."
292,4,10,Mormon 4,Yes. [a few seconds of silence follow]
293,4,10,Mormon 2,Let's go make things out of egg cartons.
294,4,10,Mormons In Heaven,"[ad lib] Oooh, yeah. I'll do that."
295,4,10,Eric Cartman,"[offscreen] Yeess. [the camera looks at him, now rolling around shirtless in $1 bills, now grabbing a bunch and bathing in them] Yeess. [sees Stan and Kyle] It worked, you guys, it actually worked!"
296,4,10,Stan Marsh,What worked?
297,4,10,Eric Cartman,Eh-everybody bought the whole act! They keep giving and giving until we have it all!
298,4,10,Stan Kyle,What?
299,4,10,Kyle Broflovski,You're keeping that money yourself?
300,4,10,Eric Cartman,"Of course, you guys! And then we can make... ten million dollars! [grins big] Look, the tooth fairy thing didn't work, the boy band thing didn't last, so I tried this route."
301,4,10,Stan Marsh,Wait-wait-wait-wait-wait. You mean that this whole thing has just been a way for you to make ten million dollars?
302,4,10,Eric Cartman,"It all came to me days ago, when we were first in Sunday school."
303,4,10,Stan Marsh,"[he and Kyle are now angry] Well, what about going to hell and all that?!"
304,4,10,Eric Cartman,"Dude, if God is all-understanding, he wouldn't send us to hell. Even Sister Anne told me that."
305,4,10,Kyle Broflovski,[points] Then why didn't you tell us?!
306,4,10,Eric Cartman,"My brain is of a much larger size than you guys's. I couldn't expect you to understand, not until you actually saw the cash flow!"
307,4,10,Kyle Broflovski,The only thing of yours that's larger in size is your big fat ass!
308,4,10,Eric Cartman,[rolls around in the money] Suck my balls!
309,4,10,Stan Marsh,"Dude, I an so disillusioned right now."
310,4,10,Saddam,"Die, pussy! [smashes the brick on Chris's head, and they both fall]"
311,4,10,Chris,"Ow..! [gets up, grabs one of Saddam's legs, and pulls it off]"
312,4,10,Saddam,"Aagghh! [gets up, grabs his leg back and beats Chris over the back with it. Chris falls on his face]"
313,4,10,Chris,"Aagghh! [grabs one end of the leg, and now it's a tug of war. Satan arrives and sees the battle]"
314,4,10,Satan,"Guys, guys, guys! [the two rivals stop and face him] Look, you both can stop fighting now! I've made a decision."
315,4,10,Chris,You have?
316,4,10,Satan,Yes. I... don't want to be with either one of you.
317,4,10,Chris Saddam,What?!
318,4,10,Satan,"Saddam, you're an asshole. And you'll never be the friend that I want. And Chris, well, you're a pussy. And you'll never be the lover I want. [Chris looks dejected] So I'm just gonna be alone for a while and learn to like myself. [Saddam sighs]"
319,4,10,Chris,Satan. Can we go for a walk in the park?
320,4,10,Satan,"No, I'm not going on a walk! You're a pussy, Chris, and you drive me crazy; go away!"
321,4,10,Chris,Fine. [walks away]
322,4,10,Saddam,"Hell, you can't leave me, Satan! I won't let you! [Satan is shocked]"
323,4,10,Eric Cartman,Today is another day! And that's another dollar the Lord needs from you-uh! So come on up and give to the Lord-uh! [Sister Anne enters the church]
324,4,10,Sister Anne,"[walking down center aisle] Alright kids, it's time to go. It's time for this to stop!"
325,4,10,Eric Cartman,Sister Anne is a blasphemer!
326,4,10,Sister Anne,I know you won't listen to me. That's why I brought somebody else. [steps aside. The curtains part. Jesus enters and walks down the aisle]
327,4,10,Kids,[in obvious awe] Wow!
328,4,10,Butters Stotch,Jesus!
329,4,10,Eric Cartman,[worried] Uh-oh.
330,4,10,Jesus,"Kids, you need to all stop spending all your time here and go back to school."
331,4,10,Eric Cartman,"[tugs on Jesus' robs, then softly] Jesus, ix-nay on the ool-schay."
332,4,10,Jesus,"God doesn't want you to spend all your time being afraid of hell, or praising His name. God wants you to spend your time helping others, and living a good, happy life. That's how you live for Him."
333,4,10,Eric Cartman,"[goes for the collection box again] Ee-yes, by doing that, [brings it out] and, putting a dollar in the box-uh!"
334,4,10,Bebe Stevens,Let's go ice-skating.
335,4,10,Girls,Yea! [leave their seats]
336,4,10,Butters Stotch,"Uh, we can help Timmy learn how to ice-skate, too."
337,4,10,Boy wearing glasses,Yeah. [others leave their seats and vacate the church]
338,4,10,Eric Cartman,"[on his knees] No, come back! You face everlasting damnation! [the last congregant leaves the church] Wait! No! No! [pounds the floor with his fists a few times] I can't be cheated out of my ten million dollars again! God damnit!"
339,4,10,Kyle Broflovski,"Serves you right, Cartman!"
340,4,10,Stan Marsh,Yeah!
341,4,10,Jesus,"But Eric, I think this time I have to teach you a lesson. I'm sending you somewhere to think about your sins!"
342,4,10,Eric Cartman,You're gonna send me to hell?
343,4,10,Jesus,No. Worse!
344,4,10,Kenny McCormick,[rushes up to him] (Eric! Eric!)
345,4,10,Eric Cartman,"[sees Kenny] Aw, crap!"
346,4,10,Satan,"[encounters two men] Hi, Bob. Hi, Rick."
347,4,10,Rick,"Hi, Satan."
348,4,10,Saddam,[waiting in the road] There you are!
349,4,10,Satan,[rolls his eyes] Awgh... Not again.
350,4,10,Saddam,You know you can't live without me. Now get that ass back to bed!
351,4,10,Satan,"Saddam, I told you, I don't need you anymore!"
352,4,10,Saddam,"You can't leave me, Satan. Nobody leaves me."
353,4,10,Satan,"Yes, I can! Raaarrr! [blasts a hole through Saddam with lightning from his index finger. Saddam falls]"
354,4,10,Saddam,"Aw, you little..prick!"
355,4,10,Satan,"Goodbye forever, Saddam!"
356,4,10,Saddam,"[coughs] What are you talking about? You can kill me, but I'll be back tomorrow."
357,4,10,Satan,Not this time. I asked a favor of an old friend of mine to let you in.
358,4,10,Saddam,Let me in where? [flames engulf Saddam and disappears]
359,4,10,Saddam,"What the..? Hey, what the hell is this place?!"
360,4,10,Mormon 5,"Hello, and welcome."
361,4,10,Mormon 1,"We're glad you made it, brother."
362,4,10,Saddam,"Ey, who the hell are you?"
363,4,10,Mormon 6,"We're just about to do a play, about how much stealing hurts you deep inside. Come join us. [he and others crowd in on Saddam]"
364,4,10,Mormons In Heaven,[ad lib] Yes. Come on. Let's go.
365,4,10,Mormon 6,You're here forever. [the Mormons lift him up and carry him away over their heads]
366,4,10,Saddam,Nooo! N-nooooooooooo!
