,season,episode,character,line
260,4,4,Soldier,Good. And then hand them the Easter eggs filled with tear gas. Are you ready?
261,4,4,Janet Reno,Ready.
262,4,4,Soldier,Code blue!
263,4,4,Janet Reno,Code blue! [drops down onto the yard]
264,4,4,Music Instructor,"Lad, we would like very much to have you here at the Romanian Music School."
265,4,4,Kenny McCormick,(Woohoo!)
266,4,4,Mrs McCormick,How much is all this gonna cost?
267,4,4,Music Instructor,"Don't worry, Ms. McCormick, Romania is very poor country. Apartment is cheap. Food is cheap, Everything is cheap because we are so God-damned poor."
268,4,4,Assistant,"Yes, your two hundred American dollars will last months here."
269,4,4,Mrs McCormick,"Wow, what a great country. Everybody's poor, like us."
270,4,4,Kenny McCormick,(Yeah.)
271,4,4,Janet Reno,"[enters the kitchen through the back door] Hello, girls. I'm the Easter bunny. [sees nothing but furniture before her. She pulls out a an assault rifle with scope and silencer then moves forth] Happy Easter, kids. Come see what I brought for ya. [Stan, his parents, and the quints watch TV in the living room, and Janet Reno peeks at them. Terrance and Phillip are heard on the TV. Janet Reno pulls back and flattens herself against the kitchen wall]"
272,4,4,Phillip,"Hey, Terrance, I think I have to fart. [Reno pulls out an Easter egg and throws it at the girls. It ends up right in front of them]"
273,4,4,Terrance,"Wait. Before you do, pull my thumb."
274,4,4,Quint 2,"Oh, look. An Easter egg."
275,4,4,Randy Marsh,"Oh, shi- [the Easter egg unleashes its tear gas, and all cough and choke]"
276,4,4,Lead Soldier,"That's it. Let's move, move move move, move! [breaks through the front door and leads the other police officers in.] Give us the kids, now! Now!"
277,4,4,Officer 1,Down on the floor. Get down on the God-damned floor! [more officers stream in as Sharon drops down to the floor and assumes the fetal position]
278,4,4,Officer 2,Find them!
279,4,4,Janet Reno,[bursts through the master bedroom door] This is a bust! Hand over the quints! [police officers are already there looking for them under the bed and in dresser drawers. Reno joins them and heads for the closet. She opens a sliding door and finds Randy holding Stan in his arms and points her weapon at them thus comically recreating the famous image of the US Border Patrol agent pointing his MP5 submachine gun at six year old Elian Gonzalez held by his rescuer Donato Dalrymple] Hand over the children! Happy Easter. Hand over the children!!
280,4,4,Grandpa Marvin Marsh,[rolls in] What the hell's goin' on?! [all guns point to him]
281,4,4,Officer 3,"Freeze, asshole!"
282,4,4,Grandpa Marvin Marsh,"Aw, go ahead and shoot me! I dare ya!"
283,4,4,Officer 3,"Don't push me, man!"
284,4,4,Grandpa Marvin Marsh,"Pull the trigger, you little pussy!"
285,4,4,Officer 3,Gaahhh! [aims away from Grandpa and lets loose with gunfire]
286,4,4,Officer 4,Gun! Gun! [fires into the room. Reno drops down to avoid getting hit. Bullets riddle the wall]
287,4,4,Janet Reno,"Down! Down! [outside, the protesters back away from the house]"
288,4,4,Protester,Riot! Riot! [protesters now move forward against a wall of police]
289,4,4,Officer 5,"Pepper spray! Pepper spray! [the police harden their line, pull out their cans and spray the protesters, who drop down immediately coughing. The house blows up. When the smoke clears, Reno and two officers are seen carrying the quints away. They reach a black van and toss the girls inside.]"
290,4,4,Officer 6,"Go ahead! In the van! [Reno goes in, followed by the other officers. One of them barks an order to the driver, and the van leaves the scene.]"
291,4,4,Stan Marsh,"[standing in front of the still burning ruins of his house] Dammit, now I'm never gonna have my own circus!"
292,4,4,Music Instructor,"Oh, your son is so talented, Ms. McCormick. The people of Romania love him."
293,4,4,Mrs McCormick,"Good job, Kenny."
294,4,4,Music Instructor,"Mrs. McCormick, we would love for you and your son to stay here in Romania, with us. Will you consider it?"
295,4,4,Mrs McCormick,"[She kneels down and places her hand on Kenny's head] Well, what do you think, Kenny? You'd have to leave your friends and your family behind."
296,4,4,Kenny McCormick,(Sure!)
297,4,4,Music Instructor,Alright!
298,4,4,Sharon Marsh,"Oh, Randy, it's gone! It's all gone!"
299,4,4,Eric Cartman,"[arrives with Kyle] Dude, what the hell happened?"
300,4,4,Stan Marsh,The government came and got the quintuplets. No more Cirque du Cheville for us.
301,4,4,Kyle Broflovski,"Damnit! How come every time we get a sweet idea, the government has to screw it up?!"
302,4,4,Stan Marsh,"Yeah! Well, not this time!"
303,4,4,Eric Cartman,Huh?
304,4,4,Stan Marsh,"We've just gotta get that angry mob back on our side! [addresses the mob] Alright, everybody, listen up! Those bastards broke in here and took those poor quintuplets to the mayor's office downtown! But they haven't won yet! I say we all go over to the mayor's office, and demand to see the quintuplets right now!"
305,4,4,Protester 1,Hmm.
306,4,4,Protester 2,Yeaahh.
307,4,4,Protester 3,I don't know. I usually like to stop protesting by 5:30.
308,4,4,Protester 4,"Yeah, ah, do we get overtime for this?"
309,4,4,Stan Marsh,"Uh, sure, you can all get overtime."
310,4,4,Protester 5,Alright! [Fist pumps]
311,4,4,Protester 6,Yeah!
312,4,4,Protester 7,Down with Japan! [the mob moves away]
313,4,4,Janet Reno,"Alright. We just need to get a few more pictures of the girls reunited with their father so everyone knows they're happy. [The girls are shown with their grinning father. Two of them sit on his laps, the other three stand in front]"
314,4,4,Photographer,"Come on, girls. Smile. [the girls look downcast] We want you to look happy. Smile. [works a sock puppet on his left hand] Look at the silly frog. Who's got the silly frog? Look at him. I've got- Look at him. It's so silly. ""I'm so silly."" [the girls still have their eyes cast down]"
315,4,4,Stuart and Mrs. McCormick,"Ah, hello? This is Kenny's dad, back in America. I miss my son very much. I would like to see him returned to me so that the U.S. government will buy me a new car and- [the butt of a rifle strikes the side of his head] Ow! I mean, bec- because I miss my son very much. [looks to his right] Man."
316,4,4,Stan Marsh,Hey! We wanna see the quintuplets!
317,4,4,Soldier,"[Holds out hand to stop their progress] You can't see them, boys. They're happily reunited with their father."
318,4,4,Stan Marsh,"[whistles a signal] Come on, angry mob! [the mob appears behind him. All of them move forward and overrun the checkpoint. A lagging protester runs over a fallen soldier]"
319,4,4,Soldier,Aaa-a-a-aaa-ah.
320,4,4,Romanian Official,"[the bearded one] Alright, it is time for us to return to Romania."
321,4,4,Janet Reno,[hears something] What is that?
322,4,4,Officer 7,[at a window] It's the protesters. They're back.
323,4,4,Janet Reno,God-damnit! [Puts back on her Easter Bunny 'helmet'] We'll take care of them. Come on!  [leaves the office]
324,4,4,Officer 8,Let's move. Move!
325,4,4,Officer 7,"Come on, come on, come on."
326,4,4,Officer 9,"Come oonn, come oonn. [they follow Reno out, leaving the quints alone in front of a poster that reads ""Join the Army...  It's KILLER!!!"". The officers engage the protesters on a runway]"
327,4,4,Officer 1,This is government property!
328,4,4,Protester,Let the quints stay! [Reno and Sharon head for each other]
329,4,4,Sharon Marsh,"You ruined my house! [lays out Reno using a baseball bat to the Bunny helmet. The quints look out the window, then turn around. Quint 2 hops off the bench and walks to the office phone]"
330,4,4,Quint 1,"What are you doing, Nadia?"
331,4,4,Nadia,I'm calling the only person in the vorld who can help us. [picks up the receiver and starts dialing. The other girls look at each other.]
332,4,4,Eric Cartman,Take that! [kicks an officer on the shin]
333,4,4,Quint 3,[heads towards the battlefield and addresses everyone] Stop it! Stop it! Stop it! [the other four quints are with her. Weapons and signs are lowered]
334,4,4,Quint 1,All of you are acting like idiots!
335,4,4,Stan Marsh,Yeah.
336,4,4,Quint 1,None of you care about us. You only care about yourselves!
337,4,4,Quint 2,"Look at you, Father. You walked out on us five years ago [he removes his hat and holds it tight], and now you act like you miss us sooo much! You are a liar and a fake!"
338,4,4,Eric Cartman,"Yeah, you suck, dude!"
339,4,4,Quint 3,"And you Romanian leaders [both of them are there], you don't care about us! All you care about is making America look stupid!"
340,4,4,Eric Cartman,"Yeah! God, you guys are dicks!"
341,4,4,Quint 3,And you protesters! Don't you have anything better to do?! Get a life!
342,4,4,Eric Cartman,Yeah!
343,4,4,Quint 3,And you boys are the worst of all!
344,4,4,Stan Marsh,Huh?
345,4,4,Kyle Broflovski,Huh?
346,4,4,Eric Cartman,Huh?
347,4,4,Quint 3,"You know nothing about Romania, and yet you assume America is so much better! Maybe Romania isn't as nice as America, but it is our home! We are Romanian! All you care about is your own stupid circus! [at this point, a limousine pulls up behind them. It's from the Oprah show. The driver opens the back door and the girls head for the back seat]"
348,4,4,Janet Reno,"[has a protester in a headlock] Where are you going, girls?"
349,4,4,Quint 1,"The only place we can go. We're going on Oprah and then a book tour. [turns and climbs in, followed by three others]"
350,4,4,Quint 5,Yes. You can all kiss our little white Romanian asses! [wiggles her ass at the crowd and climbs in. The limo leaves and everyone is left in a state of shock.]
351,4,4,Stan Marsh,"Oh, well. Doing our own circus was a dumb idea anyways."
352,4,4,Eric Cartman,"Yeah, screw them!"
353,4,4,Kyle Broflovski,Kenny was never gonna get his singing right anyway.
354,4,4,Stan Marsh,Whatever happened to Kenny?
355,4,4,Romanian Protesters,Let Kenny stay! Let Kenny stay! Let Kenny stay! [a van pulls up and police officers all the way from the U.S. pour out]
356,4,4,Officer 1,"[sternly] Alright, people, the father wants his son returned to him! Hand him over to us!"
357,4,4,Romanian Protesters,Boooo!
358,4,4,Officer 2,"Shut up, Romanians! All right, let's go. Move move move move! [bursts through the front door. Officers pour in and look all over the place for Kenny. They enter the master bedroom, and look under the bed and in dresser drawers. One of them head for the closet and opens the sliding door and again the Elian Gonzalez scene is recreated with Kenny and his mother facing the police]"
359,4,4,Officer 3,"[seeing Mrs. McCormick holding Kenny] Hand over the boy, now!"
360,4,4,Mrs McCormick,"Okay, okay!"
361,4,4,Officer 3,"I mean it, lady, you've got about-! [his assault rifle goes off, riddling Kenny with bullets. His mom is distraught and drops Kenny] Whoops."
