,season,episode,character,line
258,17,4,"""Yes, I Am Scared!"" Host",And you didn't suspect anything when we had plants tell you to turn Goths and Vamp kids into Emos when really they're exactly the same thing?
259,17,4,Sarah and Harold/Howard Flannagan,I guess I should have figured it out. I'm an idiot. [laughs about it]
260,17,4,"""Yes, I Am Scared!"" Host","Tune in again next week, when we make a woman from Milwaukee think she's working at a haunted abortion clinic."
261,17,4,Henrietta,"So, my friends. Have you made the transformation?"
262,17,4,Pete,"Uhhhh, Henrietta, we have some bad news. The plants you think took over your body and made you emo? They're just plants. [she stops drawing] From Lowe's Home and Garden."
263,17,4,Michael,It was all a prank by some douchey network reality show.
264,17,4,Henrietta,"Nnnnoooo, there's an organic spore in my head that made me switch cliques so easily."
265,17,4,Michael,"No, you just kind of did it on your own."
266,17,4,Henrietta,"Oh my Gawd. [closes her eyes, drops her pen on the table, and pinches her nose at the bridge] This is so... em-barrassing."
267,17,4,Pete,"Ahh, hang on. What I meant to say was [flips his hair] we just infiltrated the Emo lair and... we torched the plant leader."
268,17,4,Henrietta,"Oh. [sudden relief] Oh! [she begiins convulsing, then turns around in her chair] Ihihit's meee-e! I'm, I'm I'm me again! [gets off her chair and walks to the boys] Oh my God I'm... all better. Thanks you guys."
269,17,4,Mrs Biggle,"[peeks into the room] Henrietta, I have dinner ready."
270,17,4,Henrietta,"Shut up, Mom! Leave me alone, you conformist bag of demon jizz!"
271,17,4,Mrs Biggle,...Fatty. [closes the door.]
