,season,episode,character,line
204,17,8,GRRM,I'll make some calls. I know a way to make sure you're completely prepared for Black Friday! [starts dialing]
205,17,8,President of Sony,"Sony PS4 no urazuke. Zenbu. Domo sumimasen. [""For your support of the Sony PS4, I would like to extend my sincere gratitude to all of you""]"
206,17,8,Sony Aide,The President of Sony bids you thanks for all your support of the PS4.
207,17,8,President of Sony,"Sore kara kono gifuto de Princess no Pawaa agemashou [""After that, let us give you this gift, the Power of the Princess""]"
208,17,8,Sony Aide,"He offers you this gift to once and for all make you an official Princess, and to give you the powers you need to win this war on Black Friday. [The president kneels, opens the box, and shows off the brooch resting within it. Kenny leaves the throne and takes the brooch from its box]"
209,17,8,President of Sony,"Ima kara [""From now on""]... Princess Kenny!"
210,17,8,Craig Tucker,"Wow, Kenny's a Japanese princess."
211,17,8,Kenny McCormick (and his narrator),"(Wooo!) [as J-pop music plays, Kenny's backyard is transformed. The makeshift thrown becomes a gazebo with a unicorn bust on top, Kenny gets a magical girl look, with big anime eyes, and gets the power of the rainbow, with bubbles, etc. He gets a pet unicorn. The whole scene could be an intro for a Princess Kenny show.]"
212,17,8,Guard 9,Oh God. We're done for!
213,17,8,Randy Marsh,"My friends, the time is almost here. Let us face these shoppers with the bravery of those mall security officers before us. [his phone rings and he picks up] Commander Marsh. ... They're what? ... They're gonna what?!"
214,17,8,Niles Lawson,"Tom, we have breaking news from the South Park mall. In an effort to make sure everyone is prepared, the mall has decided to push Black Friday by one week!"
215,17,8,Crowd,[turns and looks at him] What?
216,17,8,Niles Lawson,"The genius idea was proposed by George R. R. Martin, who also suggested ""Fuck it, let's push Thanksgiving to December 3rd."" For pushing the date, the mall is now reducing Black Friday prices to 96% off to the first hundred people inside the mall! [the shoppers begin to fight each other] This is going to be a fucking bloodbath, Tom. There will be medical tents, ambulances, face-painting, no doubt a lot of people you know and love are going to die! [an elderly man holding up a 96% off flier lets out a dragon's roar]"
