,season,episode,character,line
231,15,10,Mr Mackey,"Oh! Oh God! Oh God he killed himself! Eric Cartman killed himself! Did you see that? Oh why would he do it? [pulls out a letter] Oh wait uh here, here's a suicide note. Mkay. [opens it up and reads it:] Dear Guys, I just cannot go on mkay. I'm tired of being FAT, mkay, and I have to end it all. Mkay. -Eric Cartman."
232,15,10,Stan Marsh,"Please, can this wait? A big story is about to about to come out on Eavesdropper and we have the only way to stop it!"
233,15,10,Mr Mackey,"[thinks a moment] Well why the hell didn't you say so! Come on, let's go!"
234,15,10,Sparrow Prince,Go by car!
235,15,10,Singers,Go Lemmiwinks! Stop Wikileaks!
236,15,10,Frog King,"Quickly, while Lemmiwinks still has it in him!"
237,15,10,Singers,"Run, run, the battle's on! Wikileaks and Lemmiwinks. Run, run, the battle's on!"
238,15,10,Stan Marsh,"Stop right there, you little rat!"
239,15,10,Singers,"Go Lemmiwinks! Stop Wikileaks! Run, run, the battle's on! Wikileaks and Lemmiwinks. Go Lemmiwinks! Stop Wikileaks!"
240,15,10,Frog King,"[appears before Wikileaks and stops him] Wikileaks, you have chosen a path of evil and now you shall pay. Sparrow Prince, Catatafish! [Sparrow Prince and Catatafish descend on the shoebox and open it. Lemmiwinks peeks out, then leaves the box]"
241,15,10,Frog King,"Oh dude, he is fucking him up!"
242,15,10,Butters Stotch,Look! I think Lemmiwinks killed him! [Indeed. Lemmiwinks had bit Wikileaks on the jugular and Wikileaks is bleeding. Wikileaks soon stops moving and Lemmiwinks gets off him]
243,15,10,Frog King,He did it!
244,15,10,Mr Mackey,"[walks over to the computer and gets to work] Okay, let's just delete all this tabloid garbage, mkay."
245,15,10,Stan Marsh,Phew. I'm sure glad that's over with.
246,15,10,Kyle Broflovski,"Yeah, but you know? I think we all learned an important lesson about laughing at other people's misfortunes."
247,15,10,Eric Cartman,"Boy, I say."
248,15,10,Mr Mackey,"[rounds the corner and sees Cartman] Oh Eric! Uh, Eric, I know we kinda threw you under the bus, mkay, but I hope you understand the faculty didn't really have a choice."
249,15,10,Eric Cartman,It's okay Mr. Mackey. I'm totally over it.
250,15,10,Mr Mackey,"Well I think you're being very mature about this, Eric. It was an overly generous move to give all the faculty those cupcakes. I wanna thank you. Mkay."
251,15,10,Eric Cartman,"Oh, you're most certainly welcome."
252,15,10,Mr Mackey,"[walks through them and continues down the hallway] Well students, why don't we uh- [feels a pain in his stomach] Oooh. Oh, gee, uh..."
253,15,10,Eric Cartman,"Are you feeling okay, Mr. Mackey?"
254,15,10,Mr Mackey,"Yeah, I j-I just uh I'll be right back. Oh! [lets out a wet fart] Aaaah! Oh it's bad! [so bad bits of shit shoot out his pants onto the floor] Excuse me kids, I need to run, I gotta WUUGH! [that last movement made him fly into the ceiling and back to the floor] OW!"
255,15,10,Eric Cartman,[softly] I put a lot of Arby's horsey sauce on those.
256,15,10,Mr Mackey,"[stands up] Okay, can somebody get me some paper towels?? Or maybe a [poot. He hits the ceiling again and falls on his face] Ooowww, okay! [begins to slide down the hallway propelled by the poop and gas coming out his ass] Ooohhh, it's bad!"
257,15,10,Frog King,"Congratulations, Lemmiwinks."
258,15,10,Sparrow Prince,"Thanks to you, private lives will stay private."
259,15,10,Catatafish,"Yes, we are all free once again to make teenagers do bass to mouth."
260,15,10,Frog King,Just one question Lemmiwinks: How does it feel to have killed your own brother? [Lemmiwinks just gets up and walks away] Le-Lemmiwinks? [no answer] He's devastated.
261,15,10,Sparrow Prince,"Yup, he's devastated."
