,season,episode,character,line
180,15,2,Stan Marsh,Okay we got it! We got it! [the box must contain what the comedians wanted from the boys - Funnybot]
181,15,2,Adam Sandler,Get it to the platform! Hurry!
182,15,2,Adam Sandler,"Well, that does it. Things can finally get back to normal."
183,15,2,Stan Marsh,"Yeah, I'm sure glad that's over with."
184,15,2,Funnybot,Thank you boys for teaching me that comedy and logic do not go together.
185,15,2,Kyle Broflovski,"No problem, Funnybot."
186,15,2,Funnybot,I understand now that comedy should be left to the imperfect biological beings.
187,15,2,Token Black,"[walks to the rim and looks down] I can't believe it's finally over. [the camera goes deep into the ground and locates the ball, and something in it knocks three times]"
188,15,2,Tyler Perry,"[inside the ball] Oh Lerrrd, somebody turn on the light. What's goin' on? Hellowwer!"
189,15,2,President Obama,I am please to announce that the greatest threat to mankind is now gone forever. Justice has been done.
190,15,2,Token Black,"Thanks, everyone. Please tell me that you'll never do that again, Jimmy."
191,15,2,Jimmy Valmer,"Don't worry, fellas. I learned my lesson. I promise: there's not gonna be any comedy awards next year!"
192,15,2,Eric Cartman,[cryptically] Or will there be?
