,season,episode,character,line
1672,17,8,Narrator,"Now let me tell you, child, of a war that is about to come. [turns out the wall is the two consoles over which the war will be fought - the PS4 and the XBox - and the crow is on the display for the XBox One.] Since time unremembered there have been two. [the crow hops from the XBox One display to the PS4 display] One dark and unforgiving, the other pure and filled with light. [next is a silhouette of a woman looking at South Park Mall from a pile of rocks] At the dawn of war, I stand alone, looking out at would be the last battlefield, for winter is coming, and I... am a princess. [the woman is Princess Kenny] Once a common lady of the dark army, but, denied my right to be called princess by birth, [Kenny hops off the rocks and walks] I've betrayed my kind, [Kenny enters EVGames] and now I have chosen my side: that which I believe is best for all, [Kenny flips through the games and chooses Vomit Cops, then plays it] for it has the dual-shock controller with a speakers and a touchpad interface. [Kenny walks home] Our land is split in two, brother against brother, friend versus friend. [enters his house and walks past his parents] My parents will fight on Black Friday as well. For what? I do not know."
1673,17,8,Stuart McCormick,What the hell is he wearin' now?
1674,17,8,Narrator,"[walks out to the back yard and sits on her throne] My followers, though few in number, shall help see me through until I am finally accepted as a princess by all. I cannot rest, for I know that even now, the enemy is training for battle, also preparing for winter."
1675,17,8,Scott Malkinson,"En garde! [Butters takes up his sword and swordplay resumes. While the crowd cheers the swords-boys on, Cartman is not impressed, and he buries his nose in his hand while squeezing his eyes shut]"
1676,17,8,Eric Cartman,"Alright, stop, stop, stop! [leaves his chair and walks up to Scott and Butters] This is NOT how you fight! You think this is a joke?! On Black Friday, there's gonna be thousands of shoppers trying to get inside that mall keeping you from getting Xbox Ones! So what do we do?! We survey each enemy, and we attack their weak spots! Scott Malkinson has diabetes, so we hit him in his weak spot! [swings his staff at Scott's mouth and lands it, making Scott's tongue go back in his mouth]"
1677,17,8,Scott Malkinson,Aaah God ow sorry...
1678,17,8,Eric Cartman,"There's another army out there who thinks they're better than us, and we are not going to be beat by that traitor whore Kenny! Get back to training! [leaves]"
1679,17,8,Butters Stotch,"[not sure what to do next, then swats Scott on his back] Yeah!"
1680,17,8,Scott Malkinson,[falls onto his knees] Ah!
1681,17,8,Kyle Broflovski,"[catches up to Cartman] Cartman, we should probably talk about our chances."
1682,17,8,Eric Cartman,"The men are just inexperienced, Sir Kyle. They need more training."
1683,17,8,Kyle Broflovski,"It's not enough! Ever since Kenny switched sides, there are more kids that wanna go with PS4 on Black Friday."
1684,17,8,Eric Cartman,"That Goddamn traitor! You know why Kenny's doing this, right? Because he wanted to be a princess, and I wouldn't let him! [they go through the sliding door] I said, ""You can be a chick, Kenny, but there's only one ruler, and that's me!"" [reaches his refrigerator and opens it, looking for something to consume]"
1685,17,8,Kyle Broflovski,"Sony released the PS4s, Cartman. They're being reviewed. People are liking them."
1686,17,8,Eric Cartman,"[turns around, holding a glass of milk] I guarantee you Kenny had something to do with Sony offering a Brack Friday Bunduru! [takes a swig of it] Just keep them in training, Sir Kyle. Two can play at Kenny's backstabbing game. [leaves, forgetting to close the refrigerator door]"
1687,17,8,Eric Cartman,"Stupid asshole! [looks at a picture of himself and Kenny at Casa Bonita putting their arms around each other, with dreamy expressions, as they used to be best buds. He folds it up and lays it on his desk, face down] Yes, hello. I'd like to speak to the president of XBox, please... The president of XBox, like, the head of XBox... Fine, CEO of Microsoft, whatever. Put him on. I need help blowing up PlayStation people... Eric Cartman. I'm a wizard and a king... A wizard-king, yes... No, I'm not king of wizards, I'm a king that happens to be a wizard. [lost his patience] Just put the CEO of Microsoft on the phone!"
1688,17,8,Steve Ballmer's Secretary,"Mr. Ballmer, John and Dave from Marketing are here to see you. [the men come on in]"
1689,17,8,Steve Ballmer,"Yes, hello. How are things going out there?"
1690,17,8,John,"Sir, the tides of war are changing."
1691,17,8,Dave,"There's a king in Colorado, a young wizard who believes that Sony will have the upper hand if we do not come to his aid."
1692,17,8,John,"He claims that with our help, his followers are prepared to fight to the death over which system is better."
1693,17,8,Steve Ballmer,"Uhh, what are you guys talking about? You sound ridiculous."
1694,17,8,Dave,"[looks at John, then] There's... going to be a war in this small town on Black Friday, and it's all over the news!"
1695,17,8,Steve Ballmer,"Guys, these are console wars, not some epic battle for a kingdom. I mean, come on."
1696,17,8,Dave,"...but, this one kid said that he's a wizard, and that Sony is helping-"
1697,17,8,Steve Ballmer,"Guys, guys guys! It's just a video game machine, alright? Microsoft's a company that... tries to be above all the petty commercialism, okay?"
1698,17,8,Dave,Ok-Okay.
1699,17,8,John,Okay. [they turn and leave]
1700,17,8,Tom and Tammy Thompson,"Well, Black Friday is still a few days away, but it looks like it's already claimed another fatality."
1701,17,8,Tom and Tammy Thompson,"Niles Lawson is on the scene, and Niles, what are you hearing?"
1702,17,8,Niles Lawson,"[holding in his left arm a giant candy cane, with blood stains along the hooked end] Tom, tragedy stuck last night when mall security officer Miles ""Happy"" Davis was beaten to death with this candy cane after telling a mother she couldn't line up for Black Friday until Thursday night. In honor of the slain mall security officer, the mall has officially decided to drop another 10% off Black Friday deals!"
1703,17,8,Randy Marsh,Happy was a good man. Too good to have died in such a brutal but festive manner.
1704,17,8,Guard 3,[runs up to Randy] Captain! Captain! The mall is dropping the Black Friday sale another 10%.
1705,17,8,Guard 4,What?
1706,17,8,Guard 5,Oh my God.
1707,17,8,Guard 6,They can't do that!
1708,17,8,Guard 7,What? That's 90% off!
1709,17,8,Guard 8,Oh God! They're back! The shoppers are back! [the camera pulls back to reveal a large crowd of shoppers slowly moving towards the mall. One of them holds a flyer for the new Black Friday deal. The fog is so low it looks soupy]
1710,17,8,Randy Marsh,Everybody stay put! I'll handle this. [exits the mall]
1711,17,8,Randy Marsh,"[through a bullhorn] If you are here for Black Friday, you cannot be on mall property until midnight on Thanksgiving."
1712,17,8,Shopper 6,We're not on mall property.
1713,17,8,Randy Marsh,"Well, you're about to be."
1714,17,8,Shopper 6,"Well, what if we just walk really, really slow? [the crowd slows it's walk further, growls spread among them, as they start to resemble a White Walker's] Black Friday!"
1715,17,8,Randy Marsh,You're gonna have to walk slower than that. You've got a while.
1716,17,8,Shopper 7,We can walk really slow. Look. [the shoppers start to shamble and quietly moan in a full parody of a White Walker army]
1717,17,8,Randy Marsh,Smartasses. [turns around and goes inside the mall]
1718,17,8,Eric Cartman,"Paladin Butters, I was hoping I could talk to you about Lady McCormick."
1719,17,8,Butters Stotch,"You mean Princess Kenny, m'lord?"
1720,17,8,Eric Cartman,"Yeah, whatever. The little prick thinks he's Daenerys Targaryen. I need to know how to deal with him. [picks a rose out for Butters, just as he did for Kenny before.] How do they deal with the Queen of Dragons in Game of Thrones?"
1721,17,8,Butters Stotch,They don't!
1722,17,8,Eric Cartman,Well did you finish watching Season 3 like I asked you?
1723,17,8,Butters Stotch,"Yeah, I finished it!"
1724,17,8,Eric Cartman,So what happens when the dragons show up?
1725,17,8,Butters Stotch,"Nothing! The dragons are just still on their way! They keep promising dragons, but all I get are more floppy wieners in my face!"
1726,17,8,Eric Cartman,Butter-Butters! The key to our victory is following the Game of Thrones model exactly. I have to know what happens when the dragons show up so I know how to deal with Kenny.
1727,17,8,Butters Stotch,Wha-what do you want me to do?
1728,17,8,Eric Cartman,Here's two bus tickets to New Mexico. I want you to take Sir Scott Malkinson and go seek out George R. R. Martin for answers.
1729,17,8,Butters Stotch,Who's George R. R. Martin?
1730,17,8,Eric Cartman,"He's the guy who writes Game of Thrones, Butters! He can let us both know how to handle Kenny, and if we should betray Clyde or not. Let's face it, Butters, this is really about you and me getting XBoxes. The rest are simply there to help us get through those doors."
1731,17,8,Homeowner,Hey! I told you kids to stay out of my damn yard!
1732,17,8,Eric Cartman,[shoots back] Do you mind?! We're trying to talk here!
1733,17,8,Homeowner,"Yeah?! Well how come every time you talk to somebody, it's about betraying somebody else?!"
1734,17,8,Eric Cartman,Why don't you mind your own business?!
1735,17,8,Steve Ballmer,"No. Listen, for the last time, we don't have any dragons to send them. If some people wanna choose PlayStations, it's their choice. [a knock is heard]"
1736,17,8,Steve Ballmer's Secretary,"Sir, Mr. Gates is here."
1737,17,8,Steve Ballmer,"Bill Gates? [to the caller] Uh, I gotta go. [hangs up, rises from his seat, goes around the desk, and greets Bill Gates] Hey heeey! Bill Gates actually showing up at Corporate."
1738,17,8,Bill Gates,"[shaking hands] Hey Steve, how're you doin'?"
1739,17,8,Steve Ballmer,"Not bad, you know? Just tryin' to get this next gen press stuff handled."
1740,17,8,Bill Gates,"I heard there's a little trouble in uh, Colorado somewhere?"
1741,17,8,Steve Ballmer,"Oh it's- no, it turns out it was nothing, just some kids tryin' to turn the console wars into somethin' bigger."
1742,17,8,Bill Gates,"Oh my gosh. You know, when I uh... stepped down and left you in charge of the company, Steve uh, I knew there might be some challenges for you."
1743,17,8,Steve Ballmer,"Yeah, well, nothin' I can't handle. [a man dressed in black appears behind him] There might be some changes we need to make to our marketing, but I'm optimistic. [the man approaches Steve.]"
1744,17,8,Bill Gates,Uh huh.
1745,17,8,Steve Ballmer,"You know, I think we'll ultimately sell the number of units we want to. [the man takes out a dagger and gets closer]"
1746,17,8,Bill Gates,"You're right, Steve. Some changes do need to be made. [the hitman reaches around and stabs Ballmer through the chest and drags the dagger to the right, cutting open Ballmer's chest even more. Ballmer cries out, but is choking in his blood. Ballmer steps backwards and falls on his back gasping for air. Gates takes a glass of wine to a sofa and sits down to look at Ballmer] Do you know what weakness is, Steve? Weakness is believing that competition is healthy. See, there was a time when XBoxes and PlayStations could both survive in this world, but that time's done. It's all headed to one device that people game on, watch TV on, socialize on. There's only going to be one winner. I can't have you idiots throwing away everything I worked so hard to achieve. [Ballmer takes his last gasps as Gates walks out of the CEO's office. Gates addresses Ballmer's men] Clean that shit up."
1747,17,8,Butters Stotch,"Well come on, Scott. You're lagging."
1748,17,8,Scott Malkinson,I think my insulin's low. I need to eat.
1749,17,8,Butters Stotch,"Let's just talk to this guy, and then we can hit a McDonald's. Oh here we go. 2217. [Butters and Scott stand in front of a mansion gate somewhere in the Southwest. Cacti abound on either side of the high fence. Butters reaches up and presses a buzzer]"
1750,17,8,Butler,[through the intercom] Can I help you?
1751,17,8,Butters Stotch,Hello? Is this George R. R. Martin's house?
1752,17,8,Butler,"Who is this, please?"
1753,17,8,Butters Stotch,"Uhhhh, it's two kids who want to know what happens when the dragons show up? [two seconds of silence] Hello?"
1754,17,8,Butler,"I'm sorry, but Mr. Martin does not see fans."
1755,17,8,Butters Stotch,We're not fans!
1756,17,8,Scott Malkinson,"Yeah, we don't like it!"
1757,17,8,Butters Stotch,"We don't like it! And I'm pretty pissed off, if you wanna know the truth!"
1758,17,8,Butler,About what?
1759,17,8,Butters Stotch,"Let me talk to George R. R. Martin, and I'll tell him about what! [the buzzer sounds again and the gates open. Butters and Scott go inside and towards the front door. George R. R. Martin steps outside to greet them]"
1760,17,8,GRRM,"It's the Red Wedding, isn't it? You hate how I killed everyone off?"
1761,17,8,Butters Stotch,"Uh no sir, we just really need to know about the dragons, but they never seem to show up."
1762,17,8,GRRM,Oh they're coming. The dragons are on their way.
1763,17,8,Butters Stotch,When?
1764,17,8,GRRM,You really wanna know?
1765,17,8,Butters Stotch,[sternly] Please. It's urgent.
1766,17,8,GRRM,"Alright, King Joffrey is still at King's Landing, but there's a young blacksmith who wakes up one morning with a plan. And His wiener gently hangs down between his legs. Soft and flaccid, his wiener glistened in the golden sunlight."
1767,17,8,Butters Stotch,"No, uhno, can we skip the wiener stuff and just get to the dragons?"
1768,17,8,Scott Malkinson,"Aw shit, I think I'm-I think I'm going to faint."
1769,17,8,Butters Stotch,"Uh what's the matter, Scott?"
1770,17,8,Scott Malkinson,I told you I have to eat every two hours.
1771,17,8,Butters Stotch,He's diabetic.
1772,17,8,GRRM,"Oh Jeez, uh, why don't you kids come out from the cold? I'll order some pizzas."
1773,17,8,Butters Stotch,"Oh. Okay, thanks."
1774,17,8,GRRM,Come on in! I'll tell you everything that's gonna happen in Game of Thrones. [leads the boys inside]
1775,17,8,Eric Cartman,"Sir Kyle, I wanted to talk to you about Stan."
1776,17,8,Kyle Broflovski,"If you want to make sure I'm not switching sides, Cartman, you don't have to worry. Stan is wrong."
1777,17,8,Eric Cartman,"It isn't that. Princess Kenny is loved by her army [picks a rose out for Kyle], but Stan is still the nuts and ball of her operation. [Kyle sniffs the rose] It would be a huge setback to the traitors getting their PlayStations if Stan were to be... [stops] grounded?"
1778,17,8,Kyle Broflovski,Grounded? For what?
1779,17,8,Eric Cartman,That could be up to you.
1780,17,8,Kyle Broflovski,"No, Cartman. You said nobody will have to be grounded. We're not playing dirty!"
1781,17,8,Eric Cartman,"Fine, Sir Kyle. Perhaps you're right. [begins walking] Did you know that Stan's dad is working a temp job as mall security?"
1782,17,8,Kyle Broflovski,What?
1783,17,8,Eric Cartman,"Seems a little convenient, doesn't it? [stops and faces Kyle] Stan with somebody on the inside to help him get his PS4s. Who's playing dirty now? Let's face it, Sir Kyle, this is really about you and me getting XBoxes. The rest are simply there to help us get through those doors."
1784,17,8,Homeowner,Don't believe it! [Cartman and Kyle look at the homeowner] He said that to a bunch of people!
1785,17,8,Eric Cartman,"Dude, you'd better stop harassing me or I'm callin' the cops!"
1786,17,8,Homeowner,You're callin' the cops?!
1787,17,8,Eric Cartman,Yeah!
1788,17,8,Homeowner,You're on my property! I'm callin' the cops!
1789,17,8,Eric Cartman,Well go ahead! Call the fuckin' cops then!
1790,17,8,Tom and Tammy Thompson,"[startled] Oh oh! [calms down] Oh, it's you."
1791,17,8,Niles Lawson,"Tom, I'm standing in your doorway because we have a hot news story to report."
1792,17,8,Tom and Tammy Thompson,We don't go to work for another hour.
1793,17,8,Niles Lawson,[walks to the foot of the bed] We just got a call from Bill Gates. [sits down] He says he can promise us a bigger war on Black Friday if we play along.
1794,17,8,Tom and Tammy Thompson,He wants us to side with him?
1795,17,8,Niles Lawson,"That's right, Tammy. Let's not forget that having a bloodbath on Black Friday is good for the news. It's good for us. The bigger, the better."
1796,17,8,Tom and Tammy Thompson,"Our job is to report the news, not make it more violent!"
1797,17,8,Niles Lawson,"Right, Tom. Because you're sooo about integrity. Let's go. [stands up and walks to the doorway, then turns around] Or maybe I should let everyone in the newsroom know what their two anchors are up to! Back to you!"
1798,17,8,9 News Announcer,"It's the morning news, with Tom and Tammy Thompson. Colorado's top-rated brother-sister news team."
1799,17,8,Tom and Tammy Thompson,"Well Black Friday is just around the corner and Tammy, it's getting fierce out there."
1800,17,8,Tom and Tammy Thompson,"That's right, and Niles Lawson is out at the mall with a little holiday surprise."
1801,17,8,Niles Lawson,"Tammy, the excitement over Black Friday is peaking, and none other than Bill Gates himself has shown up to try to make it even bigger. [Bill Gates appears]"
1802,17,8,Bill Gates,"That's right. We just wanna do whatever we can to help our supporters get their XBoxes at incredible deals on Friday, so we've come to offer swords and battle axes, whatever the kids can carry to help them fight their way through the other shoppers."
1803,17,8,Niles Lawson,We understand that you've donated some guns to the kids as well.
1804,17,8,Bill Gates,"Yes, but we are limiting it to one per XBox follower,, because of course, the key thing here on everyone's mind is safety."
1805,17,8,Mrs McCormick,[answers the door] Yes?
1806,17,8,Eric Cartman,"Hi, is Kenny home?"
1807,17,8,Mrs McCormick,"Uh, yeah, Kenny's out back playing with his friends."
1808,17,8,Eric Cartman,"Forward, men! [the bearers try to fit Cartman through the door, but they can't fir through. First they run into the door frame on the left side] That, no- [then on the right] No, you- You've gotta turn me. [the bearers tilt the litter some seventy degrees without Cartman falling off and finally fit through the door.]"
1809,17,8,Jimmy Valmer,It's the enemy! Defensive po-po-p-po-p-positions! [other soldiers rally]
1810,17,8,Other kids,Protect the Princess! Kill 'em! Kill 'em! Get out!
1811,17,8,Eric Cartman,"I seek audience with the traitor, Lady McCormick?"
1812,17,8,Stan Marsh,Let them pass! [the PS4 army makes way for the XBox army. Cartman is carried over to Kenny's throne]
1813,17,8,Kenny McCormick (and his narrator),"(Welcome to my kingdom, Sir Eric. Now, state your purpose.)"
1814,17,8,Stan Marsh,[translating] The Princess bids your fat ass welcome to her kingdom and suggests you state your purpose.
1815,17,8,Eric Cartman,"You can't win this, guys. Look around you. Lay down your weapons, and you can come back and fight for XBoxes with us on Black Friday."
1816,17,8,Kenny McCormick (and his narrator),"(You can change your mind instead of fighting with us, Eric.)"
1817,17,8,Stan Marsh,"The Princess says that if you wanna change your mind and agree that Playstations are better, she'll consider it."
1818,17,8,Eric Cartman,"Kenny, we all understand wanting to play as the chick once in a while, 'kay? But you are never going to be a real princess!"
1819,17,8,Kenny McCormick (and his narrator),"(What?!) [fans himself] (Oh, the nerve! How insensitive of you, you cock-sucking faggot!)"
1820,17,8,Stan Marsh,The Princess calls you a ball-licking lesbian.
1821,17,8,Eric Cartman,That doesn't even make sense.
1822,17,8,Kyle Broflovski,"[steps forward] Stan, this has gone too far. People are going to get hurt. What you started is way out of control."
1823,17,8,Stan Marsh,What I started? How dare you!
1824,17,8,Kyle Broflovski,All these people are going to be gaming on XBox. You really wanna just game with Craig the rest of your life?
1825,17,8,Stan Marsh,"I would rather game with Craig than spend one minute having to set up an XBox Live account! We will get our PlayStations tomorrow, and you buttholes will have nothing!"
1826,17,8,Eric Cartman,"You're outnumbered ten to one, and there's no time left! How will you win?! [Stan and Kenny look at each other, then Stan thinks a minute]"
1827,17,8,Stan Marsh,The gods will find us a way!
1828,17,8,GRRM,"So then Samwell Tarly sees the army approaching, and his wiener is about this big. [about 18 inches, by his estimate. Butters is losing patience as Scott fades] He knows that Stannis Baratheon's wiener is probably shriveled from the cold. Samwell has to rally his men, so what does he do? He takes out his wiener [unzips his pants and demonstrates his story] and he dangles it around for all his men to see. [shakes his hips and pretends his wiener is a bell]"
1829,17,8,Scott Malkinson,AAAH! [turns away for a moment]
1830,17,8,Butters Stotch,"OOAH! Uh, sir, you said pizzas were coming!"
1831,17,8,GRRM,"Yeah yeah, they're on their way. They're still coming. So Samwell's wiener goes [shakes his hips around as if his wiener were a bell and makes sounds for it]"
1832,17,8,Butters Stotch,But you said they were on their way like three hours ago! [Scott had said he needs to eat every two hours]
1833,17,8,Scott Malkinson,"If I don't get pizza soon, I'm goin' to pass out."
1834,17,8,GRRM,"[zips up] Don't worry. They're coming. Pizzas are on their way. They're gonna be amazing. [picks up where he was interrupted] Now, John Snow finally faces Jaime Lannister, and this guy's wiener is, you know, huge, right? So it's not goin' to be easy."
1835,17,8,Scott Malkinson,Ehhh...
1836,17,8,Eric Cartman,"Mr. Gates, I was hoping I could talk to you about the fight on Friday."
1837,17,8,Bill Gates,"Certainly. Uh, Eric, right?"
1838,17,8,Eric Cartman,"Uhh, it's my Lord Wizard King, actually. Having your leadership has certainly been a help. [picks another yellow rose for Gates] But I hope that we're clear that this is my army. [hands the rose to him. Gates sniffs it] There can only be one person of royalty; that's kind of the rules."
1839,17,8,Bill Gates,"Oh I certainly don't wanna step on your toes. Don't worry, I'm quite good at letting my CEOs do what they want."
1840,17,8,Eric Cartman,Your CEOs?
1841,17,8,Bill Gates,"Let's face it, this is really just about you and me getting XBoxes. The rest are simply there to help us get through those doors."
1842,17,8,Eric Cartman,"Uhhh, hmmm. What?"
1843,17,8,Homeowner,[from his bedroom window] Hahaa! How's it feel?! Now who's walking who through the betrayal garden?!
1844,17,8,Eric Cartman,Why don't you stay the fuck out of my business?!
1845,17,8,Homeowner,Why don't you stay the fuck out of my yard?! [slams his window shut]
1846,17,8,President of Sony,"Ish, ish, ish, o-ish, haishooo! [quickly sits up to deliver the final thrust, then collapses onto his bed. He then rolls over on his back, revealing whom he was having sex with]"
1847,17,8,Niles Lawson,[with mic in hand] That was amazing sex. I enjoyed it immensely. How about you?
1848,17,8,President of Sony,"[gets a cigarette and lights it.] Tanoshikatta ne. (Yeah, it was fun.)"
1849,17,8,Niles Lawson,"You know, Microsoft has given kids who want XBoxes on Black Friday a lot of support. Seems a shame that the fight will be so one-sided."
1850,17,8,President of Sony,"Eh? Nani kore, tsukareta yo. (What? I'm tired!)"
1851,17,8,Niles Lawson,Black Friday is about to happen and it's not even gonna be a fight. That's bad for both of us. There must be something you can give to kids who want Sonys to make the fight more even.
1852,17,8,President of Sony,"Hai. [""Yes."" He reaches over to his left and grabs a box] Kore ga arimasu. [""Here it is"" He opens the box and something begins to glow inside]"
1853,17,8,Niles Lawson,"[leans in to see what it is] Yes, I think that will do nicely."
1854,17,8,Chorus,"[Classical men's ensemble singing in musical round style, as GRRM conducts.]
'Wiener, wiener wiener, wiener wiener [continues in background]"
1855,17,8,Soloist,"One wiener, next to another wiener"
1856,17,8,Chorus,"Wiener, wiener wiener, wiener wiener [continues in background]"
1857,17,8,Soloist,Two wieners alongside yet another wiener
1858,17,8,Chorus,"Party, wiener party, wiener party, party party, wiener party, wiener wiener [continues in background]"
1859,17,8,Soloist,"Soft wieners, nice and soft, non-erect wieners!"
1860,17,8,Chorus,"Keep them flopping, flopping wieners, floppy floppy, dangle wieners, dangle dangle [continues in background]"
1861,17,8,Soloist,Five wieners in my face
1862,17,8,Scott Malkinson,Stop! Stop please! I can't take any more! [Chorus is silent]
1863,17,8,GRRM,"But this is the best part. Right before King Joffrey gets poisoned, everyone flaps their wieners all around his face."
1864,17,8,Scott Malkinson,Jeaaaaah!
1865,17,8,Butters Stotch,"[gets off the sofa] Listen, buddy! You promised that pizzas were on the way! If they don't show up right now, you're gonna have a dead kid in your hands! Do you hear me?!"
1866,17,8,GRRM,"Okay, okay, fine fine. What kind of pizzas do you want?"
1867,17,8,Butters Stotch,What kind do we want?!
1868,17,8,Scott Malkinson,He hasn't even ordered the pizzas yet!
1869,17,8,GRRM,"Don't worry! They're coming! Not just two pizzas, there's, there's gonna be five! And they're gonna be huge! You won't believe it!"
1870,17,8,Butters Stotch,"Come on, Scott! We're leaving! [helps Scott off the sofa, and they're about to leave]"
1871,17,8,GRRM,"Wait, I haven't told you what happens yet!"
