,season,episode,character,line
1242,17,6,Kyle Broflovski,"Alright, Cartman, joke's over. [Kenny takes out his phone]"
1243,17,6,Eric Cartman,What? What joke? This is real!
1244,17,6,Kyle Broflovski,Tell everyone you made the cow look like that!
1245,17,6,Eric Cartman,"No, [drops down to the ground] no, you were right, Kyle. I was wrong."
1246,17,6,Butters Stotch,"Boy Eric, I sure do admire your courage to admit when you made a mistake."
1247,17,6,Eric Cartman,"Thank you, Butters! [laughs to himself]"
1248,17,6,Craig Tucker,"I gotta show this to my mom! [leaves, and the other kids disperse]"
1249,17,6,Butters Stotch,Let's go get the kindergartners. Uh they're gonna wanna see this too! [leaves. Only Kyle remains with Cartman]
1250,17,6,Eric Cartman,"Yeah, be sure to show everyone, guys. It's really amazing. Heheh, too good, too too good."
1251,17,6,Kyle Broflovski,Even the dumbest lie can have big consequences.
1252,17,6,Eric Cartman,"Yes, you're right, Kyle. I'm sure that that... is going to have earth-shattering consequences. Heheheheh. [walks away]"
1253,17,6,Mr Mackey,"Your attention, please. Will Kyle Broflovski report to the principal's office?"
1254,17,6,Kyle Broflovski,Huh?
1255,17,6,Mr Mackey,Kyle Broflovski to the principal's office. Please. Umkay?
1256,17,6,Butters Stotch,"Hohoh! What'd you do, Kyle?"
1257,17,6,Kyle Broflovski,Nothing. [hops off his chair to leave the classroom]
1258,17,6,Butters Stotch,Busted!
1259,17,6,Mr Mackey,"Ah, thanks for comin', Kyle."
1260,17,6,Kyle Broflovski,Wuwhat's going on?
1261,17,6,Principal Victoria,"Kyle, these men have apparently come all the way from Israel to speak with me, but... we need a translator."
1262,17,6,Kyle Broflovski,[glances at the rabbis again] I don't speak Hebrew.
1263,17,6,Mr Mackey,"Kyle, please try your best. It seems pretty important. [to the rabbis, in bad English] This.. boy... uhkay... is Jew. Uhkay? Jew... like you. Uhkay? Please... uh, please try... speak... to Jew.[Kyle looks at the rabbis]"
1264,17,6,Rabbi 1,[sighs] We're just trying to tell them that we come on very urgent business. [Kyle looks back at Mr. Mackey]
1265,17,6,Mr Mackey,Anything?
1266,17,6,Kyle Broflovski,He said they come on urgent business.
1267,17,6,Principal Victoria,"Ohh, what does he need?"
1268,17,6,Rabbi 2,"Look, we believe that this school has something which is of the utmost importance to our people! We wish to see the red cow!"
1269,17,6,Kyle Broflovski,"The red- Oh come on, you can't possibly be here for that!"
1270,17,6,Principal Victoria,"For what? What did he say, Kyle?"
1271,17,6,Rabbi 1,"Please, you must understand! The fate of the world is at stake! [walks to his right and walks over to the window] The coming of a red heifer is the nost holy sign in all of Judaism. It signals the beginning of the End. It is not just our religion, but Islam and Christianity as well. They all agree on one thing. [turns around] That the red heifer means the End of Times."
1272,17,6,Mr Mackey,"You catch any of that, Kyle? [Kyle looks at Mr. Mackey in disbelief]"
1273,17,6,Kyle Broflovski,It's right over here by uh-
1274,17,6,Rabbi 2,Oh my holy shmear! [a group of Muslims is already bowing down to the cow. One of them notices him and tells him to get out. (!برو بیرون)]
1275,17,6,Rabbi 2,The Muslims! They beat us here! [hops the fence and charges at them. The other two follow suit.]
1276,17,6,Mr Mackey,"[frantic] What's goin' on, Kyle??"
1277,17,6,Kyle Broflovski,He said the Muslims beat them here- [to himself] God damn it!
1278,17,6,Rabbi 2,[arrives next to the cow] Step away! You all know what this means!
1279,17,6,Cleric 1,Yes! And you know you are about to die!
1280,17,6,Kyle Broflovski,Hold on everybody. This thing isn't even a-
1281,17,6,Rabbi 1,"Don't touch it! [they all surround the cow, keeping Kyle and each other away from it]"
1282,17,6,Eric Cartman,"[to a reporter] Well I just ran to the school and told everyone, ""Hey, there's a redheaded cow outside; you should all see it."""
1283,17,6,Kyle Broflovski,"[trying to reach Cartman, but trapped by the crowd] Cartman, stop! You don't know what you're doing!"
1284,17,6,Eric Cartman,"I'm pretty sure that this cow could make ginger cheese, which is like a Swiss cheese, except instead of holes, it has freckles. [chuckles loudly]"
1285,17,6,Kyle Broflovski,NOOOO!
1286,17,6,Rabbi 4,"[arrives with a sheet of paper, and Rabbi 2 looks at it] The Muslims and the Christians are calling for a meeting to discuss the terms of war."
1287,17,6,Rabbi 2,"Very well, let us meet to discuss how the world as we know it ends."
1288,17,6,Rabbi 1,"Alright, so far we agree there'll be no automatic rifles, no shanks, and no chemical weapons."
1289,17,6,Cleric 2,"If there can be no chemical weapons, then the Christians can use no nuclear weapons. [clamoring follows]"
1290,17,6,Bishop,"Come on, without nuclear weapons, what kind of final Armageddon is this gonna be?! [clamoring follows]"
1291,17,6,Rabbi 3,But couldn't we agree on non-ballistic nuclear weapons only?
1292,17,6,Bishop,"Yeah, I suppose that's fine."
1293,17,6,Cleric 2,That makes sense.
1294,17,6,Rabbi 1,Non-ballistic nuclear only. Alright. Now on to prisoners. Are we all agreeing to decapitations?
1295,17,6,Israeli,Of course we are! What do you think this is?!
1296,17,6,Others,"Yeah, come on! Just get to it!"
1297,17,6,Cleric 3,"Wait a minute, wait a minute! Has anyone noticed something? We are all in a room together. Talking. [walks to the front of the crowd] Has it occurred to anyone else that this prophecy, which amazingly is in all three religions, could actually be meant to bring us together?"
1298,17,6,Bishop,[walks up to him] The prophecy says the red heifer signals the End. [joins him] Could it mean the end of... war?
1299,17,6,Rabbi 1,"If the cow is sacrificed in Israel according to the prophecy, then perhaps it could bring about peace."
1300,17,6,Anderson Cooper,"After all the years of holy wars and hatred, a possibility for peace... in the Middle East. In the past 48 hours, Jews, Muslims, and Christians have met in Israel to sort out their differences. It may be a rocky road, but many say the chance for peace is real. And all because of a red cow, discovered by a young boy here in the U.S. [the doorbell rings and Kyle goes to answer it]We'll be back with more on these amazing developments after this. [Kyle opens the door and sees that it's Cartman]"
1301,17,6,Eric Cartman,Hey Kyle. Y-you got a minute?
1302,17,6,Kyle Broflovski,Yeah. [Cartman enters and Kyle closes the door]
1303,17,6,Eric Cartman,"I've gotta tell you something, Kyle. The red-headed cow... isn't real. I made him up."
1304,17,6,Kyle Broflovski,No shit!
1305,17,6,Eric Cartman,"I totally lied, Kyle. And when you asked me if I had lied, I looked you right in the eye and said ""No."" I owe you an apology and, I mean it."
1306,17,6,Kyle Broflovski,Well it-... it's okay. there's no denying it all worked out for the best this time a-.
1307,17,6,Eric Cartman,"[shakes his head] No! No, Kyle, you said that it's never for the best. Remember that? And you're right. You're right, Kyle!"
1308,17,6,Kyle Broflovski,"Oh no. Nohoho no. Cartman, don;t you do this! The Middle East is finally at peace!"
1309,17,6,Eric Cartman,"But it's not true. Kyle, I'm being serious. I really think I have to tell the truth! I I don't know how I can live with this. I don't think I can unless eh, unless I don't know mm-maybe you c-called your mom a fat skank? [no reply] Maybe if you'd said that to your mom and... told her that her tits belonged in a morgue, then, maybe somehow I could live with this lie."
1310,17,6,Kyle Broflovski,"Dude, go to Hell!"
1311,17,6,Eric Cartman,"You're right. You're right, Kyle. I should just tell the truth and be done with it! [picks up the house phone and starts punching]"
1312,17,6,Kyle Broflovski,Wwwait. [Cartman stops]
1313,17,6,Kyle Broflovski,Mom?
1314,17,6,Sheila Broflovski,Hi bubbe.
1315,17,6,Kyle Broflovski,"Mom, there's sssomething I need to tttell you."
1316,17,6,Sheila Broflovski,"What is it, Kyle?"
1317,17,6,Kyle Broflovski,"[looks down and to his right] You're a fat skank, Mom. [shuts his eyes. Sheila is shocked]"
1318,17,6,Eric Cartman,"[gasps loudly] Kyle! Oh my gosh, what did you just say??"
1319,17,6,Kyle Broflovski,"You're a fat skank, Mom, and your tits belong in a morgue. [turns and walks out. Cartman's jaw drops.]"
1320,17,6,Eric Cartman,"Ohh my God! [whips out his camera phone and feigns concern] Ms. Broflovski, are you okay? Does he always talk to you like that?"
1321,17,6,Eric Cartman,"[reaching his locker] Yeah, come on over here. I got some more stuff in my locker, Kyle. [opens his locker and puts a book on top of the stack. Stan, at his neighboring locker, notices]"
1322,17,6,Stan Marsh,How come you're carrying Cartman's stuff?
1323,17,6,Kyle Broflovski,I just... thought it'd be nice.
1324,17,6,Eric Cartman,"[puts another book on the stack] Kyle is doing all kinds of things for me. He finished my homework, [puts a third book on the stack] gave me the soda from his lunch. [removes the second and third books he just placed on the stack] I think he's just really stoked on me for helping bring peace to the Middle East. [places the third book back on the stack] Right, Kyle? [puts the second book back in the locker]"
1325,17,6,Kyle Broflovski,Yes sir.
1326,17,6,Eric Cartman,"Oh, looks like most everyone's here. Um, wasn't there something you wanted to say, Kyle? Remember about the...?"
1327,17,6,Kyle Broflovski,"Yes. [sets Cartman's books and backpack on the floor, then walks to the middle of the hallway] I love Cartman's farts."
1328,17,6,Eric Cartman,You what??
1329,17,6,Kyle Broflovski,Yummy yummy yummy I want Cartman's farts in my tummy.
1330,17,6,Craig Tucker,"Dude, what the hell are you talking about?"
1331,17,6,Kyle Broflovski,Yummy yummy yummy can I please Cartman's farts in my tummy?
1332,17,6,Eric Cartman,"[walks up to him] Okay okay Jesus, uh, lay down on your back, Kyle. [Kyle does so, and Cartman backs up onto Kyle's face] Let's see what I can muster up here."
1333,17,6,Kyle Broflovski,Yummy yummy yummy yummy yummy yummy yummy yummy yummy yummy.
1334,17,6,Eric Cartman,"Let's see. Oh! Oh! [farts, then gets off Kyle]"
1335,17,6,Kyle Broflovski,[stands up] Yummy yummy thank you Cartman. [turns aroundn and walks away. Cartman smiles. Stan and Kenny can't believe it]
1336,17,6,Stan Marsh,[enunciating] What the fuck?
1337,17,6,Mr Mackey,Come on in.
1338,17,6,Kyle Broflovski,"[opens the door and walks in] Mr. Mackey, can I talk to you?"
1339,17,6,Mr Mackey,"Wuh sure, Kyle. What's the matter?"
1340,17,6,Kyle Broflovski,"If you knew something, but, you couldn't tell anyone, what... what would you do?"
1341,17,6,Mr Mackey,"Well, Kyle, living with a lie is never a good thing. Okay. Could... could you maybe just tell me?"
1342,17,6,Kyle Broflovski,[rubs his tears away] Okay okay... I love having Cartman's farts in my tummy. I love it. [Cartman sneaks a peek around the open door] I love it sooo sooo much.
1343,17,6,Mr Mackey,Well... why do you like his farts in your tummy?
1344,17,6,Kyle Broflovski,Because they taste so yummy. [his voice quivers]
1345,17,6,Mr Mackey,"Well Kyle, that's kind of odd. Uh, not sure how to help you with that."
1346,17,6,Eric Cartman,"[enters and clears his throat] Oh, Mr. Mackey, could I-Oh, uhhh. Hey, sorry, am I interrupting?"
1347,17,6,Kyle Broflovski,Not if you... have some delicious farts for me.
1348,17,6,Eric Cartman,"[small gasp] Kyle, are you sure?"
1349,17,6,Kyle Broflovski,Please...
1350,17,6,Eric Cartman,"Well alright. [farts into his left hand and cups it over Kyle's mouth, making sure the fart goes all the way in.]"
1351,17,6,Kyle Broflovski,Yummy yummy.
1352,17,6,Mr Mackey,Mmmmmmmmmmmmmmmmmmmmmm kaaaaaaaaaaaaaaaay.
1353,17,6,Bishop,"Today... begins the new Israel. [the cleric lifts up a cow bell and rings it, then sets it down] Today, we are all united as one. [the rabbi lights the candle] Chakam balada."
1354,17,6,Crowd,Chakam balada! Chakam balada! [followed by lots of cheering]
1355,17,6,Rabbi 3,"Now, let us celebrate under one symbol! [the clergy go their separate ways and the table sinks into the stage. After several peals of the bell, the floot the table was on returns to the stage as the three religious symbols combine to form... the Van Halen logo. Van Halen's music comes on and the stage lights go on. Eddie Van Halen takes the stage, followed by the rest of Van Halen, with David Lee Roth on mic]"
1356,17,6,Rabbi,No way no waaay!
1357,17,6,Muslim,Epiiic!
1358,17,6,David Lee Roth,"Hello Israel! [launches into ""Ain't Talkin' 'Bout Love""]"
1359,17,6,CNN Reporter,"The party is officially underway. Jews, Christians and Muslims have united, ushering ten years of Van Halen. [archived live footage follows] Out in the crowd, people are celebrating like never before. [nineteen seconds of footage and song follow] No doubt Israel is the happiest, rockingest place to be."
1360,17,6,Stan Marsh,Hey Kyle.
1361,17,6,Kyle Broflovski,Hey
1362,17,6,Stan Marsh,"Kyle, there's peace in the Middle East. They're saying maybe it's gonna lead to peace all over the world. Everyone's really happy. You should be too."
1363,17,6,Kyle Broflovski,"I am happy, Stan. I'm thrilled."
1364,17,6,Stan Marsh,"...Dude, we've been friends a long time. Can you just tell me why you like Cartman's farts so much?"
1365,17,6,Kyle Broflovski,"[gets emotional] I just do, Stan."
1366,17,6,Stan Marsh,You like... how they smell? How they taste?
1367,17,6,Kyle Broflovski,Yes.
1368,17,6,Stan Marsh,They're really that good?
1369,17,6,Kyle Broflovski,Yes.
1370,17,6,Stan Marsh,Should I try them?
1371,17,6,Kyle Broflovski,NO.
1372,17,6,Ringtone,Yummy yummy. Yummy yummy. Yummy yummy. Yummy yummy.
1373,17,6,Kyle Broflovski,This is Cartman. I have to take it. [answers his phone] Hello?
1374,17,6,Eric Cartman,"Hey, I was just about to order some dinner. What sounds better in your mouth tomorrow? Thai or Greek?"
1375,17,6,Kyle Broflovski,[keeping quite calm] I don't care.
1376,17,6,Eric Cartman,"I care, Kyle. You should have a say in this; they're your yummy farts. Should we go with Thai?"
1377,17,6,Kyle Broflovski,That's fine. [hangs up]
1378,17,6,Stan Marsh,"...Kyle, maybe you should get some help."
1379,17,6,Kyle Broflovski,"Please, just, just leave it alone, Stan. Everything is as it has to be."
1380,17,6,Stan Marsh,"I don't get it, Kenny."
1381,17,6,Kenny McCormick,"(Dude, maybe he's like mentally ill or something)"
1382,17,6,Stan Marsh,"Well whatever it is, we have to figure it out. I think all those farts are starting to get to Kyle's head."
1383,17,6,Kyle Broflovski,"No more. No more. Oh, come on, Cartman, no. No more. [begins to reject Cartman's farts in his dreams. A bright light appears and Kyle wakes up, then looks at the foot of his bed]"
1384,17,6,Spirit,Kyle Broflovski.
1385,17,6,Kyle Broflovski,Huh? Who...? Who is that?
1386,17,6,Spirit,"Why do you endure all the farts, Kyle?"
1387,17,6,Kyle Broflovski,I... because the world is at peace. I must endure.
1388,17,6,Spirit,What you are doing... is the most awesome thing ever.
1389,17,6,Kyle Broflovski,I... I know.
1390,17,6,Spirit,Who else would take such torment?
1391,17,6,Kyle Broflovski,"That's, that that's k-kind of what I was thinking."
1392,17,6,Spirit,"You should like, shave your head and get all peaceful about it. Your sacrifice saves the world."
1393,17,6,Kyle Broflovski,Yes.
1394,17,6,Kyle Broflovski,I endure what I must for the sake of all humanity.
1395,17,6,CNN Reporter,"[now in party mode - shirtless and with face paint on] What can this reporter say except that Israel freaking rocks! Things just keep getting better here, Tom. And in a few days, they'll be honoring the little boy who discovered the red cow, here on stage, and things are gonna go off!"
1396,17,6,Eric Cartman,"You're gonna... come with me... to Israel, Kyle? [three quick farts]"
1397,17,6,Kyle Broflovski,Yes! Yes I will!
1398,17,6,Eric Cartman,Huh? You comin'? [three more quick ones]
1399,17,6,Kyle Broflovski,"Yes, whatever you want. [a longer fart]"
1400,17,6,Eric Cartman,"Okay. I want the whole world to see how much you love my farts. Plane leaves tomorrow. [leaves, screen right. Kyle stands up]"
1401,17,6,Stan Marsh,"Kyle, don't do this. Don't eat Cartman's farts in front of the whole world."
1402,17,6,Butters Stotch,"Just stop, please."
1403,17,6,Kyle Broflovski,"[dressed in gray pants and white tunic, no footwear] It's okay. Everyone, it's okay. Perhaps one day, you will all understand. What I do, I do because I care about each and every one of you. [walks away, screen left]"
1404,17,6,Craig Tucker,Well now he just sounds like a self-righteous asshole.
1405,17,6,Stan Marsh,Hey Kyle.
1406,17,6,Kyle Broflovski,"Hello, Stan."
1407,17,6,Stan Marsh,"Um, dude, we need to talk. This has to stop."
1408,17,6,Kyle Broflovski,There are greater things at work than what you understand.
1409,17,6,Stan Marsh,"If you wanna suck farts, Kyle, that's fine. Go ahead. But you can't suck farts and be a dick about it."
1410,17,6,Kyle Broflovski,I'm actually the complete opposite.
1411,17,6,Stan Marsh,All of a sudden you seem to think you're above everyone else!
1412,17,6,Kyle Broflovski,"I'm not better, I'm just... doing what needs to be done to make the world a better place."
1413,17,6,Stan Marsh,See? You sound like a dick.
1414,17,6,Kyle Broflovski,[thinks a bit] I happen to be the one person who's putting everyone else's needs before their own!
1415,17,6,Stan Marsh,"Dick! That's a dick talking! You've had too much of Cartman's farts and you got sulphur poisoning, and now you're a dick."
1416,17,6,Kyle Broflovski,"All you need to know is I'm way awesomer than you think, okay?!"
1417,17,6,Stan Marsh,I don't think Kyle really loves Cartman's farts. There's something else going on.
1418,17,6,Kenny McCormick,(Huh? Like what?)
1419,17,6,Stan Marsh,"This all started with the stupid peace in the Middle East, Kenny. For some reason it's making Kyle crazy. We've gotta get to the bottom of this!"
1420,17,6,Rabbi 1,"And now, let us honor the little boy who helped make all this happen, Eric Cartman, and his best friend, Fartboy. [Cartman and Kyle come out onstage to great applause. The rabbi gives Cartman the mic]"
1421,17,6,Eric Cartman,"Thank you everyone. It's my honor to have been a part of this... miracle. Isn't that right, Fartboy?"
1422,17,6,Kyle Broflovski,Could I please one of your piping-hot farts in my mouth?
1423,17,6,Eric Cartman,"Are you sure, Fartboy? I've had a lot of strange food on this trip."
1424,17,6,Kyle Broflovski,Yummy yummy I want your farts in my tummy.
1425,17,6,Rabbi 1,"Uh excuse me, I'm sorry everyone, but apparently there's some breaking news in the United States."
1426,17,6,Reporter,"We are in Colorado where the red cow was discovered, and apparently, two boys have shocking news that might change everything."
1427,17,6,Stan Marsh,"Yes, there's something that you all need to know. The truth about the red cow. We have all been [Stan's phone rings] So- sorry, hang on. [pulls the phone out of his jacket pocket and answers it.] Hello?"
1428,17,6,Kyle Broflovski,Dude! Do not do this!
1429,17,6,Stan Marsh,"No, dude, you don't understand. Cartman hasn't been telling the truth!"
1430,17,6,Kyle Broflovski,"Yes, I know that! Why do you think I've been putting up with his farts?!"
1431,17,6,Stan Marsh,Ohhhhhhhhhhhhhhhh.
1432,17,6,Muslim 2,"""Oh"" what? [an Israeli throws up his hands in a shrug]"
1433,17,6,Kyle Broflovski,"I know Cartman made it all up, okay?! I also know that nothing is more important for humanity than peace in the Middle East! I'm okay with this, Stan!"
1434,17,6,Stan Marsh,"Well, I'm not okay with it, 'cause it's turned you into a dick, Kyle!"
1435,17,6,Kyle Broflovski,"I'm not a dick, I'm like Gandhi!"
1436,17,6,Stan Marsh,"You know, I don't think when Gandhi starved himself he was all ""Dude, look how fuckin' awesome I am for starving. Check me out!"""
1437,17,6,Kyle Broflovski,"Okay, okay. Stan, you're right. Maybe I let being a martyr go to my head. Just please, let me stay on this path, and, I'll try to be cool about it. Okay? I'm sorry."
1438,17,6,Stan Marsh,You should apologize to Kenny too.
1439,17,6,Kyle Broflovski,"I'm sorry, Kenny!"
1440,17,6,Kenny McCormick,"(That's okay, Kyle.)"
1441,17,6,Rabbi 1,"No, what is the new information?!"
1442,17,6,Stan Marsh,The red cow... I saw it too. Ih it came down from the sky in a flash of light. It was a miracle.
1443,17,6,Kyle Broflovski,Hurray!
1444,17,6,Rabbi 1,"Oh no, it was a miracle?"
1445,17,6,Israeli 2,"Then, it's not true. The prophecy is not true! [rounds of disappointment as everyone starts leaving]"
1446,17,6,David Lee Roth,"Wait, I thought we were all here because of the prophecy of a miraculous red cow!"
1447,17,6,Rabbi 5,"No, the prophecy is that one day, a fat child with a small penis would decorate a cow to look ginger, not that one would miraculously just fall from the sky. [Kyle is stunned that Cartman fulfilled that prophecy]"
1448,17,6,Muslim 2,I knew this was all too good to be true!
1449,17,6,Bishop,We are associating with these heathens for no reason!
1450,17,6,Eric Cartman,Small penis?!
1451,17,6,Anchor,"The party's over. Muslims, Jews, and Christians are back at each other's throats, and Israel is once again a place of conflict, and turmoil"
1452,17,6,Kyle Broflovski,"Please, you have to listen to me! The prophecy actually did come true!"
1453,17,6,Rabbi 3,No it di'n't.
1454,17,6,Kyle Broflovski,Yes! It did!
1455,17,6,Rabbi 1,The prophecy was that a fat boy with a small penis would one day decorate a cow to look ginger. We should have known a prophecy like this... was too impossible to ever come to be.
1456,17,6,Kyle Broflovski,"But that is what happened! It is! Tell them, Cartman!"
1457,17,6,Eric Cartman,"No, Kyle, you were right. I see now that little lies can cause huge problems."
1458,17,6,Kyle Broflovski,But it's the truth!
1459,17,6,Eric Cartman,"No, it's not, Kyle. I have a huge dick."
1460,17,6,Rabbi 1,"Sorry boys, but we've gotta get to our fight. There's a rumble at the Wailing Wall. [brings out a switchblade. Rabbi 2 has a shot gun, while rabbi 3 carries a bat]. They leave, and Kyle turns around"
1461,17,6,Kyle Broflovski,Ssso it was all for nothing. The whole time I was... eating farts for nothing.
1462,17,6,Eric Cartman,"Cheer up, Kyle. I'm sure this isn't the first time someone who thought they were suffering for humanity was actually just sucking farts. Hey. How about we get a little dessert, help cheer you up? [puts his hand on his ass and farts on it, then puts whipped cream on it, with a cherry on top, and smothers it on Kyle's face. He then walks away. A few seconds later, the cherry falls off]"
1463,17,7,Guard 1,"The holiday season... is here, and Black Friday... is upon us. As you know, black Friday is the day shoppers go berserk for holiday deals. Last year, 26 people died, and 461 were seriously injured. [stops by a guard who lost his right arm, puts his right arm on the guard's left shoulder and closes his eyes for a moment, then moves on] This winter the mall is offering 80% off to the first thirty people in the store. [The guards shout out various responses] For you new recruits, perhaps you took this job to see just what the violence was like. [a closeup of a guard without a chin] Or perhaps you thought workin' Black Friday wouldn't be a big deal. [looks at Randy, who just smiles innocently]"
1464,17,7,Randy Marsh,I'm just trying to earn some extra holiday cash.
1465,17,7,Guard 1,[ominously] Or maybe you're just too stupid to realize what you've gotten yourselves into.
1466,17,7,Chief of Security,"That's enough! [the other guards turn to see him, an old guard with a scar over his left eye, and his back to them] Our only chance of surviving this year's sale is by sticking together! Those of you who signed up are to be... commended. [turns around] But I warn you: do not underestimate the battle that's about to take place outside those doors! [the other guards stay silent, and he turns towards the front entrance.] Winter is coming."
1467,17,7,Eric Cartman,"Good evening, sir. I'm calling together all the fighters of Zauron. I need to speak with Lady McCormick."
1468,17,7,Kenny McCormick,[looks around the living room] (She's not here right now.)
1469,17,7,Eric Cartman,"Please tell her there is to be a meeting in the Great Hall. I have found a way to get XBox Ones, and the fair Lady McCormick will want to hear about it."
1470,17,7,Eric Cartman,"Thank you all for coming. Prince Token, Sir Timmy of Blacklake, Lady McCormick [Kenny plays with the hair on his wig and mumbles coyly]. Warriors, we have fought many great battles together. At Clyde's house. At Scott Malkinson's house. But soon we will be fighting the greatest battle of our young hot lives. Winter is coming, and the next gen gaming devices are hitting the shelves."
1471,17,7,Clyde Donovan,Which nobody can afford.
1472,17,7,Eric Cartman,What if I were to tell you that if we all worked together there's a way we can get the new gaming system.
1473,17,7,Token Black,"If you know of a way, wizard, then speak."
1474,17,7,Eric Cartman,"I have learned of a dark magic at work. The day after Thanksgiving, the first thirty people inside the mall get 80% off whatever they want. They are calling it... Black Friday."
1475,17,7,Butters Stotch,"Woo, spooky."
1476,17,7,Craig Tucker,"Black Friday? Come on, that can't be real."
1477,17,7,Eric Cartman,"It is real, Craig! I saw it on the news, butthole!"
1478,17,7,Stan Marsh,[stands on his chair] It is real. They do it every year. But everyone in town tries to be the first inside the mall on Black Friday. What chance do we have?
