,season,episode,character,line
569,17,3,Worker 4,"[walks up with a book] Sir, you'd better look at this. This was found in the airport lavatory. It seems to be a survival guide of some kind."
570,17,3,Captain and his workers,Survival of what?
571,17,3,Worker 4,"From the looks of it, a contagion outbreak of the worst kind. [the book shows a page of black zombies attacking everyone else]"
572,17,3,Captain and his workers,Oh my God.
573,17,3,Pilot and Copilot,"DA43 to tower, please advise! [hangs up the mic] Damnit! They aren't telling me anything!"
574,17,3,Pilot and Copilot,Do you think it's a virus?
575,17,3,Pilot and Copilot,"Virus, bacteria, either way we're all dead! Find out if he thinks it's safe to land in Los Angeles."
576,17,3,Pilot and Copilot,What about Los Angeles? Can we take the plane to Los Angeles?
577,17,3,Eric Cartman,Not a chance. By now most of the urban cities will be compromised. This whole things from city to city. We need to go somewhere the trend won't take hold. Like Iceland. [points to the island on a map.]
578,17,3,Pilot and Copilot,This plane won't make it to Iceland!
579,17,3,Passenger 3,"You got a better idea, asshole?!"
580,17,3,Eric Cartman,Everyone quiet! I have to think!
581,17,3,Tesla Driver,"Yes, let him think!"
582,17,3,Eric Cartman,"I can't think here. I need a magazine and a toilet. [heads off to the restroom. He sees the ""vacant"" sign and opens the door, only to see a black man on the toilet]"
583,17,3,Occupant,"Oh, I'm just finishing up."
584,17,3,Eric Cartman,"Nah! [shuts the door and jumps back, then throws everything he can at the door so the occupant can't exit]"
585,17,3,Occupant,Hey!
586,17,3,Eric Cartman,[running back to his seat] One of them is in the back!
587,17,3,Tesla Driver,What?!
588,17,3,Passenger 3,What do you mean?!
589,17,3,Pilot and Copilot,"Everyone just calm down! We have to stay in control! [the occupant is still trying to get out, and everyone on the plane faces the lavatory door. The occupant begins to grunt and growl]"
590,17,3,Passenger 4,"[at one of the doors] I won't become one of them! [forces it open. It rips away, and he flies out. Other things fly out behind them. The other passengers and crew hang on for dear life. The occupant finally exits the lavatory]"
591,17,3,Pilot and Copilot,"Shoot it! [instead of waiting for Cartman to shoot the occupant, he takes Cartman's gun and shoots him. The occupant ducks and the bullet ricochets a few times. It hits the ceiling, which causes an explosion.]"
592,17,3,Girls Skipping Rope,"Engine engine #9 running down Chicago Line, if the train should jump the track do you want your money back? [the plane appears and only Stan notices it falling to its doom]"
593,17,3,Butters Stotch,Yes.
594,17,3,Girls Skipping Rope,"Y-E-S spells yes- [the plane hits a mountain top, then breaks apart as it goes down the mountain.]"
595,17,3,Mr Mackey,"Now, Token, what you need to understand, m'kay, is that a school assembly is not the time and the place to be yellin' and causin' distractions. M'kay? If there's somebody causin' you problems, then we don't disrupt the assembly, m'kay. You come and you talk to me."
596,17,3,Token Black,He's just out looking for trouble.
597,17,3,Mr Mackey,"Well that's your side of it, Token, but you know Eric has his side as well. Have you thought about maybe writin' him a poem? M'kay? Write E- write Eric a poem, tell him how you feel. [smoke from the plane crash rises behind the mountains] You know, m'kay? Well I'm tellin' you, Token, you let it go, and he'll let it go, and it'll all be fine. Can ya?"
598,17,3,Tesla Driver,"No, the plane crashed. We're in the Colorado mountains somewhere. [the call drops] Matt? Matt?! [notices Cartman and walks up to him to explain] My husband. He said the outbreak was all over the news, but everything was totally fine where he was."
599,17,3,Eric Cartman,"Totally fine? Then it hasn't happened yet. Oh my God, we still have time!"
600,17,3,Pilot and Copilot,"[barely alive] Help! Help me! [Cartman runs up to him] Please, I have two little girls in Chicago. Please find them!"
601,17,3,Eric Cartman,It's okay. We have reason to believe it hasn't spread yet.
602,17,3,Pilot and Copilot,Then you have to stop it.
603,17,3,Tesla Driver,Yes!
604,17,3,Pilot and Copilot,And there must be... a Patient Zero... The person it all starts from.
605,17,3,Eric Cartman,His name is Token.
606,17,3,Tesla Driver,"We have to kill him, before he infects everyone else!"
607,17,3,Eric Cartman,I won't do it! He used to be my friend!
608,17,3,Pilot and Copilot,You have to! You have to be strong. If you can stop this- if you can save the world- then you have to do it. [coughs up blood] Promise me! Promise... me!
609,17,3,Eric Cartman,[sighs] Alright. I promise. I won't let the black people riot and destroy the world.
610,17,3,Pilot and Copilot,"Thank you-wait, what? [sits up, but dies a few seconds later]"
611,17,3,Tesla Driver,Oh my God! Oh my God!
612,17,3,Eric Cartman,We're gonna live through this! Do you hear me?!
613,17,3,Tesla Driver,Yes!
614,17,3,Eric Cartman,[takes her hand] Come on! [they leave the crash site]
615,17,3,Reporter,"First, a wave of 911 calls about a virus, and now a plane has apparently gone down in the Colorado Rocky Mountains. Is this the beginning of the end?"
616,17,3,Butters Stotch,Oh boy! Zombie apocalypse!
617,17,3,Reporter,"The government is looking for a Patient Zero, going only off of this sketch which was found in a notebook at the airport.
[Butters suddenly recognizes the person in the picture] Anyone with information regarding Patient Zero is asked to contact the authorities immediately."
618,17,3,Butters Stotch,Holy Moly.
619,17,3,Jimbo Kern,Can I help you?
620,17,3,Eric Cartman,Stay by the window! Tell me if anything changes! [walks up to the counter] I need something that can shoot with complete accuracy from a distance.
621,17,3,Jimbo Kern,"Alright, you want a rifle! [turns around and takes a rifle from the wall, then turns back and hands it to Cartman] well, like this .22 caliber. [Cartman looks it over, and Jimbo puts his hand on his hip] What is it you intend to shoot?"
622,17,3,Eric Cartman,A person. [the driver looks around]
623,17,3,Jimbo Kern,...You mean a person who's threatening you?
624,17,3,Eric Cartman,Threatening all of us!
625,17,3,Tesla Driver,"Please, please hurry! It's important!"
626,17,3,Jimbo Kern,"Well, you should be fine so long as the person breaks into your house and is an immediate threat to you."
627,17,3,Eric Cartman,What?! How am I supposed to get a person to break into my house?!
628,17,3,Jimbo Kern,"You can't shoot someone who threatens you just out on the street. Well unless of course you're in a state that has a ""stand your ground"" law."
629,17,3,Eric Cartman,Stand my ground?
630,17,3,Tesla Driver,Please! We're running out of time!
631,17,3,Jimbo Kern,"See now with a ""stand your ground"" law, you could legally shoot somebody that's threatening you whether they're in your house or not."
632,17,3,Eric Cartman,"Yes yes, that's what I need! I'll take that!"
633,17,3,Jimbo Kern,"No, no, see, you've gotta be IN a state with a ""stand your ground"" law, like Florida."
634,17,3,Eric Cartman,"[walks away from the counter] This is hopeless. How am I supposed to shoot Token with all these stupid rules?! [his eyes light up] Wait a minute. I can't shoot Token, [turns around] but I can shoot anyone I want in Florida?"
635,17,3,Jimbo Kern,So long as they're threatening you.
636,17,3,Tesla Driver,"What?! What is it, please?! Hurry, my husband might still be alive!"
637,17,3,Eric Cartman,The other way to stop the outbreak. Token isn't the only Patient Zero. The outbreak won't happen if... we shoot George Zimmerman. We have to get to Florida!
638,17,3,Eric Cartman,"Let's go, let's go! Let's move move move move! Let's go!"
639,17,3,Flight Attendant,This plane is going to Baltimore.
640,17,3,Eric Cartman,"If we don't get to Florida there's not going to be a Baltimore left! [everyone sits down] Black guy in the back! [the plane crashes into the Everglades. Cartman and the driver make it out of the wreckage] Alight, now let's find Zimmerman."
641,17,3,Eric Cartman,"Put this on. We have to stay hidden from here out. [hands her a black sweater, which she puts on as she walks onto the roadway]"
642,17,3,Tesla Driver,What are we going to do?
643,17,3,Eric Cartman,I'm going to flush out Patient Zero. And you're gonna shoot him. It's the only way.
644,17,3,Tesla Driver,What if he attacks us first?
645,17,3,Eric Cartman,"Don't worry, nobody can see us wearing black."
646,17,3,Tesla Driver,"I haven't had the time to thank you, for doing what you've d- [a Moov-It truck slams into her and carries her body away. Cartman is confused]"
647,17,3,Mom,"[serving pancakes] Eat your breakfast, girls. [turns around to put the pan back on the stove]"
648,17,3,Older Daughter,Where's Daddy?
649,17,3,Mom,You can eat without your father in the room. Now hurry. [the girls giggle and the older one notices someone]
650,17,3,Older Daughter,Daddy!
651,17,3,George Zimmerman,"Good morning, girls. [walks in fully dressed, with a cup of coffee already in hand.] Save Daddy any pancakes? Look at that? Six A.M. and my family is already smiling. [Mom walks over and kisses him]"
652,17,3,Mom,"How did I get such a perfect husband, Geroge Zimmerman?"
653,17,3,George Zimmerman,And how did I get such a beautiful wife?
654,17,3,Older Daughter,"I love you, Dad."
655,17,3,George Zimmerman,"I love you too, Princess. I love both of you, equally."
656,17,3,Mom,"Nothing can ever go wrong, so long as we all have each other."
657,17,3,Reporter,"[on TV] Is there any hope for stopping the zombie apocalypse? [George Zimmerman turns around to see the news] CNN has just received word that the government has learned the identity of Patient Zero. [the drawing of Token is shown] The nine year old threat to humanity has been tracked down, and measures are being taken to stop him."
658,17,3,Younger Daughter,"Daddy, what's a Patient Zero? [a knock is heard at the front door. George Zimmerman turns left and walks to the front door. He opens it and two federal agents face him]"
659,17,3,Agent 1,"Hello, Mr. Zimmerman. Your country needs you."
660,17,3,George Zimmerman,What do you need from me?
661,17,3,Agent 1,We... [holds up a photo of Token] need you to shoot a young African-American for us.
662,17,3,George Zimmerman,[turns and walks away] I gave that up.
663,17,3,Agent 2,"You're the best, Zimmerman. We just need you to do it one more time, for the security of the world!"
664,17,3,George Zimmerman,"Damnit, I have a wife and kids now."
665,17,3,Agent 1,"Then do it for your family! [Cartman appears on the sidewalk, wearing black face paint and a black sweater] This is about protecting people, Zimmerman! Keeping our streets safe so that our children are free to go out... [his voice trails off as Zimmerman focuses on something else]"
666,17,3,George Zimmerman,Something's wrong. [quickly turns around and sees the stranger] Look out! [grabs the gun from one of the agent and fires it twice. Cartman's arm gets hit by a bullet and he falls to the ground]
667,17,3,Agent 1,"My God, I didn't even see him. [the other agent walks over to the body]"
668,17,3,Agent 2,"Nice work, Zimmerman. [George turns and walks over to his family]"
669,17,3,George Zimmerman,Are you guys okay?
670,17,3,Older Daughter,"What was that, Daddy?"
671,17,3,George Zimmerman,More needless violence.
672,17,3,Agent 1,"Nonsense, you did what you had to. You're a hero."
673,17,3,George Zimmerman,"That may be true, but I'll have to live with this the rest of my life. Even though I'll be walking around a free man."
674,17,3,Agent 2,"[notices the paint coming off Cartman's face] Hey, wait a minute. This kid isn't black, he's white."
675,17,3,George Zimmerman,"Wait, what?"
676,17,3,Judge,Guilty!
677,17,3,Reporter,"The zombie apocalypse... is over. All the panic, crashing planes and chaos appear to have, for some reason, died with George Zimmerman. And as for the little boy who was so mercilessly gunned down? [a picture of Cartman smiling appears, his left shoulder in a bandage, his right hand giving a thumbs up] Although he survived the shooting, his wishes are to remain anonymous, giving the hospital only the nickname... ""Brad Pitt."" ...But cooler."
678,17,3,Stan Marsh,That sure wasn't much of a zombie apocalypse.
679,17,3,Kyle Broflovski,"Yeah, that sucked."
680,17,3,Butters Stotch,"Well, at least I'll bet Token's glad it's over with. Aren't you, Token? [Token just stands up, looks at the other guys, and walks out. Butters' smile fades]"
681,17,3,Eric Cartman,Hey Token. ...Sup bro? ...How's it goin' dude? I know how it feels now.
682,17,3,Token Black,You made everyone think I'm a fucking Patient Zero!
683,17,3,Eric Cartman,"Dude, I'm saying I'm sorry."
684,17,3,Token Black,So what?!
685,17,3,Eric Cartman,"Uh oh. [brings forth a can of red spray paint and paints a red circle around himself in the middle of the street] Sounds like you're still angry, Token."
686,17,3,Token Black,Fuck you!
687,17,3,Eric Cartman,"Alright Token, come on! This is ridiculous. I know you totally wanna kick my ass right now. You'd like to walk right up and punch me in the face, but what's that gonna solve? I've got a way better idea. [makes a fist with his right hand and puts it forth] First bump? [Token stays put] Come on dude, fist bump. Bump that shit bro. Be the bigger person. [Token walks up to the red circle, then bends forward and offers his left fist. Then he steps into the circle and Cartman quickly shoots him]"
688,17,3,Token Black,Oh! [falls on his face]
689,17,3,Eric Cartman,"That was, he was on my ground. You all saw that, right? Everything inside the red line is mine. [drags Token's body into the circle] Inside the red line is, that's- that's my ground. He was on it. [smiles when no one answers.]"
690,17,3,Gerry s Daughters,Daddy!
691,17,3,Gerry,What's up girls? Daddy did it!
692,17,3,Eric Cartman,Ugh! Oh man. The ending to that movie was so terrible.
693,17,3,Kyle Broflovski,You're having nightmares about the ending to World War Z again?
694,17,3,Eric Cartman,Yeah. So bad.
695,17,3,Kyle Broflovski,That's what bothering you? Not the fact that you're a murderer?
696,17,3,Eric Cartman,"Jury found me innocent, Kyle!"
697,17,3,Kyle Broflovski,You're a murderer.
698,17,3,Eric Cartman,You interrupt people when they talk.
699,17,3,Mr Mackey,[over the PA system] Eric Cartman to the counselor's office please.
700,17,3,Eric Cartman,Oh man! [walks out of the room]
701,17,3,Eric Cartman,Oh boy.
702,17,3,Mr Mackey,"Have a seat, Eric. Now boys, I for one am sick and tired of this little feud you're having, okay? This has clearly gone too far, and you owe each other an apology or you're gettin' detention!"
703,17,3,Token Black,An apology?! He shot me!
704,17,3,Mr Mackey,"Well he was technically standing his ground, Token."
705,17,3,Eric Cartman,"Yeah Token, that's the law! Everything inside the red line is lava."
706,17,3,Token Black,[stands on his chair] Well it's a pretty fucking stupid law!
707,17,3,Eric Cartman,"Token, calm down."
708,17,3,Token Black,And why does standing your ground not apply to fucking white people?!
709,17,3,Eric Cartman,"Oh God, here we go again! [runs out of the office in a panic]"
710,17,4,Henrietta,"So I cast my body into the trails of blood.
The knife pierces deep, deep into my lonely eyes.
So I can see this black world... no more."
711,17,4,Pete,"Whoa... That's pretty hardcore. [taps some ashes off his cigarette into his ashtray, then flips his hair]"
712,17,4,Michael,That's real pain right there. [taps some ashes off his cigarette into his ashtray]
713,17,4,Henrietta,"That's how I feel, when my mother abuses me. I just wanna escape, to she can't hurt me anymore. [Mrs. Biggle knocks three times on Henrietta's door, then opens it]"
714,17,4,Mrs Biggle,"[sing song] Henrietta, sweetie."
715,17,4,Henrietta,"[glares at her] Shut up, Mom! Go away!"
716,17,4,Mrs Biggle,"Oh, but remember, Daddy wanted to talk to you in the living room, my dark little princess."
717,17,4,Henrietta,Stop calling me a princess! I'm not a beauty queen in a Disney movie!
718,17,4,Mrs Biggle,We'll be waiting in the living room.
719,17,4,Henrietta,"[rolls her eyes] God, she just never stops!"
720,17,4,Mrs Biggle,Oh goodness I am so nervous. [Henrietta enters the living room]
721,17,4,Henrietta,What?!
722,17,4,Mr Biggle,"Have a seat, Henrietta. [Henrietta sits on the chair]"
723,17,4,Mrs Biggle,"Oh, a little family chit-chaaat."
724,17,4,Henrietta,"Shut up, Mom!"
725,17,4,Mr Biggle,"Henrietta, as you know, your mother and I have been concerned about your behavior for some time."
726,17,4,Henrietta,Are we really doing this again?!
727,17,4,Mr Biggle,"We've had a hard time coping with the dark things you're into, but we've finally had some counseling, and apparently we're not the only parents who have a child that is... emo."
728,17,4,Henrietta,What?!
729,17,4,Mrs Biggle,"But Daddy and I love our little muffin, even if she's emo or not."
730,17,4,Henrietta,I'm not a fucking emo! Don't you even know the fucking diff!
731,17,4,Mr Biggle,Do you know how your foul language breaks your mother's heart?
732,17,4,Mrs Biggle,Like calling Mommy Demon Jizz.
733,17,4,Mr Biggle,"So listen, sweetie, we've found a camp. [her mom brings out a brochure]"
734,17,4,Henrietta,Noo...
735,17,4,Mr Biggle,"A camp which is for troubled kids like you, and you get to work outside and learn about responsibility."
736,17,4,Henrietta,"[stands up, ready to leave the room] I'm not going to any fucking camp!"
737,17,4,Mr Biggle,"It's for two weeks, and when you come back we can talk about earning back some of your privileges."
738,17,4,Henrietta,I won't come back because I'll be fucking dead. I'll walk out of that camp and I'll walk the streets until I probably get picked up and gangbanged by criminals until I'm bleeding out my fucking eyes!!
739,17,4,Mrs Biggle,Theeeey have a horseshoe pit where you can challenge the other kids to horsehoooes.
740,17,4,Pete,And that's all you know? what else did she say?
741,17,4,Michael,She said that her parents called her an emo and she had to go to this camp for two weeks.
742,17,4,Pete,"[flips hair] Oh my God, for two weeks?"
743,17,4,Firkle,Is she at the camp now?
744,17,4,Michael,"I don't know. [scrolls through his text messages] She texted from the bus they put her on, then she said she wasn't even allowed to have her cell phone where she was going. Then all of a sudden her texts went dark."
745,17,4,Pete,[softly] Whoa...
746,17,4,Firkle,That's fucking creepy man.
747,17,4,Michael,[gets up and walks a bit] I just can't believe it. I can't believe parents would do that to their child.
748,17,4,CPS Worker,"Alright now, you say that you witnessed your friend being abused by her parents."
749,17,4,Michael,Yes. They called her an emo.
750,17,4,CPS Worker,What's wrong with that?
751,17,4,Michael,"Emos suck! Their vile, self-pitying, depressed assholes!"
752,17,4,CPS Worker,"So, why do you think they called her that?"
753,17,4,Michael,"Because she's Goth, and some ignorant people don't know the difference!"
754,17,4,CPS Worker,What is the difference?
755,17,4,Pete,Oh my God! They're totally different!
756,17,4,CPS Worker,"Okay, different how?"
757,17,4,Pete,"They're achm, you know, one is good and an' emos are horrible! [flips hair] You're, you know... They're posers!"
758,17,4,Firkle,Emos suck my Goth balls.
759,17,4,Michael,"Alright alright, think of it this way: a goth believes that deep down the world is totally fucked up. But an emo thinks that deep down, they are totally fucked up."
760,17,4,CPS Worker,That's not much of a difference.
761,17,4,Pete,That's a huge fucking difference!
762,17,4,Michael,"Okay okay, look, emos are more prone to suicide."
763,17,4,Pete,"This fuckin' bitch, man."
764,17,4,Michael,But goths are more prone to be depressed that so many people commit suicide
765,17,4,Pete,Goth's darkness is nihilistic whereas Emo's is cynical.
766,17,4,Michael,"Wait, I thought we were cynical. ...What what whatever, it doesn't matter."
767,17,4,Pete,"No, see, you're nihilistic."
768,17,4,Michael,"Oh yeah, you're right."
769,17,4,Henrietta,"Hel-lo?! Somebody let me out of here! You can't treat people like this! [notices the camera and looks at it.] This is fucking ridiculous! What's wrong with you?! I'm gonna go to the fucking cops when I get out of here! [the floor opens up behind her. She turns around to see what's going on, and a plant rises into the room. She looks at the plant, puzzled. It begins to shake like a rattle, then stops]"
770,17,4,Pete,"What if she comes back, and she's all preppy and conformist?"
771,17,4,Michael,She's only been there two weeks. They can't have changed her that much. Can they have? [the bus arrives and they all turn to look at it stop. The rear doors open and they look in. Henrietta appears and they gasp.]
772,17,4,Firkle,"Oh. My. God. [Henrietta steps off, and boy has she changed!]"
773,17,4,Henrietta,"Hey guys. [she now wears a green headband, pink highlights in her hair, and additional pink makeup around her eyes. The left eye is made to look as though it's been crying. Her gloves are pink and black and instead of her cross necklace, she wears a necklace where the pendant is shaped like a bat]"
774,17,4,Pete,What the hell have they done to you?
775,17,4,Henrietta,What do you mean? They couldn't do anything. They can't fix me. They don't even understand me. [walks away. The other three move a bit to get a better look at her leaving]
776,17,4,Michael,Oh my God it's worse than we thought! They made her emo!
777,17,4,Michael,[concerned] Has she said one word to either one of you guys?
778,17,4,Pete,Nothing. It's like she's a totally different person. [flip]
779,17,4,Michael,"She won't even look at us. All she does now is hang out with the douchebag emo kids. [the camera pans right, across the aisle, and shows Henrietta with her new friends, the Emos]"
780,17,4,Emo Boy,"God, PE class is for such wannabe posers."
781,17,4,Emo Girl,I'd rather kill myself than put on gym shorts.
782,17,4,Henrietta,"I wish there would just be an earthquake, so we could all die."
783,17,4,Pete,"Uugh, how could she hang out with them??"
784,17,4,Michael,There must something else going on here.
785,17,4,Henrietta,Not now Mom! I'm suicidal!
786,17,4,Michael,"[enters] It's not your mom, it's me."
787,17,4,Henrietta,"Oh, hey. [lowers the volume.]"
788,17,4,Michael,What did they do you you? At that camp?
789,17,4,Henrietta,What do you mean? Just the usual group therapy crap.
790,17,4,Michael,"Don't take this the wrong way, but I think that place turned you into an emo."
791,17,4,Henrietta,"That's ridiculous. I'm not anything. I don't fit in anywhere. I'm not emo, okay?"
792,17,4,Michael,"Then why are you listening to Sunny Day Real Estate? [she sits up and then turns off the iPod] I was thinking, maybe they just made you confused at that place. Maybe they didn't know what they were doing. But then I started thinking, maybe that place... turned you emo on purpose. Like maybe they knew what they were doing."
793,17,4,Henrietta,"[getting cross, then turns her chair around slowly] You should probably stop digging for answers."
794,17,4,Michael,What?!
795,17,4,Henrietta,There's no winning this for you. [gets off her chair and walks towards him] Soon the entire world will be emo. It is our time.
796,17,4,Michael,Nooo waaaaay.
797,17,4,Henrietta,Nobody understands us. And they won't understand until it is faaar tooo late.
798,17,4,Michael,Omigodnowaaaaaaaaay.
799,17,4,Henrietta,"Do not fight it, Michael. Is being emo really all that different from being goth? [sataniccally] Join us!"
800,17,4,Michael,[runs out of the house] No waaay! [runs out of the house and across the street and throws his cane away to the ground] No way no waaaaaay!
801,17,4,A ring tone,Death and despair! Death and despair! Death and despair! Death and desp-
802,17,4,Pete,[answers it] Hello?
803,17,4,Michael,It's worse thann we thought.
804,17,4,Pete,What is? Everything? [flips hair]
805,17,4,Michael,"No! I mean Henrietta. I confronted her and she was all like ""I am emo! And emos are going to rule the world"" and I was like ""No waaay!"" and she was like ""Yeah, soon it will be too late."" and I was all ""No waaay!"""
806,17,4,Pete,No way.
807,17,4,Michael,"Yeah, so listen: call up Firkle and meet me at Village Inn. I gotta run home, but I'll be there in ten minutes. [rushes home and closes the front door, then runs up the stairs.]"
808,17,4,Michael's Mom and Dad,Michael! Michael! [Michael leans over the rail]
809,17,4,Michael,"Can't now, Mom! I've got an emergency!"
810,17,4,Michael's Mom and Dad,"In the dining room Michael! Let's go! [Michael goes down reluctantly and enters the dining room] Have a seat, son. [Michael takes a seat opposite his dad.] Your mom and I have decided you're going to go away for a little while."
811,17,4,Michael,What??
812,17,4,Michael's Mom and Dad,[holds up the same brochure Mrs. Biggle held up two weeks earlier] We've been put in touch with this camp for troubled kids like you and-
813,17,4,Michael,What the hell are you talking about?!
814,17,4,Michael's Mom and Dad,"This place gonna fix you, make you normal child! [moments later his dad takes him outside and toward the truck]"
815,17,4,Michael,"No! You've gotta listen to me! You don't know what you're doing!! [Dad throws him into the car] You fucking conformists! [the truck starts up and backs out of the driveway. Michael looks across the street and sees Henrietta with her emo friends, two of whom are new. He gasps. As the truck pulls away he screams through the closed window] They're evillll!"
816,17,4,Pete,I never thought it would end like this. I never thought that Goths would just be slowly replaced by Emos.
