,season,episode,character,line
247,18,7,Steve,"Hello, Customer Service, this is Steve."
248,18,7,Steve,"Hello, this is Steve with Customer Service."
249,18,7,Steve,"Uhhh, nononono my friend. I am Steve with Customer Service."
250,18,7,Steve,"Listen, my friend. This is gong to be very hard to comprehend, but none of what you are seeing is real."
251,18,7,Steve,"...Ohhh, nohhh, nonononononono."
252,18,7,Steve,"My friend, my friend, a customer who is in virtual reality called Customer Service, and it has created a customer feedback loop. Okay? Here in India we call it a customer feedback vindaloop."
253,18,7,Steve,"[slowly, wagging his left index finger] Ohhh, fuck you!"
254,18,7,Steve,"Nononononono, do not fuck me, because I am you and then we will just be fucking ourselves. Now, have I provided answers to your questions in a courteous and prompt fashion?"
255,18,7,Steve,What do you mean have you answered all my questions?! NO! You have not answered ANY questions at ALL!
256,18,7,Steve,"Nonononono no, listen, listen: if I didn't answer your questions, then we have given bad customer service!"
257,18,7,Steve,But you didn't answer any of my questions!
258,18,7,Steve,"Well what is more important, my friend? The result, or good customer service?"
259,18,7,Butters Stotch,"[singing a spiritual] I'm troubled, I'm troubled in mind. If Jesus don't help me I surely will die. [his door opens and Stan, Kyle, and Cartman come in]"
260,18,7,Stan Marsh,Butters.
261,18,7,Butters Stotch,[startled] Huh. But... [stands up] you guys can't be here.
262,18,7,Kyle Broflovski,Why not?
263,18,7,Butters Stotch,Because I'm grounded. That means no visitors.
264,18,7,Kyle Broflovski,Butters! When did you call Oculus Rift Customer Service?!
265,18,7,Butters Stotch,"When we were playing with the Oculus headset. Wuh don't you guys remember? [goes to the bedroom door] We were all messin' around with it. I played with it first, and, and went a little nuts. Uh I forgot I was in virtual reality and I got grounded, and now I'm grounded in real life."
266,18,7,Stan Marsh,So now we are in th real world.
267,18,7,Butters Stotch,YES.
268,18,7,Eric Cartman,"You guys! [the boys look at him] I have accepted the reality that I am just a computer program. The fact is that one of us right now is in a room wearing a VR helmet seeing all this, and it's not me!"
269,18,7,Stephen Stotch,[appears behind him] Butters!
270,18,7,Butters Stotch,[really startled] AAaaghagh!
271,18,7,Stephen Stotch,What are your friends doing here?!
272,18,7,Butters Stotch,Huh I'm sorry Dad!
273,18,7,Steve,"Hello, hello my friend, are you still there?"
274,18,7,Stan Marsh,"Yes, we're here."
275,18,7,Steve,"Listen carefully, my friend. You are stuck in a paradox. It turns out there are three things you cannot do in virtual reality. You cannot die, you cannot get grounded, and you cannot call Customer Service. This is why you are having problems."
276,18,7,Stephen Stotch,"You just don't get it, do you?! What is wrong with you?!"
277,18,7,Stan Marsh,"[as Stephen chews Butters out, puts some distance between them and himself] Well then how much of what just happened was in virtual reality?"
278,18,7,Steve,That does not matter! There is only one thing that matters!
279,18,7,Stan Marsh,"What?! [Stephen unbuckles his belt, Butters holds a hand up]"
280,18,7,Steve,Have I answered your questions satisfactorily and offered GOOD CUSTOMER SERVICE?!
281,18,7,Stan Marsh,"That doesn't make sense! [Stephen takes his belt off. Butters closes his eyes, knowing what's coming]"
282,18,7,Steve,"That's the paradox! Please my friend, please! I am not real! You are not real! Have I answered your questions and provided good customer service?! This call may be recorded! [the boys look at Stephen and Butters as Stephen prepares his belt for a whipping]"
283,18,7,Stephen Stotch,Well you're getting it now!
284,18,7,Stan Marsh,"Yes! Yes, you have answered all my questions and I am pleased with the customer service I have been provided!! [Stephen disappears, then Butters, then Kyle, then Cartman] You guys? Are you there?"
285,18,7,Kyle Broflovski,[from a walkie-talkie] We're right here dude. Do you remember now?
286,18,7,Stan Marsh,Yeah I remember. I'm heading back to the access point. [leaves Butters' room. Stephen and Linda never really left the dining room table/ Stephen senses a change in mood]
287,18,7,Stephen Stotch,Oh my gosh! Linda!
288,18,7,Linda Stotch,"What is it, Stephen?"
289,18,7,Stephen Stotch,It's Butters. He's not grounded anymore.
290,18,7,Linda Stotch,He's not?
291,18,7,Stephen Stotch,"No. I've I've got to tell him! [leaves his chair and runs up to Butters' room] Butter? Butters! [Butters is on his bed, with the curtains open, asleep]"
292,18,7,Butters Stotch,"[wakes up] Ahhh, huh?"
293,18,7,Stephen Stotch,"You can go outside and play, son."
294,18,7,Butters Stotch,"You... you, you mean ih... [sits up] I'm not grounded?"
295,18,7,Stephen Stotch,"No. I don't know why or how, but... it's over."
296,18,7,Butters Stotch,They did it! [hops off his bed] They figured it out! [heads out the door] Whoopie!
297,18,7,Stan Marsh,"Alright, I'm nearing Checkpoint Alpha. You guys still there?"
298,18,7,Kyle Broflovski,We're here dude. Just a little further and we can finally end this.
299,18,7,Stan Marsh,"[goes upstairs and enters Cartman's room] Okay, I'm back in Cartman's room."
300,18,7,Eric Cartman,"Alright Stan, just sit down at the computer. [Stan does this]"
301,18,7,Kyle Broflovski,"Alright, dude, take off the headset. [Stan reaches up and removes the headset. At this point the animation switches to live-action. Stan finishes taking off the headset as Cartman, Kyle, and Kenny watch]"
302,18,7,Kyle Broflovski,"Sssoo aside from all the bull crap, what do ya think of the Oculus?"
303,18,7,Stan Marsh,"[thoughtfully looking at the headset] It's pretty cool, but the graphics suck."
