,season,episode,character,line
198,18,6,Satan,"You know, they all do it, and it's kind of my deal, I have to put temptation out there too, so people have free will and all that shit. But ,you know, everyone has their justification and thinks what they're doing is okay."
199,18,6,Voice Notification,"*Ding* Ey, buddy, where'd you go? Don't you want more Canadough?"
200,18,6,Satan,What's this?
201,18,6,Stan Marsh,"That's what I've been addicted to. It's a freemium game sending me push notifications. [Satan taps the screen, stands up, and plays the game]"
202,18,6,Satan,"What, you just collect coins?"
203,18,6,Announcer,How much money can you buy today?
204,18,6,Satan,"No, see, if something's addictive because it's fun, that's one thing. But this is just blatant Skinner box manipulation. Wait a minute. Who put this out?"
205,18,6,Stan Marsh,"Ah, Canada?"
206,18,6,Satan,"Oh that son of a bitch! He's always doing this shit! I tell him, ""temptation has to be nuanced!"" but he goes and does this crap again! I'm gonna need to borrow your soul real quick, kid. Is that alright?"
207,18,6,Stan Marsh,...Okay. [Satan proceeds to possess Stan] Aaaaahhh!
208,18,6,Randy Marsh,Oh pass interference! Interference! [points at the TV. Stan walks by]
209,18,6,Sharon Marsh,"Stan, where are you going? [Randy looks over]"
210,18,6,Stan Marsh,[with Satan's voice] I shall return. Do not attempt to stop me. [continues out the door]
211,18,6,Randy Marsh,Told ya. Kid's got demons. I don't do that. [Sharon looks at him]
212,18,6,NC 9 Reporter,"Horror and sadness all over Canada tonight. When the Prince signed the agreement to make a freemium game, he apparently made a deal with the Canadian Devil."
213,18,6,Minister of Mobile Gaming / Beelzeboot (Canadian Satan),"[flies up to the microphone] Hey, guy, I'm the Canadian Devil. [lets out a flaming turd and flies back into the Department]"
214,18,6,NC 9 Reporter,"The Canadian Devil now has complete control of the soul of every Canadian. This is a sad day for Canada, and therefore, the world. [Beelzeboot goes to torture Terrance, Phillip, and the Prince, who now hang from chains tied to the ceiling]"
215,18,6,Minister of Mobile Gaming / Beelzeboot (Canadian Satan),"Heh heheheh, I stab you. [Satan, now in Stan's body, appears outside the meeting room and blows the doors off, then walks in]"
216,18,6,Satan,Beelzeboot! Once again you lack any sense of nuance!
217,18,6,Terrance & Phillip,Who the fuck is that?
218,18,6,Minister of Mobile Gaming / Beelzeboot (Canadian Satan),"Well well, my overachieving doppelganger! You're no match for Canadian Satan! [lets out a flaming turd]"
219,18,6,Satan,"Return from whence you came! [purple balls of energy appear around his hands, and they produce two beams of flame which carry Beelzeboot out into the sky]"
220,18,6,Minister of Mobile Gaming / Beelzeboot (Canadian Satan),"Ow! Watch it, guy! [the battle continues in the sky]"
221,18,6,NC 9 Reporter,"Sadly, a shocking turn of events here as the actual Devil has now appeared and seems to be fighting the Canadian Devil! This is certainly a conundrum for Canadians everywhere as we try to figure out who to root for. For that, let's ask the Minister of Sports in Edmonton. [The Canadian Minister of Sports appears on split screen]"
222,18,6,Minister of Sports,"Well of course, the patriotic thing to do would be to root for the Canadian Devil. But then again, he is the one who has promised us pain and servitude for a million years."
223,18,6,Canadian,"Screw that, go Canada!"
224,18,6,Satan,"Enough, Beelzeboot! Thy end has come. [the balls of energy reappear and this time he aims the flames down at Beelzeboot. He destroys the Department in the meantime. Flaming skulls appear and go back into the pit Satan created]"
225,18,6,Kyle Broflovski,Hey dude.
226,18,6,Stan Marsh,Hey.
227,18,6,Kyle Broflovski,Y-you alright?
228,18,6,Stan Marsh,"Yeah. Yeah, I think I'm gonna be okay. [turns away and walks off the court]"
229,18,6,Eric Cartman,Cool.
230,18,6,Prince,"My fellow Canadians, what we do now as a country will hopefully be a model for others. We have all learned a tragic lesson together: that though many sins are out there, when you get involved with freemium gaming, you are making a deal with the Canadian Devil. We will no longer make freemium games, and we will no longer make improvements to our country with money taken from addicts. Canada is back to being an ethical, respected, shitty tundra. [cheers erupt from the crowd]"
231,18,6,Stan Marsh,"I'm gonna move here and here, and then I'm gonna roll to kill this zombie."
232,18,6,Marvin Marsh,"Well okay, good idea. [Stan rolls the dice]"
233,18,6,Randy Marsh,[stops by with an ornate silver cup] What are you gaywads doin'?
234,18,6,Stan Marsh,"We're playing board games, so that Grandpa avoids the casino and I avoid freemium apps."
235,18,6,Randy Marsh,"Well all right! Good for you guys. Tell you what, I'll join you. Board games go good with a glass of wine. [takes a seat]"
236,18,6,Stan Marsh,"That's not a glass, that's a trophy, that you won, for drinking."
237,18,6,Randy Marsh,"It's not drinking. It's called a White Zinfandel Sipping Sprint, and it's competitive. Get off your high fuckin' horse."
238,18,6,Stan Marsh,"Your turn, Grandpa. If you roll a five or a six, you can kill these zombies. [Marvin takes the dice and rolls them]"
239,18,6,Randy Marsh,You guys wanna put some money on it? [Stan bangs his head on the table.]
