,season,episode,character,line
218,12,11,Michael Chertoff (Guinea Pirate),"Argh, curse ye, Craig. Dar, argh. [the guinea pirate falls on its back and the beams turn off. The slabs go back into the pillar and the pillar rotates back into the ground. The four boys approach Craig, stunned at what just happened. Craig lets out a big sigh of relief]"
219,12,11,Craig Tucker,"My name is Craig Tucker. Last week I stopped a guinea pirate from taking over the earth. All the Peruvian flute bands were released, [a shot of that is shown; happy pan flute musicians] and drove the guinea creatures back to the Andes mountains. [shots from all over are shown, specifically South Park and New York City: pan flute bands are driving the guinea creatures away] Many people had died, but mankind had prevailed. [shots of the cleanup are shown. The Marshes are among the rescued] All over the world, survivors were found, living witnesses to the horror that had been seen."
220,12,11,Randy Marsh,"[trying to show a video clip to two firemen] Here here, look, look! [there's no picture] What the? [opens the camera to check it out] Oh- ohhh I didn't have a tape in it. [someone else took a picture of that, though]"
221,12,11,Craig Tucker,"The guinea pirate lived, but was taken to prison to live out the rest of his days. [the guinea pirate is taken to the Washington D.C. State Penitentiary strapped down to a flatbed truck. Next, a shot of Paris is shown: a Peruvian flute band plays at the Champs Elysées] And people all over the world learned to support their local Peruvian flute bands, and buy their CDs. For they protect us from the guinea creatures. As for me, I was returned home by Homeland Security. [Top Official 1 and Official 3 drop him off and smile at the joyful parents] My parents were sooo happy. [a shot of Craig looking at himself in the mirror, reflecting on the events surrounding his trip to Peru] I realized that we don't always have control over what happens to us. [a shot of Craig in bed, just after bedtime] We are but players on the stage of life. And I also learned to never listen when people come asking you for money. [a shot of the boys dressed as Mariachis standing at Craig's front porch talking to him; he slams the door in their faces.]"
222,12,11,Eric Cartman,That guy's an asshole!
223,12,11,Kyle Broflovski,"Yeah, what a dick!"
224,12,11,Kenny McCormick,(I fuckin' hate Craig!)
225,12,11,Top Official 2,"[enters the office without warning] Sir! Sir, we have a problem!"
226,12,11,New Director,What now?!
227,12,11,Top Official 2,"The former director of Homeland Security, that turned out to be a guinea pig? It attacked the guards, got out of its holding cell."
228,12,11,New Director,"My God, are you telling me..?"
229,12,11,Top Official 2,"Yes sir. It broke out of prison. [heavy footfalls are felt throughout Washington D.C. Car alarms go off, people scream, and a large guinea pig in striped prison uniform appears. The camera shuts off.]"
