,season,episode,character,line
240,6,2,Singer and backup singers,"The day is approaching to give it your best
You've got to reach your prime!

[Thumper and Stan do some Tai Chi on their skis, then Thumper has Stan ski down the hill blindfolded while he takes notes on technique and time]

That's when you need to put yourself to the test
And show us the passage of time
We're gonna need a montage (Montage)
A sports-training montage (Montage)

[The teen girl is reading to Stan from a book: Skiing for ""DUMBASSES."" Then Thumper spots Stan as Stan does barbells, then has him do a few more runs. The times aren't satisfactory.]

And just show a lot of things happenin' at once.
Remind everyone of what's goin' on. (What's goin' on?)

[Bulldozers show up at the youth center to knock it down, but a group of families shows up to protest the demolition. Next shot, the parents are still at those meeting, getting quite weary and tired]

And with every shot, show a little improvement
To show it won't take too long
That's called a montage (Montage)
Even Rocky had a montage (Montage)

[Stan skis down a little faster, and Thumper shows him how much he's improved. Tad is then shown polishing his skills, landing after a ski jump and receiving Heather into his arms. The girl reads to Stan some more, but Stan's fallen asleep. She rouses him and resumes the lesson]

In any sport, if you want to go
From just a beginner to a pro
You'll need a montage (Montage)
a simple little montage (Montage)

[she shows Stan a few pictures in her book. Next, Stan is skiing down the hill with bricks weighing his shoulders down. Kyle stands on a bluff with a picture of himself and Stan and looks wistfully at it and at K-13. Cartman rubs his finger into his ass and gives a sleeping Butters the Hitler again. Cartman stifles a laugh]

Always fade out (Montage) into a montage (Montage)

[Again, Stan skis down the hill with Thumper looking on. Now Thumper approves of the time. The instructor, the teen girl, and Stan look out at K-13 from a nearby hill, the camera at their backs]

If you fade out it seems like a long time (Montage) has passed in a montage (Montage)
Montage (Montage)

[The camera faces the trio now and zooms out slowly. Stan sets his skis down and steps into them, then skis down the slope. Fade out]"
241,6,2,Randy Marsh,"All the ad said was that we had to attend a thirty-minute meeting, right, and- and it's been a day and a half! These guys won't let us leave!"
242,6,2,Phl,"That's not true, officers, we said they could leave at any time."
243,6,2,Thin Cop,"All right, let me see if I got this straight. You two gentlemen are offering part-time limited liability [suddenly animated] ownership in one of your fabulous condos for the one-time price of eight thousand dollars?!"
244,6,2,Phil,That's right!
245,6,2,Fat Cop,Sounds to me like if anybody should be arrested it should be you people for passin' up such a great deal!
246,6,2,Thin Cop,"That's right, you're practically stealing condos at that price. ""Book 'em, Danno!"" [laughs. The parents look on, chagrined]"
247,6,2,Randy Marsh,"Oh, Jesus."
248,6,2,Linda Stotch,No! No!
249,6,2,Gerald Broflovski,"The police work for time-share, too? [the police draw their guns and aim at the parents]"
250,6,2,Phil,"[somewhat menacing, moves forward] The police, the mayor, the president of the United States. Perhaps now you see the severity of your situation. I think we shall all sit down... [backs up] and listen to the presentation."
251,6,2,Josh,[draws his own gun and aims] Sit! [the parents go to the table and sit on the chair]
252,6,2,Phil,"Now, you're probably asking yourselves... ""Can my time-share condo turn into a profit?"""
253,6,2,Josh,"""What kind of cash flow can I realize from my investment?"""
254,6,2,Phil,The answer might astonish you. For over ten years investors have seen their-
255,6,2,Resort Announcer,The powder is fresh and the stage is set for Tad versus Stan on the K-13!
256,6,2,Tad Mikowski and Two Friends,"This time you're not just gonna lose, you're gonna die!"
257,6,2,Kyle Broflovski,I can't lose another friend. First Kenny and now Stan? All I'm gonna have left are you two douches. [Cartman gives him an angry look]
258,6,2,Resort Announcer,Ready. Set. Go! [the crowd cheers and Tad takes off. Stan begins to ski]
259,6,2,Stan Marsh,Pizza... pizza... pizza...
260,6,2,Man In Yellow Jacket,Tad's got the lead.
261,6,2,Butters Stotch,"Come on, Stan! [Tad is shown zipping down the hill, Stan is still at the summit making his way down]"
262,6,2,Tad Mikowski and Two Friends,[stops near a tree] Haha. [pulls out a small saw hidden in the back side of his jacket] This should slow down Darsh a bit! [goes to the tree and starts sawing it off at the base. Stan has gone down the mountain some more]
263,6,2,Resort Announcer,[the crowd cheers the skiers on] And it looks like Tad is way out in front.
264,6,2,Tad Mikowski and Two Friends,"[finishes sawing the tree in two and laughs] Now, I'll win for sure!"
265,6,2,Kyle Broflovski,"Awgh, dude, I can't look. [closes his eyes and covers them with his hands  Tad is shown zipping further down the hill, Stan has left the summit]"
266,6,2,Tad Mikowski and Two Friends,"[stops and looks up the hill, then leaves. He returns with a bucket of sand and pours it out]Let's see what some sand does to your speed, Darsh! [leaves. Stan continues his run. Tad returns with more sand and pours it out]He doesn't stand a chance, now! [Stan reaches the fallen tree and climbs over it, then continues his run. Tad pours out even more sand]I'm gonna beat 'em! [tosses the bucket away and leaves]"
267,6,2,Resort Announcer,[as the crowd cheers] The race is half over and Tad is still out in the lead! [Stan is moving along nicely. Tad stops further down and pushes a large cage of hamsters onto the slope]
268,6,2,Tad Mikowski and Two Friends,"Heh, when Darsh skis by here, I'll let all these hamsters go. That should distract him just long enough for me to win the race!"
269,6,2,Teen girl,"[walks in] Oh, Tad."
270,6,2,Tad Mikowski and Two Friends,...What are you doing up here?
271,6,2,Teen girl,"Oh nothing. I just thought I could distract you. With these. [lifts up her jacket and top. Tad look and is unable to move as he groans at what he sees. Stan moves along in the background and passes Tad, who remains spellbound. Stan reaches the finish line and breaks it. The boys and the crowd cheer the victory and approach Stan. Another song begins to play]"
272,6,2,Kyle Broflovski,"Good job, dude!"
273,6,2,Stan Marsh,Thanks. [Tad reaches the finish line to see the celebration start without him. He takes off his goggles and throws them to the ground in anger]
274,6,2,Resort Announcer,"You did it, Stan! [Tad approaches Heather, who gives him the cold shoulder and walks away. Tad is crestfallen]"
275,6,2,Teen girl,"Thanks a lot, Stan. Now we're gonna be able to keep the youth center. [the crowd cheers louder, and the mechanic stops by]"
276,6,2,Mechanic,"Well, that does it. Looks like the spirits of the Wakichaw Indians can finally rest in peace. [three spirits rise from K-13 thanking Stan for setting them free.]"
277,6,2,Heather,"[walks up to Stan] Stan, I was wrong about you. Would you like to go out again? [Stan looks at her incredulously]"
278,6,2,Teen girl,"Go ahead, Stan. She's everything you ever wanted. [the parents arrive]"
279,6,2,Sheila Broflovski,"There you are, boys!"
280,6,2,Kyle Broflovski,"Mom, Dad!"
281,6,2,Stan Marsh,Where the hell have you guys been?!
282,6,2,Stephen Stotch,"Uh, we got a little held up at the time-share sales office."
283,6,2,Randy Marsh,"Yeah, but the good news is we finally came to our senses and bought some shares in a condo. So we all get to come to Aspen for two weeks every year!"
284,6,2,The Boys,[disappointed] Awwwwww!
285,6,2,Stephen Stotch,What's the matter? Didn't you boys like skiing? [the song is stopped abruptly]
286,6,2,Stan Marsh,No! We can't keep track of when you pizza and when you French-fries and when the hot-shot asshole skier takes your girl or if you're supposed to race him the first time or train first to beat him on the really difficult mountain so you can save the dorky but hot girl's youth center. Skiing sucks! [turns right and leads the other boys away]
287,6,2,Kyle Broflovski,"Yeah, what a stupid sport! [the parents turn left and follow the boys away]"
288,6,2,Thumper,[looks at the teen girl] I heard that you were the one responsible for making Tad lose the race. Thanks.
289,6,2,Teen Girl,Yeah. Well he really flipped when he saw these. [lifts up her jacket and top again and two creatures appear where her breasts should be]
290,6,2,Left Creature,"[softly, slowly] Quaid..."
291,6,2,Right Creature,"[softly, slowly] Start the reactor..."
