,season,episode,character,line
274,3,6,Stan Marsh,"Please, Sexual Harassment Panda. People listen to you. You have to get them to stop suing each other."
275,3,6,Petey,"But, I'm just a panda."
276,3,6,Kyle Broflovski,"No you're not, dude! You're a guy in a panda costume! [All mascots within hearing distance turn to see the cause of this outburst]"
277,3,6,Willy,"[rushes over to Petey and the boys] Heeyy, I'm a real worm, pal!!"
278,3,6,Kyle Broflovski,"Okay, sorry, sorry."
279,3,6,Eric Cartman,"You're-you're a worm. That's that's cool, that's cool."
280,3,6,Stan Marsh,"[to Petey] Okay, yyou are a panda. But being Sexual Harassment Panda isn't helping anyone right now. You used to use your panda powers to teach people about sexual harassment. But now you need to teach a new message. A new massage that people will find useful again."
281,3,6,Petey,What message?
282,3,6,Kyle Broflovski,That people shouldn't sue each other all the time.
283,3,6,Petey,...You know? You little cubs might just be right.
284,3,6,Willy,Yeah!
285,3,6,Petey,[jumps up and stands] Okay!
286,3,6,Gerald Broflovski,"Your honor, I'd like to make my closing arguments."
287,3,6,Kyle Broflovski,"[bursting in] Wait! [Stan, Cartman, and Petey follow]"
288,3,6,Mr Garrison,"Hey, it's Sexual Harassment Panda."
289,3,6,Stan Marsh,"[faces the audience] No! He's a whole new panda now, and he's got something to say."
290,3,6,Petey,"Hello, everyone. I'm Petey, the ""Don't Sue People"" Panda."
291,3,6,Jimbo,"""Don't Sue People"" Panda? [the bar patrons are present]"
292,3,6,Skeeter and Bar Patrons,[stands up] Hey! We don't take kindly to folks that don't sue people 'round here!
293,3,6,Barkeep,"Nuhow, Skeeter, he ain't hurtin' nobody."
294,3,6,Petey,"Listen to me: when you sue somebody, it hurts everyone. You sue for money, but where do you think that money comes from? From the schools, from taxes, from the state. From you. [The courtroom is silent, listening] There's no such thing as free money. When you sue somebody, you take money away from parks and schools and charities, and put it in your own pocket. And that makes me a sa-a-a-a-ad panda. [reactions are seen in the faces of various people in the courtroom, even in Gerald's face.]"
295,3,6,Bearded man,"I'm a sad panda, too."
296,3,6,Man 1,I'm a really sad panda. I didn't know we were doing all that damage. This is all that damn lawyer's fault! [people get angry at Gerald]
297,3,6,Man 2,[rises] Yeah! Let's sue the lawyer!
298,3,6,All,[rising] Yeah!
299,3,6,Gerald Broflovski,"[approaches Petey and the boys] No! Don't you see? Th-the panda's right. Boy, what a great message he has! When you sue people, you just end up causing a lot of problems for society. Uhwell, I've really learned something today. All I could see was the millions of dollars coming to me and I didn't care about where the money came from. Well, I'm no longer doing sexual harassment lawsuits in schools! They're too vague and two easily corruptible. Thank you, Sexual Harassment Panda!"
300,3,6,Petey,"""Don't Sue People"" Panda."
301,3,6,Gerald Broflovski,"Yeah, well, whatever, sooo let's... not... sue anyone again. Okay, come on, guys. Let's go get some ice cream!"
302,3,6,Petey Boys,Hooray!
303,3,6,Petey,"Pandas love ice cream. [Gerald, Petey, and the boys leave the courtroom]"
304,3,6,Judge Julie,"Well, seeing as we have no lawyers, I'm throwing the case out. Case dismissed! [gavels and leaves the bench]"
305,3,6,Skeeter and Bar Patrons,[people in the audience leave] Hey! We don't take too kindly to cases being dismissed around here!
306,3,6,Barkeep,"[passing by] God damnit, Skeeter, shut the hell up."
307,3,6,Petey,"Hello, cubs. I'm ""Don't Sue People"" Panda, with an important message for you! Lawsuits damage our society. I know it's tempting to make money, but just remember: that money has to come from somewhere. And usually, it ends up hurting a lot of innocent people. So, until next time, don't let frivolous sexual harassment lawsuits ruin our schools. Good-bye now. [walks off]"
