,season,episode,character,line
234,3,13,Pat Robertson,"Everyone, the Word of God is going around the world and all your help is so greatly appreciated. Eh-oo What we need now is an argon crystal laser. [the 900txl] Eh you see, an argon crystal laser can pierce thick space holes in a way that other lasers just can't. Send your money now. Uuh-I th-thank you."
235,3,13,Sally Struthers,[eating her way through a box of food relief] Onadonakami?
236,3,13,CIA Agents Connelly and Bill Sphinx,"Ms. Struthers, we understand that you have a ship of your own. One capable of interstellar travel."
237,3,13,Sally Struthers,"Chewmbacca vije dai gwo. [""Maybe I do, and maybe I don't.""]"
238,3,13,CIA Agents Connelly and Bill Sphinx,We need to use your ship to catch those boys. We will do anything for that technology.
239,3,13,Sally Struthers,"Juodo nakahobi? Ho ho ho ho. [""Why should I help you?""]"
240,3,13,CIA Agents Connelly and Bill Sphinx,"Ms. Struthers, if those Ethiopians make it to another planet, who will send money to your foundation? Without Ethiopians, you have no food."
241,3,13,Sally Struthers,Wo? Wo chaka gom??
242,3,13,CIA Agents Connelly and Bill Sphinx,"Oh, that won't be a problem, Ms. Struthers. We have... collateral. [steps aside and brings Kenny in]"
243,3,13,Kenny McCormick,"(Oh my God, I get it.)"
244,3,13,Sally Struthers,Oh ho ho ho ho ho ho. [a small creature pops out and laughs]
245,3,13,Sister Hollis,"I have the infidels in my sight. [the Marklar ship tries evasive maneuvers, but it is hit again.]"
246,3,13,Eric Cartman,Holy shit!
247,3,13,Ethiopians,[tossed to the other side of the cargo bay] Whoa!
248,3,13,Starvin' Marvin,Doye dondabuh. [swings the ship around and fires two blasts at the Missionary 600]
249,3,13,Crew,Aaah.
250,3,13,Sister Hollis,"Holy crap, they have photon torpedoes."
251,3,13,Pat Robertson,"Uhnow, our deflector shields are useless against phorton torpedoes, and we really need your support on this one, folks. Here at the 600 Club we need your money to spread the Word of Jesus, and build more advanced deflector shields for our galactic cruiser. Call now, and we'll give you this free pin. [a CBC logo pin]"
252,3,13,6 Crew,Aaah.
253,3,13,Stan Marsh,"You got 'em, Marvin."
254,3,13,Kyle Broflovski,"Yeah, now finish 'em off! [a huge junker comes up behind and fires at them]"
255,3,13,Computer,[female voice] Warning. Deflector shields failing.
256,3,13,Kyle Broflovski,Where did that come from??
257,3,13,Sally Struthers,"Ho ho ho ho. [the CIA agents stand behind her, and two other men are at the helm]"
258,3,13,CIA Agents Connelly and Bill Sphinx,Good! Now get them in our tractor beam! [the beam is activated and holds the Marklar ship in place. The Missionary 600 comes around and faces the Marklar ship]
259,3,13,Sister Hollis,"Now we've got 'em! [in the Marklar ship, the boys look at the screen...]"
260,3,13,Sally Struthers,Ho ho ho ho.
261,3,13,Eric Cartman,It's Sally Struthers!
262,3,13,Sister Hollis,"Well, it appears they'll be going back to Ethiopia, so we can go on to the aliens."
263,3,13,Kyle Broflovski,"Sorry, Marvin. We tried."
264,3,13,Eric Cartman,Wait. Ms. Struthers? Ms. Struthers!
265,3,13,Sally Struthers,Wo?
266,3,13,Eric Cartman,"Ms. Struthers, please. Just listen to me for one second. You started the Feed the Children Foundation for wonderful reasons: to help starving, helpless people who live in a rotten part of the world. Well, it's for those reasons we wanna help our friend Marvin now. [Sally looks moved]"
267,3,13,Sally Struthers,"Holna chewbacca? [""Because of me?""]"
268,3,13,CIA Agents Connelly and Bill Sphinx,"Ms. Struthers, don't forget the gift we gave you: the child in carbonite. [points. The camera pans over to a panel which shows Kenny encased in carbonite]"
269,3,13,Sally Struthers,"Dama doko nou na oh. [""Let him speak.""]"
270,3,13,Eric Cartman,"Ms. Struthers. You helped so many people, and you've taught us that helping people is what life is all about. All we wanna do is... be like you. [Sally considers Cartman's statements for a moment, then...]"
271,3,13,Sally Struthers,"Oh, foada! [""You're right!"" She presses a button, and the tractor beam switches off the Marklar ship and on the Missionary 600]"
272,3,13,6 Crew,[the bridge jerks a bit] Whoa! [the beam pulls the Missionary 600 closer to the junker.]
273,3,13,Eric Cartman,She bought it.
274,3,13,Stan Marsh,Sally Struthers is saving us!
275,3,13,Pat Robertson,"Uh, now, now, stay with me on this one, folks. Uh, Sally Struthers has a Tiberian junker [pictured in a window], which is uh the favorite ship of the Hutts, and she has trapped oureh, our our new CBC ship in an uh [struggling] poe-sitronic tractor beam. [a stage hand holds up this cue card that reads: Tractor Beam, so we're gonna need a Ionic Tractor Disruptor] Uh, so we're gonna need an ionic tractor disruptor. Now now, not a regular ionic di- tractor disruptor, but a negative ionic tractor disruptor to uh, help spread the Word of Jesus. [to Susan, softly] I don't have a fucking idea up here."
276,3,13,Stan Marsh,Now's our chance!
277,3,13,Eric Cartman,"Wait. I remember. It was the red button! [presses it, and the ship zooms away. The wormhole appears again and the ship head for it]"
278,3,13,Sister Hollis,They've opened the wormhole!
279,3,13,Kyle Broflovski,"It's pulling us in! [the junker and the Missionary 600 give chase. All three ships enter the wormhole, and all experience its warping effects.]"
280,3,13,Boys,Aaaah!
281,3,13,6 Crew,"Aaaah! [the ships rush out of the wormhole and into Alpha Seti VI, near the Marklar planet]"
282,3,13,Kyle Broflovski,Marvin... [everyone talks at once]
283,3,13,The Marklar,"Please, please, please. We are confused. You must explain one at a Marklar."
284,3,13,Sister Hollis,"Alien friend, we are here to spread the Word of Jesus. He died for your sins."
285,3,13,The Marklar,Who? Marklar?
286,3,13,Stan Marsh,"We brought Marvin and his people to live here, but these buttholes followed us."
287,3,13,The Marklar,Brought m- marklar??
288,3,13,Sister Hollis,"What is ""marklar""?"
289,3,13,The Marklar,Yyou're marklar; everyone and everything is referred to as marklar.
290,3,13,CIA Agents Connelly and Bill Sphinx,Doesn't that get confusing?
291,3,13,The Marklar,"Oh no. Watch this. Hey, Marklar!"
292,3,13,The Marklar,[in orange robe] Yes?
293,3,13,The Marklar,You see?
294,3,13,Kyle Broflovski,"[steps forward] Wait. Wait. I think I can explain this whole thing. Marklar, these marklars want to change your marklar. They don't want Marklar or any of these marklars to live here because it's bad for their marklar. They use Marklar to try and force marklars to believe they're marklar. If you let them stay here, they will build marklars and marklars. They will take all your marklars and replace them with Marklar. These marklar have no good marklar to live on Marklar, so they must come here to Marklar. Please, let these marklars stay where they can grow and prosper without any marklars, marklars, eh or marklars."
295,3,13,The Marklar,"Young marklar, your marklars are wise and true."
296,3,13,Sister Hollis,What the hell did he say?
297,3,13,Stan Marsh,"[hushed] Wow! Good job, dude!"
298,3,13,Kyle Broflovski,Thanks.
299,3,13,The Marklar,The marklars can stay!
300,3,13,Ethiopians,Wooo!
301,3,13,Boys,Alright!
302,3,13,Eric Cartman,"Alright,"
303,3,13,The Marklar,You marklars must leave.
304,3,13,Sister Hollis,But you will all burn forever in eternal hellfire. [she and the other woman are taken away]
305,3,13,The Marklar,"Yes, that's nice. Thank you for stopping by."
306,3,13,Stan Marsh,"Well Marvin, it was sure cool seeing you again."
307,3,13,Starvin' Marvin,Chak chak glika gm gm guchab mglup.
308,3,13,Kyle Broflovski,"No, we gotta go. Sally Struthers is gonna give us a ride back to Earth."
309,3,13,Sally Struthers,Bwo chaaga bi.
310,3,13,Boys,"[leaving] Goodbye, Marvin."
311,3,13,Starvin' Marvin,Chak chak m geteaub m * *.
312,3,13,Stan Marsh,Maybe we'll come and visit sometime.
313,3,13,Eric Cartman,"Yeah, and maybe Jesse Jackson will be President, heh."
314,3,13,Stan Marsh,Dude!
315,3,13,Eric Cartman,What? We're not gonna come visit him.
316,3,13,Stan Marsh,"I know, but you don't tell him that!"
317,3,13,Eric Cartman,"T'heh, whatever. [the Ethiopians chatter over their new home and head for the lake at the foot of the waterfall]"
