,season,episode,character,line
246,3,7,Skyler,"Salma Hayek? Whoa, she's hot. [goes into the woods to find her]"
247,3,7,Eric Cartman,"[dressed as James West, reaches the open door] Okay, it's clear. [Stands watch as Shelly makes her way inside]"
248,3,7,"""Salma Hayek"" Polly Prissy Pants","Over here! Please, come quick! [Skyler moves towards the voice]"
249,3,7,Eric Cartman,We don't have much time!
250,3,7,Shelly Marsh,This won't take me long!
251,3,7,Eric Cartman,Hurry up in there!
252,3,7,Shelly Marsh,I'm almost done.
253,3,7,Skyler,"Hello-o? Hello-o, Mrs. Hayek?"
254,3,7,"""Salma Hayek"" Polly Prissy Pants",Over here! Please help me! I am lost and I have no clothes!
255,3,7,Skyler,"[to himself] No clothes, right."
256,3,7,"""Salma Hayek"" Polly Prissy Pants",I'm over here! Please help me! I will reward you greatly!
257,3,7,Skyler,"Right here, Miss Hayek!"
258,3,7,"""Salma Hayek"" Polly Prissy Pants","Oh, please help me!"
259,3,7,Skyler,What the? [sees the Speak and Record bear and Polly Prissy Pants on the ground]
260,3,7,"""Salma Hayek"" Polly Prissy Pants",Please help me! I will give you tacos!
261,3,7,Skyler,"Dude, somebody tricked me! I'll make you pay for making me come out here, God dammit! [rushes home and enters] Stupid asshole stuffed animals trying to ruin my night! [gasps loudly. His guitar is in pieces and buried in kitty litter. Shards of wood are arranged to read ""King Turd"" in front of the neck of the guitar] My guitar! NOOOOO!"
262,3,7,Eric Cartman,That was sooo cool! I wish we could've seen his face!
263,3,7,Shelly Marsh,"[faces him at the door] Thanks for all your help, Eric. You know, as far as turds go, you're okay. [opens the door, and they both are shocked at what they see]"
264,3,7,Eric Cartman,Oh my God! [the orgy is well under way]
265,3,7,Shelly Marsh,They're having a cat orgy!
266,3,7,Eric Cartman,"You are all very bad kitties! That is a bad, bad kitty!"
267,3,7,Shelly Marsh,Your mom's gonna get home soon. We're gonna get busted!
268,3,7,Eric Cartman,"[gets the catnip and holds it up high] Come on, kitties. Outside. Come on. [points the way out, then goes towards the door. The cats follow] That's it. Come on, come on. [opens the door, only to find Skyler waiting for him] Uh oh."
269,3,7,Skyler,"You two ruined my career! I'm gonna get you! [Cartman throws the catnip at him and scores] Umph! [the cats jump on him] Ogh! Oh! Owey! Owwey! Duewy! Oh! [horror and then glee appear on the faces of Cartman and Shelly] Oh, you ripped my pants off! Oh my God! Oohh my Goodd!"
270,3,7,Shelly Marsh,"Come on! We've got to get the house clean before your mom gets home. [they go back inside and close the door] You know, Eric. It's kind of cool that two people who hated each other can be friends."
271,3,7,Eric Cartman,Yeah. I think we get along okay.
272,3,7,Liane Cartman,"[enters] Hi, kids. I'm home."
273,3,7,Eric Cartman,Heh. [all are afraid. Two cats hide behind Kitty] Mom! Uh I can explain. It was all Shelly's fault! She didn't watch the cat!
274,3,7,Shelly Marsh,No! It's Eric's fault. He let those cats in here.
275,3,7,Liane Cartman,"[holds on to the doorway] Oh, what a party that was! [walks towards the sofa] Hmm-hm-hm-hmm. Hmm-hm-hm-hmm. [Crashes onto it and falls asleep]"
276,3,7,Shelly Marsh,"Wow, she passed out."
277,3,7,Eric Cartman,"Luckily for us, my mom is a total lush."
278,3,7,Shelly Marsh,"Well, let's clean up the house. Looks like everything turned out o-kay."
279,3,7,Eric Cartman,That's how it goes in the Wild Wild West. [raps once more]
