,season,episode,character,line
233,10,2,Ike,I'm totally tripping balls. I'm totally tripping balls.
234,10,2,Eric Cartman,"[trying to shake Kyle to his senses] We have to get out of here! Now! [lightning strikes the house, which begins to burn. The lights begin to flicker, and the camera zooms in on Cartman, who continues shaking Kyle] Kyle! Kyle!! [the screen goes black]"
235,10,2,Network Anchor,"And now, the worst appears to be over. Last night's smug storm... has left thousands homeless. All across the Midwest, people are picking up the pieces. Cities like Denver and South Park are heavily damaged, but still all right. However, San Francisco, I'm afraid... has disappeared completely up its own asshole."
236,10,2,Stan Marsh,No...
237,10,2,Randy,"I'm sorry, Stan. I'm sorry your gay little song killed your friend."
238,10,2,Clyde,"Hey! Hey, Stan! You're not gonna believe it! You've gotta come see!"
239,10,2,Stan Marsh,What?
240,10,2,Clyde,It's a miracle!
241,10,2,Stan Marsh,Kyle!
242,10,2,Kyle Broflovski,Hey Stan.
243,10,2,Stan Marsh,"Dude, what happened?? [grins]"
244,10,2,Gerald,We don't know. We were all passed out and... next thing we know we just woke up on a bus heading here.
245,10,2,Mr Mackey,"It's like you had a guardian angel, m'kay? [Butters looks to Cartman for any reaction. Cartman puts his left index finger to his mouth, indicating that Butters should keep his mouth shut about this]"
246,10,2,Stan Marsh,"[gives Kyle a brief hug] Dude, I'm so glad you're not dead."
247,10,2,Richard Tweek,So I guess there's nothing left to do now but... rebuild.
248,10,2,Randy,"Yeah. First off, we're all gonna need new cars."
249,10,2,Gerald,"And let's make sure nobody gets a stupid hybrid, right? [everyone seems to agree and discusses it...]"
250,10,2,Kyle Broflovski,NO! Hybrid cars are a good thing!
251,10,2,Mr Mackey,"But hybrid cars are the leading cause of smug, m'kay?"
252,10,2,Kyle Broflovski,"Hybrid cars don't cause smugness, people do. [silent reactions all around] Look, hybrid cars are important. They may even save our planet one day. What you all need to do is just learn to drive hybrids and not be smug about it."
253,10,2,Randy,You mean... drive in hybrids... but not act like we're better than everyone else because of it.
254,10,2,Kyle Broflovski,Yeah!
255,10,2,Randy,I'm... [puts his hands over his lower belly] I'm not ready...
256,10,2,Gerald,I don't think I can do it either.
257,10,2,Mr Mackey,It's simply asking too much.
258,10,2,Randy,"Perhaps... one day... we can learn to drive hybrids without being smug about it, but for now... the technology is just too much for us."
259,10,2,Gerald,"Come on, everybody! Let's go buy wasteful gas guzzlers! [everyone likes the idea; they all disperse]"
260,10,2,Eric Cartman,"[walks up to Kyle] Well, looks like you're back for good, huh Kyle?"
261,10,2,Kyle Broflovski,"Yeah, I guess so."
262,10,2,Eric Cartman,"We just can't get rid of you, can we, you sneaky Jew rat!"
263,10,2,Kyle Broflovski,"Don't belittle my people, you fucking fatass! [turns and walks away angry]"
264,10,2,Eric Cartman,"Ah, that's better. [smiles]"
