,season,episode,character,line
192,10,9,Kyle Broflovski,You f-figured this thing all out?
193,10,9,Bearded Man,"Not me. My mystery-solving sons. Come on in, boys. [the Hardly Boys enter] My boys were researching who went number two in the urinal at your school when they discovered something odd, which gave them a clue."
194,10,9,"Frank and Joe Hardly, and their father",Gave us both a clue.
195,10,9,Mr Hardly,"That clue led them to a 9/11 conspiracy group party, where they got a lot more clues."
196,10,9,"Frank and Joe Hardly, and their father",I was getting a clue like every two minutes.
197,10,9,"Frank and Joe Hardly, and their father",I got such a raging clue that I almost shot clue goo all over Joe.
198,10,9,Mr Hardly,Those clues pointed out that all the 9/11 conspiracy theories could be disproven scientifically. And that's when Frank got his biggest clue.
199,10,9,"Frank and Joe Hardly, and their father",It was huuuge.
200,10,9,Mr Hardly,That all the 9/11 conspiracy Web sites are run by the government. The 9/11 conspiracy... is a government conspiracy.
201,10,9,Stan Marsh,Aw Jesus...
202,10,9,Kyle Broflovski,Why would the government want people to believe they caused 9/11?
203,10,9,Mr Hardly,"For a government to have power, they must appear to have complete control. What better way to make people fear them than to convince them they are capable of the most elaborate plan on earth?"
204,10,9,President George Bush,"[off-screen] That's quite enough, Hardly! [the camera shows him entering with his staff] Don't believe what he says, boys; we caused 9/11. [brings forth a manila folder] It's all right here in these secret documents, [hugs the folder tight] but you'll never get them. [turns around as he yawns, dropping the folder to the floor behind him. No one picks it up]"
205,10,9,Kyle Broflovski,I knew it! You didn't plan 9/11 and you really didn't shoot that guy!
206,10,9,President George Bush,"[dropping the act] Boys, you don't understand. People need to think we are all-powerful. That we control the world. If they know we weren't in charge of 9/11 then... we appear to control nothing."
207,10,9,Kyle Broflovski,Well why don't you just tell people the truth?!
208,10,9,President George Bush,"We do that too. And most people believe the truth. But one fourth of the population is retarded. If they wanna believe we control everything with intricate plans, why not let them?"
209,10,9,Mr Hardly,"Just one thing, Mr. President: How the devil did you know we were all here? [a close-up of Kyle. A gun appears next to his left temple. The camera moves clockwise as it refocuses on Stan, who's got the gun aimed at Kyle. Stan must have told the President]"
210,10,9,Stan Marsh,"How come you couldn't just go home, dude? That's all we had to do!"
211,10,9,Kyle Broflovski,Stan! What the fuck?!
212,10,9,Stan Marsh,It was all planned out!
213,10,9,Kyle Broflovski,You knew this whole time? Why?
214,10,9,Stan Marsh,Because it was me. I'm the one who took a dump in the urinal.
215,10,9,Kyle Broflovski,[backs away a bit] What??
216,10,9,Stan Marsh,The stalls were full and I didn't wanna miss recess! I didn't think it would turn into such a big deal!
217,10,9,Kyle Broflovski,So you blamed the government?!
218,10,9,Mr Hardly,"And the government was more than willing to take the blame, so long as it made them look responsible for 9/11!"
219,10,9,Stan Marsh,"[lowers his pistol] Oh man, now everyone's gonna know. Why did the stupid Hardly Boys have to be so good at solving mysteries?"
220,10,9,Kyle Broflovski,"So wait, wait: Stan took a dump in the urinal and he contacted the conspiracy Web site? But the conspiracy site was run by the government?"
221,10,9,Stan Marsh,Yuh.
222,10,9,Kyle Broflovski,"So then, who was responsible for 9/11?"
223,10,9,Stan Marsh,Whattaya mean? A bunch of pissed-off Muslims.
224,10,9,"Frank and Joe Hardly, and their father","[giggles] Yeah. What are you, retarded? [The President and his staff laugh heartily]"
225,10,9,Mr Hardly,"Well, it looks like this mystery is solved. It's time for the culprit to finally pay!"
226,10,9,Mr Mackey,"When you dook in the urinal, it's bad, m'kay! [Stan squirts some cleaning fluid onto the urinal basin] How would you feel... if somebody came into your home, m'kay, pulled down their pants and laid a big mud monkey right on your mom's face? [Stan laughs] Oh you think that's funny, huh?! Yeah, that's real funny!"
