,season,episode,character,line
241,8,1,Butters Stotch,[in a gravelly voice] Woof woof. [babbles incoherently. The veterinarian leads him towards a cell]
242,8,1,Vet,"Right over here. [opens the gate] Good dog. Come on. [guides Butters in] There you go, right in there. [closes the gate and locks it, then leaves] Goooood dog. [Butters babbles some more as a dog approaches from his left and sniffs. The dog pisses on him and walks away. Butters' voice rises in protest. Another dog approaches from his right, sniffs him, and pisses on him. Butters' voice rises a bit more in protest. A third dog approaches from his left, turns around, and craps on him. Butters stands up]"
243,8,1,Butters Stotch,Gaaaah!
244,8,1,Assistant,Somebody threw a ninja star in that poor puppy's eye?
245,8,1,Vet,"It just makes me sick how some people can treat animals. [pulls out a large syringe, quickly] Well, nothing we can do for it; let's put it to sleep, shall we? [they move back into Butters' cell] Here you go, pup. I've got a sweet dose of murder for you. What the? Blasted! He's escaped! ...Oh well, let's murder one of these other dogs."
246,8,1,Stan Marsh,"All right, the county fair's still open! [they spot Roger, shown in anime form, and approach his booth.]"
247,8,1,Roger,Can I help you boys?
248,8,1,Stan Marsh,We have come to return the weapons we purchased.
249,8,1,Roger,"Uh, sorry kids, ah I don't give refunds."
250,8,1,Kyle Broflovski,"Listen, douche! Our parents are gonna kill us, and you, if they found out that we bought these!"
251,8,1,Roger,I thought you told me your parents were dead.
252,8,1,Craig Tucker,[approaches with his boys] You guys! [the other boys turn around] You guys!
253,8,1,Stan Marsh,"What is it, Craig?"
254,8,1,Craig Tucker,It's Butters! We saw him!
255,8,1,Kyle Broflovski,Where?!
256,8,1,Craig Tucker,Right on the other side of the fairgrounds. He's just wandering around aimlessly.
257,8,1,Kyle Broflovski,Then it's not too late!
258,8,1,Stan Marsh,"Come on, Ninjas! [the boys make their way across the fairgrounds, but freeze in their tracks upon seeing the auction]"
259,8,1,Barker,"[in anime form] All right, folks, our next item up for bids is this lovely 19th Century lamp."
260,8,1,Stan Marsh,"Aw dude, crap. All our parents are there."
261,8,1,Craig Tucker,Butters is right on the other side.
262,8,1,Kyle Broflovski,We have to get past them!
263,8,1,Eric Cartman,All right. Looks like I have to use my power of invisibility to get by.
264,8,1,Kyle Broflovski,You have that power too?
265,8,1,Eric Cartman,"I told you, Bulrog has lots and lots of powers. Behold. [steps aside and holds his arms up. He sweeps them down and disappears. He them removes his clothes and gathers them into a pile] This way, I can move about the crowd of people undetected. [walks over to Stan and hands his clothes over] Here, hold this stuff for me."
266,8,1,Stan Marsh,"[softly] Good luck, Bulrog. [Cartman leaves, with only his footsteps indicating where he's going]"
267,8,1,Barker,"Now, this lamp comes from the estate of Edna and James Hollinger, who lived in upstate Wyoming. [Cartman, in normal form, appears, tip-toeing across the stage sideways. His penis can be seen.] It has a bronze finish and actual gold leaf along the base. This is a rare opportunity to own a classic antique. [Cartman changes his gait and tip-toes forward. The bidders look on] The lamp has been appraised by our auction staff at well over two thousand dollars."
268,8,1,Barker,"[Cartman changes his gait and tip-toes along sideways. One of the staffers notices Cartman and taps his colleague. The colleague looks and gasps] So we're gonna start the bidding at three hundred and seventy five. Do I, do I hear three hundred and seventy five? [Cartman continues tip-toeing along and the bidders sit motionless. Eight seconds pass before Cartman stops, realizing that the crowd can indeed see him.] Kid, what the hell do you think you're doin'? [Cartman looks around, knowing he's stuck.]"
269,8,1,Butters Stotch,"[wanders on stage] Haba, haba! Habahoaha! [babbles some more, then falls flat on his back again]"
270,8,1,Linda Stotch,[rises with her hands on her chest] Butters! [the auction staff encircles the boy]
271,8,1,Randy Marsh,What happened to him?
272,8,1,Sheila Broflovski,Oh my God!
273,8,1,Stan Marsh,"Oh, Jesus."
274,8,1,Kyle Broflovski,"Oh dude, we are gonna get it now."
275,8,1,Mayor McDaniels,"All right, people, we are all extremely upset over what's happened. [the boys' parents are present, with angry faces on] But let's try to speak one at a time."
276,8,1,Man 1,"Well, like the rest of you, I am shocked and appalled at what happened! I don't know if the parents are to blame or if it's the times we're living in, but something has to change!"
277,8,1,Townsfolk,[amid chatter] Yeah! I agree!
278,8,1,Gerald Brofloski,This is the worst thing that's happened in this town! [Butters is shown with a patch over his left eye and a long gauze wrapped around his head to keep the patch in place] The worst thing!
279,8,1,Man 2,"Yeah! I mean, there were children watching that auction! And when that little eight-year-old boy walked up and flashed his... penis! It was an outrage! [the adults go into an uproar again]"
280,8,1,Stan Marsh,What?
281,8,1,Eric Cartman,What?
282,8,1,Skeeter,"Not only that, the auction was televised on public access, so my little daughter watchin' at home saw the... penis! How am I supposed to explain that to her?!"
283,8,1,Sheila Broflovski,This is what happens when the moral fabric of society breaks down! [the adults go into an uproar again]
284,8,1,Mr Garrison,"[next to Mr. Mackey] You see the damage you've caused, Eric Cartman?! What were you thinking?!"
285,8,1,Eric Cartman,I told you it was a wardrobe malfunction. [the adults go into an uproar again]
286,8,1,Kyle Broflovski,"Dude, they don't care we knocked Butters' eye out with weapons?"
287,8,1,Stan Marsh,"Just run with it, dude."
288,8,1,Kyle Broflovski,"[looks around, then stands on his chair] Uh, yeah! I agree! Uh- my fragile little eight-year-old mind didn't know how to deal with what I was seeing. Cartman should be punished!"
289,8,1,Man,Yeah! [the adults go into an uproar again]
290,8,1,Eric Cartman,"Hey, fuck you, Kyle!"
291,8,1,Kyle Broflovski,"Yeah, I c- I can't believe it."
292,8,1,Stan Marsh,Yeah. I guess parents don't give a crap about violence if there's sex things to worry about.
293,8,1,Kyle Broflovski,[pulls out his nunchucks] So I guess this means we get to keep our weapons.
294,8,1,Stan Marsh,"[he and Kenny pull out their weapons] Yeah. Come on, ninjas. [they transform into their anime forms] We've got some more work to do."
295,8,1,The Boys,"[leap into a pose, and the image is frozen] Hya!"
