,season,episode,character,line
241,8,12,Mr Slave,"Sweetie, listen, I know you've done some ""partying"" in your private little rich life, but you don't even wanna know the kind of stuff I've done. I'm the real whore, and I'm telling you, it isn't great."
242,8,12,Paris Hilton,Oh yeah?! I challenge you to a whore-off!
243,8,12,Various Teen Girls,Ooooo!
244,8,12,Men,[popping up out of nowhere] Whore-off! Whore-off!
245,8,12,Official,"Ah, testing? Hello? [taps the mic a few times] Okay uh, welcome everyone. Uh, the South Park Chamber of Commerce is pleased to bring you the first annual ""Who Is The Biggest Whore"" showdown. [the crowd cheers]"
246,8,12,Bebe Stevens,Mr. Slave has no idea what he's in for.
247,8,12,Red,Paris is gonna rock his world.
248,8,12,Official,"Ah, I'm... not quite sure how we... start this competition off, but uh-"
249,8,12,Paris Hilton,[gets off her chair and walks over to the mic] I'll show ya how we start it off. [the music starts and she kisses him hard and grabbing his crotch]
250,8,12,Crowd,"Ohhh! [the girls are grinning, Wendy looks at the girls' reactions. Paris then has five men on stage with her, and one of them is licking her leg. Mr. Slave simply observes]"
251,8,12,Wendy Testaburger,"[approaches Stan and friends, and Mr. Garrison] What is Mr. Slave doing? He-he's just sitting there."
252,8,12,Herbert Garrison,"Give him time, Wendy. Give him time. [cheers him on softly] Come on, Mr. Slave."
253,8,12,Paris Hilton,[throws the men off] Back off! None of you losers are enough for me! [whips out a pineapple from behind her back and stuffs it up her vagina] Eeeaaagh. Oh yeah. Aaaargh. [some gasps] Tada! [the crowd cheers and fireworks go off]
254,8,12,Randy Marsh,"Oh, no she di'int. [the crowd continues cheering]"
255,8,12,Mr Slave,"[dusts himself off and coughs] Jesus. [takes off his pants and takes a running leap towards Paris. He lands on her head and proceeds to swallow her up through his ass, with each swallow accompanied by a grunt. The first swallow takes her head; the second, her chest; the third, her abdomen and lower back; and the fourth takes the rest of her body.] Ohoho, Jesus. [the girls are stunned at what they just saw. The adults, the boys, and Wendy all cheer]"
256,8,12,Herbert Garrison,"Now, that's a whore! [Stan and friends are still stunned. Mr. Slave goes back to his chair and puts on his pants]"
257,8,12,Bebe Stevens,"Wow, I guess Paris isn't such hot shit after all."
258,8,12,Mr Slave,"People, don't applaud me. I'm a dirty whore. [the crowd falls silent] Being spoiled and stupid and whorish is supposed to be a bad thing, remember? Parents, if you don't teach your children that people like Paris Hilton are supposed to be despised, where are they gonna learn it?! You have to be the- [feels something in his stomach] ooohooho, Jesus Christ. You have to be the ones to make sure your daughters aren't looking up to the wrong people."
259,8,12,Mr Stevens,"The homosexual is right. From now on, Bebe, you're going to dress like a little girl. [the crowd disperses and the girls walk up to Wendy]"
260,8,12,Bebe Stevens,"Wendy, we're sorry we called you names. Like not-stupid and not-spoiled."
261,8,12,Red,"Yeah, and I didn't mean to say you weren't a whore."
262,8,12,Wendy Testaburger,"That's okay, you guys. [Butters and his family are shown next]"
263,8,12,Stephen Stotch,"So-so that's it? No two hundred million dollars? Well, Butters, I hope you're happy!"
264,8,12,Butters Stotch,[turns right and walks away] I'm a bad bear. I'm a very bad old bear.
265,8,12,Stephen Stotch,You're a grounded old bear.
266,8,12,Paris Hilton,"Oh my God, it's so gross! Let me out of here! [a light comes on in front of her - it's the Frog King] What the fuck is that?"
267,8,12,Frog King,"Paris, you must find the way out of this place or you'll surely die."
268,8,12,Paris Hilton,What?
269,8,12,Frog King,"Make your way to the small intestine. There you will meet the Sparrow Prince, who can guide you to Catatafish. Now go, Paris Hilton. Make haste! [disappears]"
270,8,12,Singers,"[End of Stupid Spoiled Whore Video Playset. Some singers sing the following song as Paris begins her journey:]
A great adventure is waiting for you ahead.
Hurry onward Paris Hilton or you will soon be dead.
The road ahead is filled with danger and fright
But push onward, Paris Hilton, with all of your might.
Paris Hilton... Paris Hilton, Paris Hilton
Paris Hilton... Paris Hilton, Paris Hilton
Paris Hilton... Paris Hilton, Paris Hilton
Stupid whore!"
