,season,episode,character,line
345,1,10,Damien Thorn,"Well, goodbye, guys. It was nice getting to know you."
346,1,10,Stan Marsh,You're leaving already?
347,1,10,Damien Thorn,I have to. My dad's always on the move.
348,1,10,Stan Marsh,Wow. I feel kinda bad for that kid.
349,1,10,Kyle Broflovski,Yeah. Just when he was being accepted he has to leave and start over.
350,1,10,Stan Marsh,Parents can be so cruel. Don't they realize that what a child needs more than anything is security?
351,1,10,Liane Cartman,"More pie, hon?"
352,1,10,Eric Cartman,Eh... n-yeh. No... more... pie... eheh... seriously.
