,season,episode,character,line
211,9,7,Jimmy Valmer,What do I have? The weapon of comedy. So apparently the Chinese and the Japanese aren't getting along lately. Have you seen this? Have you heard about this?
212,9,7,Q Money,What?!
213,9,7,Jimmy Valmer,I'll tell you one thing: their food hasn't been getting along with my stomach for years.
214,9,7,Q Money,[laughs] That's pretty good.
215,9,7,Jimmy Valmer,Martha Stewart is out of jail. Have you seen this? Have you heard about this?
216,9,7,Q Money,"[laughs] Oh yeah. That's right, she is. [behind him, Nut Gobbler grabs a pipe and approaches him silently]"
217,9,7,Jimmy Valmer,She's apparently gotten real good with baking cakes with keys in them. [Q Money laughs heartily as Nut Gobbler reaches him. She knocks him out with one blow to the back of the head.]
218,9,7,Nut Gobbler,"Serves you right, you son of a bitch!"
219,9,7,Jimmy Valmer,"Nice teamwork, Nut Gobbler."
220,9,7,Nut Gobbler,"I can't believe you chased me all this way. You, you really care about me."
221,9,7,Jimmy Valmer,"Not really. You're just a hooker, and I need to get laid. The talent show could be over any minute."
222,9,7,Nut Gobbler,"That's good enough for me. [takes off her coat and poses enticingly] Take me to bed. [Jimmy approaches her, reaches out, and she falls back and lands with a thud on his arms and crutches. He then hoists her up and carries her down the stairs to the bottom floor of the building. He carries her out the door, through the group of hookers gathered to marvel at the sight, and towards a Ho-Tel. One admiring prostitute wipes away a tear. Jimmy carries Nut Gobbler through the door and onto a bed nearby. The door closes and the light goes out. All the other hookers keep applauding]"
223,9,7,Ike,"I have a Yankee Doodle sweetheart,She's my Yankee Doodle girl.[holds up some sparklers]'Ankee Doodle came to London,Just to ride the ponies,[throws them off and gets inside a small cannon next to him. The barrel rises until it's in launch position]I am da Yankee DoodleI am da Yankee DoodleI am da Yankee Doodle boy.[The cannon shoots him out and he lands clear across the stage. Some applause greets the performance. As the props are taken away, Ike takes off his hat and bows low to everyone, then puts on his top hat and walks off]"
224,9,7,Mrs Garrison,"Okay, very nice, Ike, thank you. All right, children, it looks like we have no more contestants, which means, the Talent Show is over! [the children cheer and Principal Victoria nudges a sleeping Mr. Mackey]"
225,9,7,Principal Victoria,"Mr. Mackey, it's over."
226,9,7,Mr Mackey,"Huh? [takes off his glasses and rubs his eyes] Oh oh oh, right."
227,9,7,Mrs Garrison,Now we will tally up the judges' scores and find out which act they hated the least.
228,9,7,Jimmy Valmer,"Hold everything! [Mrs. Garrison looks up. Jimmy has entered the gym and walks towards the stage. The audience watches him head up the steps] Mrs. Garrison, if you don't mind, I'll be taking that microphone.."
229,9,7,Mrs Garrison,"Okay, let's put our hands together for Jimmy Valmer. [some applause heads his way]"
230,9,7,Jimmy Valmer,"Wow, what a terrific audience. So apparently it's been exactly two years since the fall of Baghdad. Have you seen this? Have you heard about this? Just as B-Bush predicted, Baghdad fell, Iraq fell, Saddam fell. The only thing that didn't fall was ...the price of gas. [everyone laughs] I just read in the paper that China's protesting Japan. Have you seen this? Have you heard about this? Yeah, I guess in China you don't get to- [his penis gets hard again and he's surprised] You've gotta be kidding me."
