,season,episode,character,line
228,16,6,Stan Marsh,"...Kenny? Kenny! [Kenny has slid down on the seat, but his eyes are open]"
229,16,6,Narrator,Kenny McCormick has died of boredom.
230,16,6,Kyle Broflovski,"Oh my God, they killed Kenny! YOU BASTARDS!"
231,16,6,Eric Cartman,"No, not they, YOU! Look what your ziplining idea has done! You killed Kenny, YOU're the bastard!"
232,16,6,Kyle Broflovski,"IT WASN'T MY IDEA, IT WAS YOURS! YOU KILLED KENNY, YOU BASTARD!"
233,16,6,Stan Marsh,"[being interviewed] And finally, I couldn't hold it in anymore. I said ""Stop it!"""
234,16,6,Stan Marsh,[rises and walks a bit] Stop it! It was me! My idea.
235,16,6,Eric Cartman,You?!
236,16,6,Stan Marsh,"Four days ago, I came across a brochure for ziplining. [reaches into his pocket and pulls out the brochure for Backcountry Adventures, then looks at it for a few seconds] I thought it would be fun. I only acted like it was an idea we all came up with together. [Kyle and Cartman look at each other]"
237,16,6,Kyle Broflovski,"So you intended for us to go ziplining all along? Why, Stan?!"
238,16,6,Stan Marsh,"[turns to face them] If you signed up three friends, you got a free iPod Nano. [the camera pans down and sure enough, the offer is on the brochure cover: Sign up 3 friends and get an iPod NANO!!!]"
239,16,6,Kyle Broflovski,You sold us out?! For an iPod Nano?!
240,16,6,Stan Marsh,I had no idea ziplining would be so boring.
241,16,6,Eric Cartman,[points at Stan] You... You killed Kenny! [Stan begins to weep]
242,16,6,Kyle Broflovski,"You BAStard! You BAStard, Stan! [a shot of Kenny, then a shot of the three surviving boys crying. Kyle cries on Cartman's shoulder and Cartman comforts him]"
243,16,6,Kyle Broflovski,"[being interviewed] How many iPod Nanos is friendship worth? I guess, one."
244,16,6,Stan Marsh,"[being interviewed, crying] The hardest part about it is knowing you can't take it back. [wipes away the flowing tears] I mean, it was the fifth-generation Nano, so I can't trade it in anywhere."
245,16,6,Narrator,"But then, miraculously, the boys' prayers are finally answered. [the boys look around, startled]"
246,16,6,Eric Cartman,[being interviewed] It was a miracle. He came to save us and take us back home.
247,16,6,Eric Cartman,You came for us!
248,16,6,Kyle Broflovski,Mr. Hankey!
249,16,6,Stan Marsh,"Thank you. [whispers] Mr. Hankey. [Mr. Hankey has landed on the boat, at the top of an armrest]"
250,16,6,Mr Hankey,"[without the falsetto voice] Howdy ho, boys? Let's get you back home. [the boys are overjoyed at their good fortune]"
251,16,6,Eric Cartman,[being interviewed] We were saved. It was over.
252,16,6,Narrator,"After nearly four hours in the Colorado wilderness, the boys are finally going home. From the boat, the boys were airlifted aboard Mr. Hankey's magical helicrapter. [shown, the images are back to the cartoon form] In the four hours since they had left home, the boys had traveled so far that Mr. Hankey then had to fly them on his Seven Turdy Seven. [a jet plane made of poo] From there, it was only an hour ride back home on the Poochoo Express. [The ziplining Shockabra pictures are shown] Four friends, turn apart by tragedy [Kenny's image vanishes, leaving the forest background in place], would now start the long journey back to forgiveness. Kenny McCormick's remains were finally brought home to his parents. [Mr. Hankey delivers them personally. The parents are distraught] And the boys received treatment for their herpes. [two paramedics treat Stan and Cartman as Mr. Hankey looks on from above. Stan and Cartman focus on Mr. Hankey.]"
253,16,6,Eric Cartman,"[being interviewed] No, I didn't get herpes, I just had a cold sore."
254,16,6,Narrator,"[shots of the scenes being described are shown] Kyle Broflovski spent twenty seven days in the hospital having fecal matter removed from his nasal passages. Stan Marsh dedicated himself to raising awareness about the boredom risks of ziplining. [a lecture tour. Stan is shown on stage with a ""No on Ziplining"" logo] His awareness videos became so popular that Stan once again ended up jacking it in San Diego. As for Eric Cartman, [shown as a mountaineer] he refused to let the tragedy stop him from doing what he loves most. In just two weeks, he was back to drinking Diet Double Dew, defiant to dew the math."
255,16,6,Eric Cartman,"[being interviewed] It's diet, dude. Diet soda doesn't give you diarrhea. [takes a long sip]"
