,season,episode,character,line
240,13,1,Male Host,We understand the Jonas Brothers are getting ready. What's going on backstage must be exciting.
241,13,1,Mickey Mouse,"You'd better start talkin', haha! [Stan covers his face, then removes his hands] You'd better start talkin' right now, haha!"
242,13,1,Stan Marsh,We told you: we aren't working for another studio and there isn't a plan to sabotage your big night.
243,13,1,Kyle Broflovski,We came on our own 'cause our friend's purity ring is killing him.
244,13,1,Mickey Mouse,"You're lying! I'll cut you up, haha!"
245,13,1,Joe,You see? We were right about the purity rings! A nice Christian symbol can't be used for profit gains.
246,13,1,Kevin,We've all angered God.
247,13,1,Mickey Mouse,"[walks up to them with the chainsaw and revs it up against the boys, who cringe a bit] You think God is in control here, haha?! I am in control! I've been in control since the '50s in case you haven't noticed, haha! [throws the chainsaw aside] You three faggots are going onstage, and [points at the boys] YOU three faggots aren't going to stop me! NOBODY IS RUINING THIS EVENT!! Haha. I've worked too long and too hard to have anybody [Kyle notices he's next to the mic control desk and surreptitiously turns up the Mic 1 slider] fuck this up! [this causes Mickey's voice to be heard by the audience, who quiet down] Where would you be without me, Jonas Brothers? Haha. Your music sucks and you know it! Haha. It's because you make little girls' 'ginies tickle! And when little girls' 'ginies tickle, I make money! Haha. And that's because little girls are fucking stupid! Haha. And the purity rings make it okay to do whatever I want! Haha. Even the Christians are too fucking stupid to figure out I'm selling sex to their daughters! I've made billions off of Christian ignorance for decades now, haha! And do you know why?! [Cartman sees the curtain control button and presses it. The curtain rises revealing Mickey Mouse to the audience] Because Christians are retard-ed! Haha. [Mickey is facing the boys, so he doesn't notice anything happening behind him yet] They believe in a talking dead guy! Haha. [having heard his own echo, he blanches and turns around. He now sees the audience] Ohhh. Haha. Hello, folks."
248,13,1,Audience,BOOO!!
249,13,1,Mickey Mouse,"Now now, take it easy, haha. Here's the Jonas Brothers."
250,13,1,Joe,Come on guys. [the brothers turn left and walk offstage and the booing continues]
251,13,1,Mickey Mouse,No! Stop! Bring them back here!
252,13,1,Roadie,"It's over, Mr. Mouse. Everyone's tuning out."
253,13,1,Mickey Mouse,NO! NO GODDAMNIT! NO! SHUT UP! SHUT! UP! AAAAAAGH! [Mickey suddenly blows up to a height of some 40 feet and starts breathing fire on the audience. The girls scatter]
254,13,1,Father Maxi,[walks up to the TV and turns it off] That's it girls. No more Disney TV for a while.
255,13,1,Reporter,"Tom, the Disney Jonas Brothers 3D Television Special has failed, costing the Disney Company millions, and once again Mickey is pissed off and throwing a fit."
256,13,1,Mickey Mouse,"[floating over the city like a Thanksgiving Day float] Vengeance is mine! You are all ants and I am your destroyer, haha."
257,13,1,Reporter,"The Disney purity ring venture will now most likely prove a marketing bust, as Mickey returns to Valhalla to slumber and feed. [Kenny offers Tammy the Grey's Anatomy DVD, but she looks at her purity ring]"
258,13,1,Tammy Warner,"Aw Ken, look what we've become. We're way too young to be this boring."
259,13,1,Kenny McCormick,(I agree. Let's put in this DVD and watch Grey's Anatomy.)
260,13,1,Tammy Warner,"No! I don't want to watch Grey's Anatomy, Ken. Let's take off these rings, Ken."
261,13,1,Kenny McCormick,(Take off the ring? You can take off the ring??) [throws away the DVD] (Really?)
262,13,1,Tammy Warner,Let's take them off and just be kids again. There'll be plenty of time to wear rings and be boring and lame when we reach our late 30s and we're boring and lame anyway.
263,13,1,Kenny McCormick,(Yeah. Screw this crap!) [as one they take off their rings and throw them to the floor and hug each other]
264,13,1,Tammy Warner,Oh I feel better already!
265,13,1,Kenny McCormick,(Me too!)
266,13,1,Tammy Warner,What say you and me... go to T.G.I. Fridays?
267,13,1,Kenny McCormick,[jumps for joy] (Woo-hoo!!) [takes her hand and runs out the door with her]
268,13,1,Father Maxi,"And so, as we commit this young child to the earth, let us all be reminded that syphilis is still a deadly disease, and it can be caught even if using protection. This young boy learned the hard way that there's no guarantee... For the world of oral sex is a world..."
269,13,1,Eric Cartman,"[during the eulogy] I told him... A woman's mouth is the most germ-ridden place on earth, I said. Statistically the most unsafe place for a man to put his penis, I said."
270,13,1,Kyle Broflovski,"Well, now we know."
271,13,1,Eric Cartman,And knowing is half the battle.
