,season,episode,character,line
219,13,4,Sharon Marsh,[coming in from the kitchen with Shelly] What's going on?
220,13,4,Randy Marsh,"[thrusts the paper in Sharon's face] HA! Read it and weep, Sharon! No more queefing!"
221,13,4,Sharon Marsh,"[resigned] Well, ...congratulations, guys. Looks like you got us. Good job."
222,13,4,Randy Marsh,Aw come on. [tries to lighten the mood] Just because you can't queef anymore...
223,13,4,Sharon Marsh,"You really think women cared that much about queefing? Is that really what you think this has all been about? This has been about women having a little bit of fun for once at your expense. For just this one time we could be the immature ones to make you feel uncomfortable. But no, you just couldn't let us have that one little thing, could you? Because even though things are getting better for women, you still think of us as lesser people sometimes, and we always have to prove ourselves twice as hard. Congratulations, guys. [begins to sob] For getting your way... again. [she and Shelly turn around and head back to the kitchen]"
224,13,4,Stan Marsh,"Mom, we didn't mean... [he and Randy are stunned. Randy walks to the sofa and sits down.]"
225,13,4,Randy Marsh,"[exhales] Boy oh boy. I think we might have screwed up royal, Stan. [Stan follows him to the sofa and sits next to him]"
226,13,4,Stan Marsh,Yeah. We all got so caught up in how we felt that we didn't realize... women actually cared about something a lot deeper.
227,13,4,Randy Marsh,"Stan, let's call the guys together. Maybe we can make this right."
228,13,4,Randy Marsh,There's a time in our lives when we must listen to the oppressed.
229,13,4,Randy Marsh,And realize we've been keeping women down.
230,13,4,Stan Marsh,And realize we've been keeping women down.
231,13,4,Mr Mackey,They have power and they have courage.
232,13,4,Stephen Stotch,"And we must all stand by the belief,"
233,13,4,Butters Stotch,"And we must all stand by the belief,"
234,13,4,Gerald Broflovski,"That a woman is strong, and she has the right to queef."
235,13,4,Kyle Broflovski,"That a woman is strong, and she has the right to queef."
236,13,4,The Males,Fly free. Free to queef aloud; fly free. Let every queef show that you’re proud.
237,13,4,Randy Marsh,You face so many challenges to put an end to your grief.
238,13,4,The Males,"You are woman now, and you are free to queef."
239,13,4,Eric Cartman,It's time for equality. We must give them the respect they deserve.
240,13,4,Mr Garrison,They're just the same as you and me. Their rights must be preserrrr-r-r-rrrved.
241,13,4,The Males Randy,"Queef free (Queef free). Every woman has the right; queef free (Queef free). Let your queefing stars shine bright.You are woman, hear you roar (queef free), queefing too loud to ignore. Queef a little each day and let your soul take flight!
Ah-aaaaaaah-aaaaaaaaaaaaaaaaaaaaah, queef free."
242,13,4,Bishop,"For this reason a man will leave his father and mother and be united to his wife, and the two will become one flesh. [Katherine jumps up and queefs on him] Nooo! [the sisters laugh]"
243,13,4,Phillip,"Stop it, Katherine! This is a serious moment!"
244,13,4,Bishop,Therefore what God has joined together let no man- [Terrance jumps up and farts on him. Phillip laughs. Katie jumps up and queefs on Terrance]
245,13,4,Phillip,Aww. sick! [Terrance jumps up and farts on Katie. Phillip laughs. Katherine comes up and queefs on him. He farts on the bishop]
246,13,4,Bishop,"That's it! I now pronounce you farts and queefs! [the couples laugh as the bishop quickly leaves, Canadians laugh]"
