,season,episode,character,line
353,2,14,Stan Marsh,"Oh, my God! Ozzy Osbourne bit Kenny’s head off!"
354,2,14,Kyle Broflovski,You bastard!
355,2,14,Teen MC,And now here’s Ween!
356,2,14,Dean Ween,We're thrilled to be part of Chef Aid.
357,2,14,Gene Ween,Chef was the guy who told us to do a country album.
358,2,14,Dean Ween,"No, dude, that was Steve's idea."
359,2,14,Gene Ween,Oh. Then who's Chef?
360,2,14,Dean Ween,"I don't know, dude. I thought you knew him."
361,2,14,Gene Ween,"Oh, well. Anyways, here's our song!"
362,2,14,Ween,"Many colors in the homo rainbow
Don't be afraid to let your colors shine shiiiiiiiiiiine"
363,2,14,Mr Garrison,"Don't worry, Mr. Twig. Even though Mr. Hat rescued me from prison, I'm still going to stick with you."
364,2,14,Mr Twig,[In a French accent.] Did you love him?
365,2,14,Mr Garrison,It doesn't matter. He left me.
366,2,14,Mr Twig,Did you love him?
367,2,14,Mr Garrison,Yes.
368,2,14,Mr Twig,Then run to him.
369,2,14,Mr Garrison,But I feel like I'm making the wrong decision.
370,2,14,Mr Twig,"Love isn't a decision, it’s a feeling. If we could decide who we love, it would be much simpler, but much less magical."
371,2,14,Mr Garrison,"I'll never forget you, Mr. Twig. Thank you."
372,2,14,Teen MC,"And now, ladies and gentlemen, Mr. Elton John! Whoo!"
373,2,14,Elton John,"Thank you all for coming to help Chef. This is a song written by a very special little boy. I have no idea what his name is, but who the hell cares? Anyway, he wrote it for his girlfriend."
374,2,14,Elton John,"Wake up, Wendy!"
375,2,14,Elton John,Smell the coffee...
376,2,14,Kyle Broflovski,"Hey, that's your song for Wendy!"
377,2,14,Eric Cartman,"Ha-ha, you're a wuss."
378,2,14,Mr. Big Record Producer,"Ha-ha-ha-ha-ha! I win! You lose! Chef Aid is over, and you didn't raise near enough money to pay Cochran's legal fees. Ha-ha-ha-ha, I win!"
379,2,14,Narrator,"And what happened then? Well, in South Park they say..."
380,2,14,Narrator,Johnnie Cochran's heart grew three sizes that day.
381,2,14,Johnnie Cochran,"Wait! [Walks to Chef.] Mr. Chef, this music has really touched me. I like to take up your case, free of charge!"
382,2,14,Chef,You will?
383,2,14,Johnnie Cochran,I will.
384,2,14,Mr. Big Record Producer,No!
385,2,14,Johnnie Cochran,"We'll see you in court, Mr. Record Producer."
386,2,14,Mr. Big Record Producer,[Dropping to his knees.] Noooooooo!
387,2,14,Johnnie Cochran,"Ladies and gentlemen of this supposed jury, you must now decide whether or not to reverse the decision for my client, Chef. I know he seems guilty, but ladies and gentlemen, this..."
388,2,14,Johnnic Cochran,"...is Chewbacca. Now think about that for one minute. That does not make sense. Why am I talkin' about Chewbacca when a man's life is on the line? Why? I tell you why. I don't know. It doesn't make sense. If Chewbacca does not make sense, you must acquit!"
389,2,14,Johnnie Cochran,"Here, look at the monkey. Look at the silly monkey."
390,2,14,Reporter,"Chef, how does it feel to be a free man and finally have your name credited on the song, ""Stinky Britches""?"
391,2,14,Chef,"It feels great! I just can't find the words to thank all the artists who put on Chef Aid. And most of all, I want to thank the children."
392,2,14,Reporter,"So, what are you gonna do now?"
393,2,14,Chef,Get back to what's important. It's Tuesday. And means tomorrow is tuna casserole day.
394,2,14,Stan Kyle and Cartman,Hooray!
