,season,episode,character,line
244,19,9,Nathan,"I was just holding down the fort while you were away, Jim."
245,19,9,Jimmy Valmer,Writing headlines sponsored by PC Principal and the ads? How much did they pay you?!
246,19,9,Nathan,"Please, Jimmy, I'm just trying to survive here."
247,19,9,Jimmy Valmer,"Everyone's gonna know the truth, Nathan. We're getting a new edition of the school paper out by morning. Everyone's gonna know all about the ads. [Leslie punches him and he goes flying into a bookcase. She walks over and punches him five more times, then turns around and walks off to close the door. She returns and throws him up in the air. He hits the ceiling and falls to the floor. Leslie walks past Nathan, who laughs at Jimmy's misfortune]"
248,19,9,Leslie,Deal with him. [gets on the computer and starts searching]
249,19,9,Jimmy Valmer,Leslie... I thought we were b-b-b-besties.
250,19,9,Nathan,"Hey there, big man. Editor of the school paper, huh? You still don't even know half the story."
251,19,9,Caitlyn Jenner,It's clear.
252,19,9,Mr. Garrison,Where is everybody? I thought the news said they're on a hunger strike.
253,19,9,Randy Marsh,It doesn't make sense. Someone's always here.
254,19,9,Principal Victoria,Take a look at this! [the other three adults walk over to see what she's seeing - the same State Farm ad of PC Principal and Leslie as before]
255,19,9,Mr. Garrison,What the hell?
256,19,9,Principal Victoria,It looks like he was researching this. You see this news story?
257,19,9,Mr. Garrison,"If this is true, then... PC Principal's trying to help."
258,19,9,Randy Marsh,Click on that. What is that?
259,19,9,Mr. Garrison,"No, click out of that. What is this?"
260,19,9,Mr. Garrison,"So, so then, so then Caitlyn says ""Look bitch, you're married to Bill Clinton. If anyone should be afraid of AIDS, it's you."""
261,19,9,Caitlyn Jenner,That stupid bitch had it coming. [they all laugh]
262,19,9,Mr. Garrison,"Oh God, I love you, Cait. We're so gong to win the primaries. [they all laugh]"
263,19,9,Randy Marsh,"Whoa, whoawhoawhoa wait wait wait. What, what were we doing again?"
264,19,9,Kyle Broflovski,Leslie.
265,19,9,Leslie,"You're trying to find out what's going on, right? But your friend is standing in your way?"
266,19,9,Kyle Broflovski,How do you know thi-?
267,19,9,Leslie,"I can show you what's going on, Kyle. But you have to trust me. [holds out her hand] What's the last four digits of your Sosh?"
268,19,9,Kyle Broflovski,"2692 [They shake hands, and he leaves the house with her]"
