,season,episode,character,line
182,19,8,PC Principal and his Bros,"I came to this town really thinking I could make a difference. I've been called a bigot towards persons with disabilities. I've been called... [stops for an instant] Pussy-crusher, because of the behavior of a very few individuals in my PC frat. [Nathan is shown] Jimmy Valmer is off the school newspaper. I want you to take over."
183,19,8,Nathan,Ooooh boy!
184,19,8,PC Principal and his Bros,And I will be reviewing your paper to make sure nobody is ever attacked the way I was again.
185,19,8,Nathan,I think this will be the beginning of a beautiful friendship.
186,19,8,PC Principal and his Bros,"Jimmy almost made me lose confidence, but I know who I am. I know what I am!"
187,19,8,PC Bro 11,"[voice only] Dude! Bro! [runs into the principal's office] Oh, bro, I went online to read a news story about immigrants being discriminated against."
188,19,8,PC Principal and his Bros,Yeah?
189,19,8,PC Bro 11,PC Principal what's on the screen.]
190,19,8,PC Principal and his Bros,"Dude! [stands up and whips his glasses off] What the fuck, bro?"
191,19,8,PC Bro 11,"What does this mean, dude?"
192,19,8,PC Principal and his Bros,"Bro! What the fuck, bro?!"
193,19,8,Leslie Meyers,"Do you like our school, Jimmy."
194,19,8,Jimmy Valmer,"Uh yes, Leslie, I like our school very much."
195,19,8,Leslie Meyers,I like our school too. I like the kids who go there.
196,19,8,Jimmy Valmer,"Uh huh. I'm starting to wonder something about you, Leslie."
197,19,8,Leslie Meyers,"I'm starting to wonder about you. I mean, you seem like a nice kid, but... don't you feel like you could be happier? [this sets off an alarm in him]"
198,19,8,Jimmy Valmer,Holy. Shit.
199,19,8,Leslie Meyers,What?
200,19,8,Jimmy Valmer,Can you excuse me for a moment?
201,19,8,Leslie Meyers,Okay. [Jimmy leaves the room for a moment]
202,19,8,Agent,Well Jimmy? What do you think?
203,19,8,Jimmy Valmer,[looks over his shoulder] Does she know she's an ad?
204,19,8,Agent 3,He can spot them.
205,19,8,Jimmy Valmer,Does she know she's an ad?!
206,19,8,PC Principal and his Bros,"[softly, looking truly victimized now] What the hell is going on, bro?!"
207,19,8,PC Bro 19,[stops by and checks in on him] Bro?
208,19,8,PC Principal and his Bros,"Bro, what the hell is going on, bro?"
209,19,8,Principal Victoria,"If we're going back, remember: we don't know who we can trust."
210,19,8,Mr Garrison,"If they wanna mess with my town, I'll fuck every last one of them! Let's do this!"
211,19,8,Caitlyn Jenner,"Buckle up, buckaroos! [revs up the motor and drives off running over several people]"
